edition,type,subtype,winner,title,director,year,country,premiere,competition,casting,distributor,producer,screenplay,soundtrack,subtitles,audio,length,genre,Fonction Guest,IMDB,Lien IMDB,original_title,URL Poster,text_fr,text_nl,text_en
1998,movie ,,,DARK CITY,Alex Proyas,1997,USA,,,"William HURT,
Kiefer SUTHERLAND,
Jennifer CONNELY,
Rufus SEWELL, Richard O’BRIEN",,,,,,,100',"Fantasy, Mystery, Science-Fiction",,,"https:,,www.imdb.com,title,tt0118929,?ref_=nv_sr_srsg_0",,,,,"John Murdoch awakens alone in a strange hotel to find that he is wanted for a series of brutal murders. The problem is that he can’t remember whether he committed the murders or not. In fact, most of his memories have completely vanished, and for one sickening moment he is convinced that he has gone stark raving mad. As Murdoch seeks to unravel the twisted riddle of his identity, he is drawn deeper and deeper into the murky city where he stumbles upon a fiendish underworld controlled by a group of ominous beings collectively known as The Strangers. These shadow-like figures possess the ability to stop the time and alter the city and its inhabitants - a bizarre, transmogrifying process known as Tuning. Through some evolutionary quirk, Murdoch is also imbued with this power and thus, he alone is able to resist The Stranger’s control over his mind. And for that, he must be destroyed.
Dark World is a noir-ish tale set in a ’30s-’40s-style “City That Never Was,” which features murder, mayhem, mind control and malevolent presences. The film is produced by Andrew Mason and directed by Alex Proyas - both having fulfilled those duties on the equally dark The Crow. The casting of Rufus Sewell (Carrington) and William Hurt (Michael, Smoke), as a man accused of a series of murders and the detective searching for him, rounds out the gray color scheme."
1998,movie ,,,DEEP RISING,Stephen Sommers,1997,USA,,,"Treat WILLIAMS,
Famke JANSSEN,
Kevin J. O’CONNOR",,,,,,,106',"Action, Adventure, Horror ",,,"https:,,www.imdb.com,title,tt0118956,?ref_=nv_sr_srsg_0",,,,,"With its lights gleaming off the quiet ocean surface, a magnificent, state-of-the-art luxury cruise liner cuts through the night. On board, the richest of the rich toast to their voyage, and to the Titanic-like marvel on which they sail. But approaching the giant vessel is a band of mercenaries, armed to the teeth and primed for a high-tech pirating scheme on the liner that would be the crime of the century. But beneath the human intrigues on the surface, is a monstrous underwater creature that has altogether different plans...
Deep Rising is a colossal sci-fi action-adventure which can best be described as a cross between Aliens and The Poseidon Adventure. With a gripping and suspenseful storyline, Deep Rising combines action and horror in a bone-chilling injection of pure adrenaline. It’s written and directed by Steve Sommers (The Jungle Book) and produced by Larry Mark (Working Girl, Sister Act II). The creatures are animated by Roy Bottin (Robocop, Seven, Total Recall)."
1998,movie ,,,DR. CHANCE,François-Jacques Ossang,1997,"France, Chili",,,"Elvire, Pedro HESTNES,
Marisa PAREDES,
Joe STRUMMER, Feodor ATKINE, Stéphane FERRARA,
Francisco REYES, Lionel TUA",,,,,,,97',"Crime, Drama ",,,"https:,,www.imdb.com,title,tt0118997,?ref_=nm_flmg_dr_6",DOCTEUR CHANCE,,,,"Dr. Chance is the story of a young man who lives in a South American capital. His name is Angstel, a combination of Angst (fear) and Angel. He’s part dandy, part desperado, and he’s always drifting between two extremes: indifference and total commitment. One evening, Angstel is waiting for Zelda in front of a movie theatre where Murnau’s Aurore is playing. She doesn’t show up. Angstel sees this as an act of betrayal. His last chance for love and salvation has gone up in smoke. Ancetta, a dancer at “Wasted”, runs into Angstel in the street. He tosses up a coin and wins: he buys her for a fistfull of fake banknotes. During one turbulent night, these two lost souls will fall in love with each other. When dawn breaks they flee the city in a car loaded with weapons and fake money.
Popular with his rock’n roll band Messagero Killer Boy, F.J. Ossang also turns out to be a great novel writer. In 1984 he writes and directs his first film “L’Affaire des divisions Morituri”, followed by “Le Tresor des Iles Chiennes” in 1990. His third film, “Dr. Chance”, is a stylish and atmospheric road movie, starring Pedro Hestnes as Angstel, Marisa Paredes as his possesive mother and Stephane Ferrara as a hired killer."
1998,movie ,,,DRIVE by Steve Wang,Steve Wang,1996,USA,World,,"Mark DACASCOS,
Kadeem HARDISON,
Brittany MURPHY,
John PYPER-FERGUSON,
Tracey WALTER, Masaya KATO",,,,,,,100',"Action, Adventure,Science-Fiction",,,"https:,,www.imdb.com,title,tt0116147,?ref_=nm_ov_bio_lk2",,,,,"San Fransisco, sometime in the not-so-distant future: a freighter arrives from Hong Kong with a mysterious passenger named Toby Wong aboard. He is running from the shadowy Leung Corporation and seeking freedom in the West. But the moment Toby hits the docks, he is ambushed by a team of brutal thugs headed by the icy Vic Madison and his junk food guzzling pal Hedgehog. Under hot pursuit, Toby grabs a hapless, unemployed barfly named Malik Brody and forces him at gunpoint to drive to Los Angeles. In the wild chase that follows, Toby drags Malik kicking and screaming through a gauntlet of brutal mayhem. Toby and Malik are shot at, beaten up, roadblocked and captured. But even handcuffed together, Toby manages to fight their way out, unleashing one devastating martial arts onslaught after another on Madison’s thugs. When Malik learns the secret of Toby’s awesome powers and the reason he is being hunted, he realises there is only one thing left to do: to put his foot on the gas pedal and drive.
Laced with exciting stunt and fight sequences, Drive is a futuristic action adventure starring Mark Dacascos (Crying Freeman, The Island of Dr. Moreau, Only the Strong), Kadeem Hardison (A Vampire in Brooklyn, School Daze) and Brittany Murphy (Clueless). Drive is directed by Steve Wang (The Guyver, Kung Fu Rascals) from a script by Scott Philips."
1998,movie ,,,THE ELIMINATOR,Enda Hughes,1996,"UK, North Ireland",,,"Barry WALLACE,
Michael HUGHES, Mik DUFFY, Edward HUGHES,
Paul McAVINCHEY,
Tom LENAGH",,,,,,,86',"Action, Comedy",,,"https:,,www.imdb.com,title,tt0337999,?ref_=nm_ov_bio_lk2",,,,,"Irish John O’Brien has been captured by British Intelligence, who also confiscated the computer discs he was working on. From these designs, his captors have constructed The Viper - the Vehicle for Interception, Protection, Elimination and Reconnaissance - a terrifying, turbocharged weapon intended for urban warfare. Hawk, the military commander of the Organisation, an illegal group based in Northern Ireland, orders Stone, who is better known as “the Eliminator”, to infiltrate the base, rescue O’Brien and bring back The VIPER. After a series of breathtaking action sequences, and one of the most spectacular car chases ever filmed, Stone and O’Brien flee the base and return to Ireland - but The VIPER is destroyed. Back home, Hawk is outraged that Stone should return without The VIPER, and in a treacherous frenzy, kills his former comrade. But vengeance will not rest in peace. Stone returns from the dead and launches a tense and bloody game of cat-and-mouse against Hawk and The Organisation which double-crossed him.
In the tradition of low budget successes like The Evil Dead, Bad Taste and El Mariachi, The Eliminator is Ireland’s first high-octane, non-stop action, low-budget spoof thriller. Made by and starring a group of remarkably enthusiastic complete unknowns, The Eliminator bears little resemblance to any other film ever made about Northern Ireland. 22-Year-old director Enda Hughes is a true movie addict who has been making short films on Super 8 for years. After saving up money he’d made deejaying in a nightclub, he got his cousin Denis O’Hare doing all the special effects, production design and stunt work while his brother Michael did the casting and also starred in the movie."
1998,movie ,,,EVENT HORIZON,Paul Anderson,1997,USA,,,"Laurence FISHBURNE, Sam NEILL, Kathleen QUINLAN, Joely RICHARDSON, Richard T. JONES,
Jack NOSEWORTHY, Jason ISAACS, Sean PERTWEE, Peter MARINKER",,,,,,,96',"Horror, Science-Fiction, Thriller ",,,"https:,,www.imdb.com,title,tt0119081,?ref_=fn_al_tt_1",,,,,"The year is 2040. The experimental deepspace ship Event Horizon disappears beyond Neptune. Seven years later, the search-and-rescue vessel Lewis & Clark is dispatched to Neptune under the command of Captain Miller, with Event Horizon designer Dr William Weir on board. En route, Weir explains that the Event Horizon was the first spaceship designed for faster-than-light travel, a concept that they all thought was physically and technologically impossible. The ship disappeared without a trace when the gravity drive, her revolutionary engineering process, was engaged. The Event Horizon has recently resurfaced, issuing a single harrowing distress signal to which the Lewis & Clark is now responding. Orbiting Neptune, the Lewis & Clark docks with the Event Horizon. The older ship shows no sign of life despite extraordinary bioscope readings. Distorted video images in the ship’s log suggest that the crew
perished in hellish torment.
Written by Philip Eisner and produced by Laurence Gordon, Lloyd Levin and Jeremy Bolt, Event Horizon stars Laurence Fishburne (Othello, Bad Company) as Captain Miller and Sam Neill (Sirens, Jurassic Park, The Piano) as the brilliant Dr. William Weir. The director is young Briton Paul Anderson (Shopping), who made his U.S. debut with the box-office hit Mortal Kombat."
1998,movie ,,,"FAIRY TALE, A TRUE STORY",Charles Sturridge,1996,USA,,,"Florence HOATH,
Elizabeth EARL, Paul McGANN, Phoebe NICHOLLS,
Harvey KEITEL, Peter O’TOOLE, Tim McINNERNY, Bob PECK, Anthony CALF, Chris WILLIAMS, Anton LESSER",,,,,,,99',"Drama, Family, Fantasy ",,,"https:,,www.imdb.com,title,tt0119095,?ref_=fn_al_tt_1",,,,,"For almost a century, children and secretly many adults have answered Peter Pan’s entreaty to save the fairy Tinkerbell with resounding applause. In the dark of the theater, in that one magical moment, it is a very powerful thing to believe. But what happens when that belief is carried into the light of the real world? In the summer of 1917, in the midst of the Great War, ten year-old Frances Griffiths sat clapping furiously in her seat as Peter Pan flew across the stage at the Duke of York Theater in London. Just for those wondrous few minutes, she was transported away from the reality of her missing soldier father and her new life as a war orphan and into an exuberant world of innocence and hope. Frances could not have known then that in a few short months she and her cousin Elsie would bring others hope as they stood at the center of one of the 20th centuries most incredible controversies, a controversy that would have some of the greatest minds in the world, including Sir Arthur Conan Doyle and Harry Houdini, wondering if they too should dare to believe in fairies.
Director Charles Sturridge (Gulliver’s Travels) has fashioned an elaborate film fantasy from this real-life tale. He tracked down the house where the girls had lived and found the son of Elsie Wright, played in the film by Florence Hoath. The son gave Sturridge access to all of Elsie’s notebooks, papers, the family photograph albums, and her autobiography. Peter O’Toole worked with Sturridge on Gulliver’s Travels, and the director felt he would be just right for the part of Arthur Conan Doyle, who was a tall, patrician, successful upper middle class Englishman. For Houdini, Sturridge selected Harvey Keitel (The Piano, Reservoir Dogs, Pulp Fiction)."
1998,movie ,,,FLUBBER,Les Mayfield,1997,USA,,,"Robin WILLIAMS,
Marcia Gay HARDEN, Christopher McDONALD, Raymond J. BARRY,
Clancy BROWN, Ted LEVINE",,,,,,,93',"Comedy, Family, Science-Fiction",,Enfats Admis,"https:,,www.imdb.com,title,tt0119137,?ref_=fn_al_tt_1",,,,,"Professor Phillip Brainard is a man so lost in thought that he appears, at times, not to pay attention. He’s even forgotten two dates to marry his sweetheart Sara. But then this guy’s got a lot on his mind. He’s working with his high-voltage, over-amorous flying robot assistant, Weebo, on an idea for a substance that’s not only a revolutionary new source of energy, but may well be the salvation of his financially troubled Medfield College, where his beloved Sara is the president. Late on the afternoon of his third attempt at a wedding, all of Professor Brainard’s hard work in the lab comes together when he creates a miraculous goo that when applied to any object, cars, bowling balls, even people, enables them to fly through the air at remarkable speeds. The stuff defies gravity and looks like rubber. What is it? Flubber!
In 1961, Walt Disney’s The Absent-Minded Professor was the most popular film of the year. The sparkling comedy-fantasy starring Fred MacMurray had the unmistakable Disney magic touch, perfectly blending humor, action and rollicking fun for all ages. Now, Flubber stars the incomparable Robin Williams as the new absent-minded professor. Director John Hughes maintained the spirit of the original film, but refreshed it for today’s audiences."
1998,movie ,,,GIVE ME SOMETHING,Héctor Carré,1997,Spain,,,"Nancho NOVO, Chete LERA, Rosa MORALES,
Nathalie SESENA,
Evaristo CALVO, Andres LIMA, César SANCHEZ, Sonia JAVAGA, Dorotea BARCENA",,,,,,,86',"Drama, Thriller ",,,"https:,,www.imdb.com,title,tt0118922,?ref_=nm_knf_i2",DAME ALGO,,,,"Benigno has just been released from jail. He’s an intelligent, handsome young man but he’s homeless and he’s an orphan. He’s fed up that no one pays attention to him and decides to get attention by force. Taking advantage of the presence of a television team, Benigno guns down a nun, sister Teresa. Marisol, the most popular presenter at Tele-Local, the local television station, is covering Benigno’s story. She talks too much and she wears too much make-up but she would sell her own mother to become a star.
Dame Algo is a new Spanish comedy by director Hector Carre. Carre has ample experience as an assistant director in cinema and advertising. He has worked with such filmmakers as Terry Gilliam and Steven Spielberg. Nancho Novo, known from his leading role in Julio Medem’s “La Ardilla Roja”, stars as the charismatic Benigno. Nathalie Sesena is a muse for many Spanish shortfilmmakers. She starred in Alex de la Iglesia’s El dia de la Bestia and now plays Marisol."
1998,movie ,,,HEMOGLOBIN,Peter Svatek,1996,Canada,,,"Rutger HAUER, Roy DUPUIS, Kristen LEHMAN,
Jackie BURROUGHS",,,,,,,94',Horror ,,,"https:,,www.imdb.com,title,tt0119279,?ref_=fn_al_tt_1",BLEEDERS,,,,"Three centuries ago, in the age of Vermeer, the consumptive, hedonistic beauty, Eva Van Daam, has taken her own twin brother as her lover. Ostracized from Holland, the Van Daams flee to a remote, craggy island off the coast of Maine, to which we are introduced in the present through the beautiful Kathleen and her husband, John. They have journeyed to the island of John’s birth in a desperate attempt to find a cure of the blood disease that is killing him. When John has a seizure, Kathleen rushes him to Dr. Marlow, the only doctor on the island. Reluctantly, the doctor gets drawn into John’s case and the enigma of the island. He discovers that John might be related to the infamous Van Daam clan...
In the grand tradition of such fantasy classics as The Island of Dr. Moreau and the Time Machine, the creators of the modern sci-fi blockbusters Alien, Aliens and Total Recall have crafted a chilling tale of human evolution gone horribly wrong. Peter Svatek (Witchboard III, Contagion 2009) directed Rutger Hauer (Blade Runner, Ladyhawke) as Dr. Marlow and Roy Dupuis (Screamers) as John."
1998,movie ,,,HOTEL MORGANA,Martin Hansen,1996,Germany,,,"Burghart KLAUBNER,
Ingeborg RIEHL,
Anna BOTTCHER,
Günter KUTEMEYER,
Andreas PEREZ, Martin HANSEN, Friderike WAGNER",,,,,,,65',,,,,,,,,"Hotel Morgana, a simple inn on the northern edge of the town. Whoever spends a night here falls under the spell of nightmarish visions. Are they the guests’ own fantasies or is it the constricting atmosphere of the old house which draws these fantasies from the inhabitants. In four episodes, the film recounts the extraordinary experiences of the hotel guests. A young man in room 16 notices that the mysterious, beautiful woman in the lift lives in the room next door. In his obsessive attempts to get a glance of her, he is surprised by a monstrous being. Down at the reception, the old landlord examines the contents of the hoover bag. In his 38 years on night duty he has amassed a curious collection of little things that the guests have lost in the hotel. In room 25, Christine, the chambermaid, meets a famous popsinger. The brief flirt with the star arouses unforeseen powers in her. But her high spirits spell her downfall. A new guest has arrived in room 34. Unexpected disturbances by other guests, the landlord’s wife and strange insects make him pack his bags with the intention of leaving. But that isn’t so easy in Hotel Morgana.
Hotel Morgana is the first long feature film of German director and screenwriter Martin Hansen, who worked on several other film-projects as an editor or as a cameraman. In four episodes Hansen outlines the strange atmosphere of the small town Hotel Morgana. A film for adventurous travellers."
1998,movie ,,,IS THAT YOU?,Genji Nakamura,1998,Japan,World,,"Miyuki MATSUDA,
Masato FURUOYA,
Masato UCHIYAMA,
Kyusaku SHIMADA,
Sumiko SAKAMOTO,
Eriko WATANABE,
Tomoro TAGUCHI, Yoko ISHINO, Jun MURAKAMI,
Yoshiaki FUJIWARA",,,,,,,103',,,Enfants Admis,"https:,,www.imdb.com,title,tt0161610,?ref_=fn_al_tt_3",,,,,"Losing her husband three years ago, Mayumi is making a living for herself and her family as a hairdresser. She runs a beauty parlor owned by her now senile mother-in-law. She has a 10 year old son, Kai, but she works so hard there is little time left to spend with him. She is unaware that he is being bullied both in and out of school. Yuki, her lazy and rather malicious sister-in-law refuses to help her. Mayumi’s customers try hard to introduce her to possible candidates to remarry. She only finds some consolation with Kida, the best friend of her late husband. After a while she remarks that Kai is acting somewhat strange. Not only does he seem to be hiding something, but she has seen him speak to some invisible friend.
Is That You is a heart warming “feel-good-movie” from Japan. Directing the film is veteran Genji Nakamura (Is That You is his 97th film). Akiko Kawase wrote the script, mixing the supernatural with contemperary problems as single mothers and bullying at school. By casting Miyuki Matsu, who is a widow and a mother like the heroine in the film, Is That You reflects the life and thoughts of both the writer and the starring actress. Sumiko Sakamoto (who starred in Shohei Imamura’s Cannes Grand-Prix winner The Ballad of Narayama) stars as the senile grandmother."
1998,movie ,,,KILLERS by Mike Mendez,Mike Mendez,1996,USA,European,,"Dave LARSEN, David GUNN,
C.T. MILLER, Damian HOFFER, Wendy LATTA",,,,,,,97',"Horror, Mystery, Thriller",,,"https:,,www.imdb.com,title,tt0256858,?ref_=nm_flmg_dr_10",,,,,"Odessa and Kyle James were just your average American boys until the night they wet upstairs and snuffed mom and dad with twenty-seven rounds of double-ought buck. And smiled. Two years later, the trial is over. The boys have an appointment with the electric chair. Refusing to give the press and the public the path explanations they want, the brothers, with their unflappable humor and complete lack of remorse become the kind of media heroes that only a 1990’s America could embrace. Their bloody escape from prison leads to a massive manhunt, with a titillated public glued anxiously to their televisions, alternately thrilled and afraid. Barely eluding the dragnet, the iconoclastic killers hole up in a typical suburban town, taking the Ryan family hostage. This perfect middle-American household becomes the arena for a showdown between the killers and the country that spawned them. Nothing escapes the brother’s double-barreled, frontal assault: The cult of celebrity. The L.A.P.D. The media. Credit cards. Consumerism. Family values. Even a few irritating neighbors. But it’s the brothers who are in for a nasty surprise. It appears the Ryan’s have a few of their own axes to grind. And the James boys have a thing or two to learn about killing.
With his terrific visual sense and real cinematic technique and literacy Mike Mendez’s film is a completely delirious excursion into the genre that chronicles the exploits of killers."
1998,movie ,,,THE KINGDOM III,Lars von Trier,1997,Denmark,,,"Udo KIER,
Ernst-Hugo JAREGARD,
Holger Juul HANSEN,
Kirsten ROLFFES",,,,,,,561',"Comedy, Drama, Fantasy ",,,"https:,,www.imdb.com,title,tt0108906,?ref_=nm_flmg_dr_21",RIGET III,,,,"The prestigious Kingdom hospital and its motley crew of staff and patients are back to give us more thrills. In a splendid mixture of unalloyed horror and unadulterated soap we watched the way Mrs Drusse tried to put an end to little Mary’s torments, aided and abetted by her son Hansen. How Stig Helmer, the Swedish brain surgeon, tussled with the Mona report and how Professor Moesgaard messed with his entire department. Slightly extended collection of characters and spine-chilling events in this sequel.
In The Kingdom 2, ruthless wit, acid social comment, and pungent portraiture of hospital staff and patients. From Danophobe Swedish chief neuro-surgeon Helmer and his alternately sex-crazed and gambling-obsessed staffers to hypochondriac patient Mrs Drusse who happens to be in touch with the ghosts of former patients with a score to settle. They’re back in force. And so is the baby whose raging birth terminated part 1.
Audiences world-wide were enthralled by Lars von Trier’s stylistically daring, thematically challenging auteur pot au feu of modern medical science versus the forces of the occult in a supposedly state-of-the-art hospital, where wheeling and voodoo dealing get the upper hand of healing."
1998,movie ,,,LONG TWILIGHT,Attila Janisch,1997,Hungary,,,"Mari TOROCSIK, Imre CSUJA, Denes UJLAKI, Jozsef SZARVAS,
Eva ALMASY ALBERT",,,,,,,70',Drama ,,,"https:,,www.imdb.com,title,tt0119316,?ref_=fn_al_tt_1",HOSSZU ALKONY,,,,"An old woman is forced by the bus driver to get off in the middle of the night. Out in the pouring rain in a dreary, menacing world she continues her journey. A truck driver and his companion accept to take her with them. But the old woman soon discovers that they are less friendly than they seem to be. The landscape of Long Twilight is a treacherous, man-eating place where anything can happen to anyone. Where an ogre can emerge from anybody. The servants of hell are everyday monsters, simple bus and truck drivers, riders of the forest, bicyclists or farm hands. Underneath their forbearing indifference and rare kindness there is always a glowing murderous anger. In this valley of tears where nothing matters, the flame of lurking madness is the only sign of life.
Attila
Janisch, a reader, no doubt, of the German fantastic literature and the wonderful Tales of E.T.A. Hoffmann, conducts his tale with the hand of a master story-teller. The Long Twilight is based on a short story by American writer Shirley Jackson. The immaculately shot yarn about an old woman who travels back to an isolated, memoryladen location plays like a Hungarian episode of The Twilight Zone."
1998,movie ,,,MEDUSA,George Lazopoulos,1997,Greece,,,"Eleni FILINI,
Thanos AMORGINOS,
Vana RABOTA, Mitsos SIORIS, Arto APARTIAN,
Takis ANTONIOU,
Haris MICHALOYANNAKIS, Dimitris KARAGEORGOS,
Mitsos SIORIS, Froso LYTRA, George LAZOPOULOS",,,,,,,87',"Fantasy, Horror, Thriller",,,"https:,,www.imdb.com,title,tt0163097,?ref_=nm_knf_t1",MEDOUSA,,,,"The film is an adaptation in today’s world of the ancient Greek myth of Medusa. Medusa was a woman with a face so horrible, that it would petrify anybody, who would happen to look at it. She was killed by Perseus, an ancient hero. Perseus, rather than looking directly at her, looked at her image as it was reflected on the surface of his shield. The film keeps close to the myth, except for one change. In the film Medusa petrifies men only. If a woman happens to see her face, then she becomes the new Medusa, while the old one collapses into a pile of sand. Perseus is haunted by childhood memories of petrified men and strange, awesome women. He is the leader of a small gang, that breaks into houses. Until the day they break into the house of Medusa.
Medusa
is the first long feature by Greek director George Lazopoulos. He adapted one of the many ancient Greek myths for the screen and made it a stunning and breathtaking fantasy thriller."
