edition,type,subtype,winner,title,director,year,country,premiere,competition,casting,distributor,producer,screenplay,soundtrack,subtitles,audio,length,genre,Fonction Guest,IMDB,Lien IMDB,original_title,URL Poster,text_fr,text_nl,text_en
2012,movie ,7th Orbit Competition,,HIMIZU,Sion Sono,2011,JAPAN,BELGIAN,7th Orbit Competition,"Shôta Sometani, Fumi Nikaidô, Tetsu Watanabe",,,,,,,129',"Crime, Drama",,,https://www.imdb.com/title/tt1900893/?ref_=fn_al_tt_1,,,,,"15-year old Sumida’s only ambition is to lead
a normal life. And that’s not something easy to
aspire to in post-Fukushima Japan. His mother ran off
with her lover, leaving Sumida alone in charge to run the
family’s boat rental business. His alcoholic, gamblingaddicted
father regularly passes by to steal money and
to beat up Sumida. He also tries to convince his son to
kill himself, so that daddy can pay his gambling debts
with his life insurance. On top of that, Sumida receives
an extra beating from the yakuza that are after his father.
Luckily he has a soul mate. His attractive classmate
Chazawa is secretly in love with him. Her parents
have built a gallows at home and beg her to hang herself
so that she can no longer be a burden to them. Sumida
and Chazawa seem to be destined for one another, but
the world conspires to keep them apart.
Teenage romance drenched in violence against a backdrop
of chaos and destruction… sounds like a Sion
Sono movie ! Just before the director of Suicide Club,
Love Exposure and Cold Fish wanted to start filming this
adaptation of Minoru Furuya’s popular manga, Japan
was struck by the Tsunami of March 2011. Sono rewrote
everything and made the catastrophe an integral part of
the film. Himizu is one of those movies that defy classification,
with its mix of teenage angst, melodrama,
explosions of shocking and surreal brutality, images of
apocalyptic poetic beauty and a bittersweet ending.
The two young leads, Shota Sometani ( Sumida ) and
Fumi Nikaidou ( Chazawa ) rightly deserved the Marcello
Mastroianni Award for New Young Talent at the latest
Venice film festival."
2012,movie ,7th Orbit Competition,,INVASION OF ALIEN BIKINI,Oh Young-doo,2011,SOUNTH KOREA,BELGIAN,7th Orbit Competition,"Eun-Jung Ha, Young-geun Hong",,,,,,,75',"Comedy, Science-Fiction, Romance",,,https://www.imdb.com/title/tt1855232/?ref_=nv_sr_srsg_0,,,,,"Young-gun is a very frustrated young man. He
never had a girlfriend and is still a virgin. He puts
all his energy and frustration in crime-fighting. Dressed
up as a superhero and with a fake mustache to avoid
being recognized, he patrols the streets of Seoul, looking
for injustice. When Young-gun sees how three men are
attacking Monica, a very attractive young woman, he
doesn’t hesitate and throws himself into the fray. He succeeds
in beating up the assailants and takes Monica to
the only safe place he knows, his tiny flat. Wat Young-gun
doesn’t know is that the guys he battered and bruised are
actually government agents looking for a very dangerous
creature from another planet. The alien has taken Monica
as its host and if she manages to procreate before the
sun rises, it will be the end of the world as we know it.
And you’re not going to feel fine at all !
What’s often so wonderful about Korean genre cinema,
is that it is not scared to mix very different genres. Horror
dances with thriller, cheats with melodrama and sometimes
even flirts with song and dance. It’s all possible !
The genre-bending Invasion of Alien Bikini, the crucial
second feature of Young-doo Oh ( The Neighbor Zombie ),
has a thematic resemblance to our 2004 Golden Raven,
Save The Green Planet. A mentally troubled loner has
to suffer a terrifying ordeal with the fate of the planet
at stake. Alien Bikini offers the same experience, but
for only 5000 dollar. And for that you get an inventive,
energetic, funny, sexy and very weird little gem of a film.
More than perfect for our 7th Orbit Asylum."
2012,movie ,7th Orbit Competition,,KOTOKO,Shinya Tsukamoto,2011,JAPAN,BELGIAN,7th Orbit Competition,"Shin'ya Tsukamoto, Yûko Nakamura, Cocco
",,,,,,,91',"Horror, Drama",,,https://www.imdb.com/title/tt1842532/?ref_=nv_sr_srsg_0,,,,,"Kotoko is a young woman with a serious mental
dysfunction. She sees double and we’re not
talking about blurry vision here, but about two versions
of the same person. One is real and the other is an aggressive
doppelganger. She’s never certain which one
she’s facing, until the evil hallucination attacks her. This
leads to a lot of stress and as a result, Kotoko starts cutting
her wrists. It’s not because she wants to kill herself.
She just wants to find out how much pain her body can
endure. To complicate things, she also has a young son
to protect. Luckily there’s her shy neighbor Tanaka, a
know writer, who’s willing to serve as a target upon
which Kotoko can unleash all her anger and frustration.
Shinya Tsukamoto ( Tetsuo, Tokyo Fist, Nightmare Detective
) is back at the BIFFF with what he does best:
direct, write, produce, film, edit and act in an amazing,
wondrous, shocking and intriguing film that defies classification.
We’re going to try anyway : contemporary
urban body horror psychodrama! Centerpiece of this
audiovisual assault on the senses is Japanese pop star
Cocco, who delivers a terrific performance that no western
pop idol would even dare to touch. And Tsukamoto
himself isn’t too bad either as punching bag Tanaka."
2012,movie ,7th Orbit Competition,,LETTERS TO ANGEL,Sulev Keedus,2011,"ESTONIA , FINLAND , LATVIA",INTERNATIONAL,7th Orbit Competition,"Tõnu Oja, Rain Simmul, Ketter Habakukk",,,,,,,118',Drama,,,https://www.imdb.com/title/tt1433851/?ref_=nv_sr_srsg_0,,,,,"Jeremia, a sharp shooter in the Estonian army,
was sent to Afghanistan to fight against the
Taliban. Instead he found himself taken prisoner by
them. During his years of captivity, he converted to
Islam. Now the man everyone thought was dead has
returned home. Jeremia is looking for his daughter Angel.
His only leads are the sound of her crying during
a telephone call and a notebook stuffed with letters to
her. His first stop is the village where his ex-wife used
to live. Jeremia finds himself in the midst of another
kind of war. The front-lines in this run-down hamlet
run between East and West, males and females and
common sense and insanity. The village does not intend
to let him go soon. The strong and mentally unstable
women who run it see in him a savior who will free them
from an empty existence.
Will Estonia score again after The Temptation of St. Tony
ran away with our 7th Orbit Award last year ? In any case,
this Baltic entry to the Oscars is drenched with the same
melange of surrealism, absurdity and existential despair
which made St Tony such a memorable film to watch.
Director Sulev Keedus had the idea in his head ever
since he narrowly escaped conscription to the Red Army
in 1979 to fight the mujahedin during the Soviet occupation
of Afghanistan. He imagined how he would have
returned from such an ordeal, mentally and physically
broken like Jeremia. With Letters to Angel, the BIFFF
celebrates the 100th anniversary of Estonian Cinema."
2012,movie ,7th Orbit Competition,,PIG,Henry Barrial,2011,USA,BELGIAN,7th Orbit Competition,"Rudolf Martin, Heather Ankeny, Keith Diamond",,,,,,,90',"Science-Fiction, Thriller, Mystery",,,https://www.imdb.com/title/tt1262414/?ref_=nm_knf_i1,,,,,"A man regains consciousness with a hood over
his head and his hands tied behind his back. He
has no idea who he is or how he got there. In his trouserpocket
he finds a piece of paper with a name written on
it : Manny Elder. When he collapses of exhaustion, he’s
found by an attractive young widow who lives alone in
the desert with her son. They discover that Manny Elder
is a janitor in Los Angeles and drive to the city to uncover
the mystery of his identity. He finds traces and clues of
the life he led. Some seem to be planted there, others
come across his path by accident. And sometimes they
contradict each other and point in different directions.
But every time he’s close to a breakthrough, his search
ends and he finds himself back in the desert, with no
memories of what happened before.
Pig is an intriguing mystery thriller with sci-fi elements
by Henry Barrial. The comparison to Christopher Nolan’s
Memento seems logical, but while that classic dealt
with how memory influences our perception of reality,
Pig focuses on identity and how our memories shape
and deform our self-image. Barrial found the idea for Pig
when he read about the ordeal of a German of Lebanese
origin who was kidnapped by the CIA on suspicion of
terrorism. The innocent man spent six month in captivity
in Albania, without knowing where he was or understanding
the language that was spoken around him.
When he returned, he found out that everybody thought
he was dead and he was forced to start his life from
zero. Or how reality keeps inspiring the weirdest and
most original creations of the 7th Art."
2012,movie ,7th Orbit Competition,,POONGSAN,Juhn Jai-hong,2011,SOUTH KOREA,BELGIAN,7th Orbit Competition,"Yoon Kyesang, Gyu-ri Kim, Jong-soo Kim",,,,,,,121',"Action, Drama, Romance",,,https://www.imdb.com/title/tt1773020/?ref_=nv_sr_srsg_0,,,,,"Poongsan, whose real name and life story are
unknown, is a courier who crosses the demarcation
line between the two Koreas, delivering everything
from video games and letters to refugees between
separated families in the two countries. One day he is
commissioned to smuggle the lover of a high profile
North Korean defector to the South. When something
starts to bloom between Poongsan and the woman, the
situation quickly escalates, even causing a stir on the
governmental level.
Poongsan presents us with a cynical look at the complicated
relationship between North and South Korea.
The movie is intense from the start, with its mix of love,
hope, loyalty, betrayal, cruelty and violence. It’s directed
by Juhn Jai, but the door to international audiences
is opened by the name of its acclaimed producer and
scriptwriter Ki-duk Kim ( The Isle ). Juhn Jai, who has
worked as an assistant director for Kim, focuses on
the physical instincts of his characters and does that
in a very visual way. So expect some gruesome torture
scenes ! Poongsan tackles the thorny issue of no-man’s
land separating the two Koreas with the violence and
the poetic flavor of a tragic romance that characterizes
the Korean cinema in general and Kim Ki-duk in particular.
This electrifying political romance-thriller will keep
you on your toes from the beginning until the very end."
2012,movie ,7th Orbit Competition,,SHUFFLE by Kurt Kuenne,Kurt Kuenne,2011,USA,INTERNATIONAL,7th Orbit Competition,"T.J. Thyne, Paula Rhodes, Chris Stone",,,,,,,82',"Fantasy, Mystery, Romance",,,https://www.imdb.com/title/tt1488594/?ref_=nv_sr_srsg_6,,,,,"Lovell Milo doesn’t like to sleep. Not because
he’s scared of the dark or because he twists
and turns for hours before ending up in dreamland. It’s
because he never knows when or where he’s going to
wake up. Every time Milo opens his eyes, it’s at a different
age and at a different day in his life. He might go
to sleep as a 30-year old and wake up as an 10-year
old. It scares the hell out of him and he doesn’t know
how long he can take it anymore. When Milo discovers a
pattern in his zapping through time, he desperately tries
to discover who or what is behind his unique condition.
The Twilight Zone meets Frank Capra in Shuffle, once
more proof that a wonderfully executed idea can overcome
all budgetary limitations. Director-scriptwriter
Kurt Kuenne is known for his gripping documentary
Dear Zachary, about the murder on one of his best
friends. Shuffle is also dedicated to Zachary, and you’ll
understand why once you’ve seen this unique and inspiring
little gem. Lovell Milo is a superb performance
by T.J. Thyne ( Dr. Jack Hodgins from the TV-series
Bones ). To make Milo’s aging and rejuvenating process
credible, Kuenne could count on Barney Burman, Oscar
2010 for Best Make-up in Star Trek !"
2012,movie ,7th Orbit Competition,,ZENITRAM,Luis Barone,2010,ARGENTINA,INTERNATIONAL,7th Orbit Competition,"Juan Minujín, Verónica Sánchez, Jordi Mollà",,,,,,,103',"Science-Fiction, Comedy, Adventure ",,,https://www.imdb.com/title/tt0861747/?ref_=nv_sr_srsg_0,,,,,"2025. Argentina suffers from the yoke of a
giant corporation who has the monopoly of
the water supply. One evening, Martinez, a regular Joe
from a poor neighborhood, looses his job as a garbage
man. When he goes to pee in a public toilet, he
meets a strange man who bestows a unique gift upon
him. Every time Martinez grabs his balls and shouts
“Zenitram”, he gets supernatural powers. And this is
how the first Argentinean superhero came to be, albeit
one who’s afraid of flying. Martinez uses his powers to
get the tabs flowing. The people love him, the media
can’t get enough of him and the government… appoints
him minister of extraordinary affairs and buries
him in bureaucracy. Zenitram can’t take it anymore. He
gets addicted to cocaine and immortally embarrasses
himself during the National Holiday. There’s only one
way out: rehab in the Miami hospital for superheroes.
When the love of his life falls into the hands of the
Machiavellian water tycoon, Zenitram seizes this last
chance for redemption.
Zenitram is a peculiar little beast at the BIFFF : an Argentinean
political satire disguised as a superhero epic.
Director Luis Barone certainly knows what he’s talking
about, having done extensive “fieldwork” while being
employed at the cultural departments of provincial and
national ministries. Luckily you don’t have to know anything
about Argentinean politics to enjoy Zenitram. Big
bad multinationals, suffocating bureaucracies, human
weakness and vanity are universal and at least this film
offers hope for salvation, but then served with a solid
portion of irony."
2012,movie ,European Méliès Competition,,PANIC BUTTON,Chris Crow,2011,UK,BELGIAN,European Méliès Competition,"Scarlett Alice Johnson, Jack Gordon, Michael Jibson",,,,,,,96',"Horror, Thriller",,,https://www.imdb.com/title/tt1727358/?ref_=nv_sr_srsg_0,,,,,"Jo, Max, Dave and Gwen are the winners of a
contest organized by the social network site
All2Gether.com. The big prize is an all expenses included
trip to New York in a luxurious private jet. Once on
board, they find out that the contest hasn’t finished yet.
Every seat comes equipped with a monitor that shows
an animated alligator who starts to ask them some very
personal questions. The answers do not only reveal
highly embarrassing truths of our foursome. A wrong
answer is punished by the death of a family member
or friend, which they can witness in real time on their
monitors. If they want to survive this trip, they’ll have
to play the alligator’s deadly game until the bitter end.
“Saw on a Plane” is what you might think if you’ve
read the above synopsis, but that doesn’t do justice
to the very actual and poignant message of this British
nail-biter. Online social networks have become so
omnipresent and pervasive that we hardly realize anymore
how much of ourselves we expose on the Internet.
Those sick clips you’re watching, those porn sites you
“accidentally” seemed to click upon, those sarcastic
comments on network sites… sooner or later if will
all come back to bite you in the face. With Panic Button,
Chris Crow ( Devil’s Bridge ) takes the pulse of the
digital generation. Get ready for a chilling thriller with
credible characters that prefers psychological terror to
gratuitous torture porn."
2012,movie ,European Méliès Competition,,RETREAT,Carl Tibbetts,2011,"UK , IRELAND",BELGIAN,European Méliès Competition,"Thandiwe Newton, Cillian Murphy, Jamie Bell",,,,,,,90',"Thriller, Drama",,,https://www.imdb.com/title/tt1410051/?ref_=nm_knf_i2,,,,,"Kate and Martin, a couple with marriage troubles,
retreat to a deserted and remote island
near the Scottish coast where they used to spend happier
times. They try to work on their relation, but Kate
is so stuck in her depression that she rejects Martin’s
every attempt of contact. It all changes when a third
person suddenly appears. The man, with a bloody face
and dressed in a military uniform, collapses at the front
of their house. His name is Jack and he brings some
very bad news. A highly contagious and very lethal virus
is rapidly spreading on the mainland. Soon the island
will be overrun by refugees who’ll probably bring the
virus with them. If they want to survive, they’ll have to
barricade themselves in the house and be prepared to
kill everybody who tries to get in. But is Jack telling
the truth ?
Young British director Carl Tibbets delivers an impressive
debut feature with this claustrophobic thriller. He
creates a disturbing and confined universe where you’ll
wonder until the very end if we’re seeing a glimpse of
a world shattering event or if it’s all the ramblings of a
deranged mind. Everything depends on the chemistry
between the protagonist and for that he could count
on three names that ring like a bell ( especially the last
one ). Thandie Newton ( Beloved, Mission Impossible II )
and Cillian Murphy ( 28 Days Later, Sunshine ) are the
damaged couple Kate and Martin, while Jamie Bell
( King Kong, The Adventures of Tintin ) gives a charismatic
performance as the ambiguous Jake."
2012,movie ,"European Méliès Competition, Danish Focus",,RONAL THE BARBARIAN,"Thorbjorn Christoffersen, Kresten Vestbjerg Andersen, Philip Einstein Lipski",2011,DENMARK,BELGIAN,European Méliès Competition,"Anders Juul, Hadi Ka-Koush, Lærke Winther",,,,,,,89',"Animation, Adventure, Fantasy ",,,https://www.imdb.com/title/tt1629374/?ref_=nv_sr_srsg_0,,,,,"Let’s put it bluntly: Ronal isn’t exactly how you
would imagine a genuine barbarian. You know
those walking bundles of biceps with Austrian accents
that could rip your arm out just by tickling your armpit.
Well, that’s not Ronal. He’s a weak shrimp, a real wussie
with twig-like arms. And now the fate of his fellow barbarians
rests on his fragile shoulders. Evil Lord Volcazar
has raided the village and abducted the entire tribe.
Forced to go on a perilous quest to save his kin, Ronal
is joined by Alibert, the horny glam rock bard, Zandra
the gorgeous shield-maiden, and Elric the metrosexual
elfin guide ( just imagine Legolas in a Gay Pride Parade ).
Babes, balls and muscles! With this kind of tagline, you
know that grown ups finally also have their animation
films: violence, gore, sex and fun… Ronan is an epic
spin-off joke on classics like Conan the Barbarian and
Lord of the Rings! From the Danish animation filmmakers
who brought you Terkel in Trouble ( 2004 ) and the
sci-fi spoof Journey to Saturn ( 2008 )."
2012,movie ,European Méliès Competition,,THE SANDMAN,Peter Luisi,2011,SWITZERLAND,BELGIAN,European Méliès Competition,"Fabian Krüger, Irene Brügger, Beat Schlatter",,,,,,,88',"Fantasy, Drama",,,https://www.imdb.com/title/tt1801808/?ref_=nm_knf_i2,,,,,"Benno is not at all like the Sandman from the
Chordettes’ classical song ( Mr Sandman, bring
me a dream... pom, pom, pom, pom ). He’s an egomaniac
with a job at a stamp store that consists in ripping
off clients who don’t realise the value of the collections
they inherited from their deceased family members.
One morning he wakes up with sand in his bed. Even
worse, Benno turns into a real walking sand tank. In
his troubled sleep he has a nightmare and a love affair
with his downstairs neighbor, whom he intensly
despises for keeping him awake with her singing at
night. The pile of sand grows every time he closes his
eyes, and the calmer he tries to be, the stronger the
stream of sand. And it get worse ! Because the sand
has magical properties. When Benno finds himself in
a situation he can’t control, he throws it in the face of
the persons in front of him and makes them believe that
the whole thing was just a dream. A useful tool against
your enemies or a curse ?
The Sandman is a deliciously surreal comedy from
Swiss director Peter Luisi that already won 14 movie
awards. Its title doesn’t only refer to the man of sand
that the main character is slowly becoming, but also
to the mythical Sandman of the fairytales. With lots
of humor and imagination, Luisi sweeps us of our feet
in this absurd story that could be called the European
counterpart of Eternal Sunshine of the Spotless Mind !"
2012,movie ,European Méliès Competition,,SENNENTUNTSCHI : CURSE OF THE ALPS,Michael Steiner,2010,SWITZERLAND,BELGIAN,European Méliès Competition,"Roxane Mesquida, Nicholas Ofczarek, Andrea Zogg
",,,,,,,115',"Mystery, Horror",,,https://www.imdb.com/title/tt1296077/?ref_=nv_sr_srsg_0,,,,,"1975, a small village in the Swiss Alps. The
suspicious suicide of the village priest coincides
with the sudden appearance of a strange, young
woman. The villagers immediately suspect her involvement
in the death of their priest. The only one who
protects her is Reusch, a local boy turned cop, with a
troubled past. Meanwhile, in a cabin on a nearby hill,
three lonely and horny farmers are dabbling with the
supernatural. They want to bring the mythic Sennentuntschi
to life: a female made of straw who will satisfy
their every need. Once made flesh, this sexy monster is
abused in all orifices by her creators. But it doesn’t take
long before she turns against them and goes medieval
on the farmers. Back in the village, Reusch discovers
a disturbing connection between his protégé and Sennentuntschi.
Sennentuntschi : Curse of the Alps is Switzerland’s first
big budget horror film. This impressive and stylish debut
feature by Michael Steiner is partly a murder mystery
and partly a macabre fairy tale. The story stays exciting
until the end and is a joy for the eye to see thanks to
cameraman Pascal Walder’s images of wide, rugged
landscapes filled with hidden menace. The performance
of Nicholas Ofczarek as the naive and trusting cop and
of Roxane Mesquida as the enigmatic young woman
will keep your attention glued to the screen. It’s still
too early to speak of a Toblerone horror wave, but Sennentuntschi
is certainly an excellent start !"
2012,movie ,European Méliès Competition,,TRUTH OR DARE,Robert Heath,2011,UK,WORLD,European Méliès Competition,"Tom Kane, Liam Boyle, Jack Gordon",,,,,,,96',"Horror, Mystery ",,,https://www.imdb.com/title/tt1838722/?ref_=fn_al_tt_4,,,,,"A graduation party for college students gets out
of hand when a game of “Truth or Dare” openly
humiliates the ultra rich and equally shy Felix. The five
students that are involved in Felix’s embarrassment
will face the devastating consequences of their actions.
A few months later, they are reunited on their way to
Felix’s birthday party. When they arrive at the location,
a cabin in the woods on the vast family domain, they’re
welcomed by Justin, Felix’s charismatic older brother.
Underneath his charming appearance, Justin boils with
anger and it doesn’t last long before he reveals the true
reason for their presence. Felix has killed himself and
Justin will not rest before he has exposed the truth.
We’ve all played “Truth or Dare” at some point in our
lives and mostly it’s about who has done “it” with whom
and how far you’re willing to go with each other. But in
Robert Heath’s sadistic psycho-chiller, the wrong answer
might lead to a chopped-off limb or a burning dose
of acid in your stomach. Friendship is only a thin layer
of veneer and the tortured fivesome are prepared to do
anything just to survive. Nobody’s innocent in Truth or
Dare, but who’s responsible for what is one of the many
guilty pleasures in this British genre fest."
