edition,type,subtype,winner,title,director,year,country,premiere,competition,casting,distributor,producer,screenplay,soundtrack,subtitles,audio,length,genre,Fonction Guest,IMDB,Lien IMDB,original_title,URL Poster,text_fr,text_nl,text_en
2005,movie ,Fantastikids,,LABYRINTH,Jim Henson,1986,"USA, UK",,,,,,,,,,101',"Fantasy, Adventure, Family",,,"https:,,www.imdb.com,title,tt0091369,",,,,,Sixteen-year-old Sarah is given thirteen hours to solve a labyrinth and rescue her baby brother Toby when her wish for him to be taken away is granted by the Goblin King Jareth.
2005,movie ,Hommage Henri Xhonneux,,MARQUIS,Henri Xhonneux,1989,"Belgium, France",,,,,,,,,,83',"Animation, Comedy",,,"https:,,www.imdb.com,title,tt0097839,",,,,,"The scene is a pre-French Revolution Bastille, where various political prisoners are being held: a woman who was raped and impregnated by the king, a police chief who was accused of selling bad pork, and the Marquis, who was unjustly accused of working for the overthrow of the king. The Marquis is only interested in writing his deviant stories, while his penis yearns"
2005,movie ,Hommage Jules Verne & Karem Zeman,,THE DEADLY INVENTION OF PROFESSOR ROCH,Karl Zeman,1957,Czech Republic,,,,,,,,,,84',"Fantasy, Adventure, Animation",,,"https:,,www.imdb.com,title,tt0052374,",Vynález zkázy,,,,An evil millionaire named Artigas plans to use a super-explosive device to conquer the world from his headquarters inside an enormous volcano
2005,movie ,Hommage Jules Verne & Karem Zeman,,THE STOLEN AIRSHIP,Karl Zeman,1967,Czech Republic,,,,,,,,,,90',"Fantasy, Adventure, Family",,,"https:,,www.imdb.com,title,tt0062412,",UKradená vzducholod,,,,Five young boys take off in a lighter-than-air machine from the Centenary Exposition in Prague.
2005,movie ,Hommage Jules Verne & Karem Zeman,,JOURNEY TO THE BEGINNING OF TIME,Karl Zeman,1955,Czech Republic,,,,,,,,,,86',"Fantasy, Adventure, Family",,,"https:,,www.imdb.com,title,tt0047930,",Cesta do pravěku,,,,"One day a young boy finds a fossil of trilobite. Together with his three friends they set off on an adventurous journey through prehistory, up to the beginning of time."
2005,movie ,Hommage Jules Verne & Karem Zeman,,THE FABULOUS BARON MUNCHHAUSEN,Karl Zeman,1961,Czech Republic,,,,,,,,,,83',"Fantasy, Adventure, Comedy,",,,"https:,,www.imdb.com,title,tt0054665,",Baron Prásil,,,,"The outrageous Baron Munchausen tells of his many adventures, from meeting the Man in the Moon to defeating a Turkish army all by himself."
2005,movie ,Hommage Jules Verne & Karem Zeman,,Georges Méliès Short Films,Georges Méliès,,France,,,,,,,,,,,,,,"https:,,www.imdb.com,name,nm0617588,",,,,,
2005,movie ,Hommage Jules Verne & Karem Zeman,,AROUND THE WORLD IN 80 DAYS,Michael Anderson,1956,USA,,,,,,,,,,167',"Comedy, Adventure, Family",,,"https:,,www.imdb.com,title,tt0048960,",,,,,A Victorian Englishman bets that with the new steamships and railways he can circumnavigate the globe in eighty days.
2005,movie ,Hommage Jules Verne & Karem Zeman,,"20,000 LEAGUES UNDER THE SEA",Richard Fleischer,1954,USA,,,,,,,,,,127',"Drama, Adventure, Family",,,"https:,,www.imdb.com,title,tt0046672,",,,,,"A ship sent to investigate a wave of mysterious sinkings encounters the advanced submarine, the Nautilus, commanded by Captain Nemo."
2005,guest,Guest of honor,,,"Billy, Crawford",,USA,,"We’re used to seeing him on the cover of some glossy magazine, but pop idol Billy Crawford has in fact already starred in some ten movies. Billy, who grew up in the Philippines, reaches stardom as a child, wins an award for Best Interpretation and even has his own television program. At the age of 12, his parents take him to the United States, where he starts to work on a musical career. 3 successful albums later, he joins Paul Schrader’s film set, where he plays the part of Cheche. In the middle of his European tour, Billy Crawford stops in Brussels to defend the World Premiere of Paul Schrader’s Exorcist, on Friday 18 March.",,,,,,,,,,Actor,,"https:,,www.imdb.com,name,nm1116863,",,,,,
2005,guest,Guest of honor,,,"Paul, Schrader",,USA,,"Paul Schrader is one of the so-called “movie brats”. Together with peers like Francis Ford Coppola, William Friedkin, Brian De Palma, George Lucas, Steven Spielberg, Hal Ashby and Martin Scorcese, he shapes American cinema of the 70ties and becomes one of the heralds of author-driven movies. After publishing a book on the work of Ozu, Bresson and Dreyer, The Transcendental Style, he launches himself into screenwriting. The Yakuza (Sidney Pollack, 1975) is quickly followed by Taxi Driver (Martin Scorsese, 1976). Two years later, he debuts as a director with Blue Collar. Since then, Paul Schrader has gathered acclaim and awards as a screenwriter (American Gigolo, Raging Bull, The Last Temptation of Christ, Bringing Out The Dead) and as a director (Cat People, Mishima, Light Sleeper, Affliction, Auto Focus). He honours us by presenting his latest film in world première at the festival : Paul Schrader’s Exorcist : The Original Prequel. ",,,,,,,,,,Director,,"https:,,www.imdb.com,name,nm0001707,",,,,,
2005,guest,Guest of honor,,,"Deborah Kara, Unger",,Canada,,"After studying at Australia’s NIDA, the national training centre for the arts industry, Canadian actress Deborah Kara Unger also makes her feature film debut down under with Russell Crowe in the award-winning Prisoners of the Sun. But it’s her part in David Cronenberg’s adaptation of A.G. Ballard’s Crash (1996) that gets her noticed by film buffs and industry players. Deborah Unger stars alongside Michael Douglas and Sean Penn (The Game, 1997), Denzel Washington (Hurricane, 1999), Mel Gibson (Payback, 1999), Stellan Skarsgard & Charlotte Rampling (Signs & Wonders, 2000) and Val Kilmer (Salton Sea, 2002). Last year you could already see her twice on the screen of the Passage 44 with Fear X and OPo1nt0. This year, Deborah Unger’s here in person to present the opening film of the festival : White Noise. ",,,,,,,,,,Actress,,"https:,,www.imdb.com,name,nm0000679,",,,,,
2005,guest,Knight,,,"Dario, Argento",,Italy,,,,,,,,,,,,Director,,"https:,,www.imdb.com,name,nm0000783,",,,,,
2005,guest,Knight,,,"Larry, Cohen",,USA,,"This American horror veteran (New York, 1941°) starts his career on the small screen, where he makes a name as director of the legendary SF-series The Invaders. His first long features are so called Blaxploitation flicks, such as Black Caesar and Hell Up In Harlem. But he finds his true vocation with original horror movies like It's Alive, Q, The Winged Serpent, God Told Me To (for which he received the George Pal Award in 1987) and Ambulance. Larry Cohen is also a much demanded screenwriter. He’s not only responsible for the scripts of genre classics such as The Return of the Magnificent Seven and the Maniac Cop series, but also for contemporary hits like Abel Ferrara’s Body Snatchers, Phonebooth and Cellular. Larry Cohen is guest of honour at the BIFFF.  ",,,,,,,,,,Director,,"https:,,www.imdb.com,name,nm0169540,",,,,,
2005,guest,President,,International Competition,"Udo, Kier",,Germany,,,,,,,,,,,,Actor,,"https:,,www.imdb.com,name,nm0001424,",,,,,
2005,guest,jury,,International Competition,"Fabrice, Du Welz",,Belgium,,,,,,,,,,,,Director,,"https:,,www.imdb.com,name,nm0239001,",,,,,
2005,guest,jury,,International Competition,"Richard, Franklin",,Australia,,"""Australian director Richard Franklin is a graduate of the celebrated
University of Southern California Cinema School.
He debuted in 1975 with the controversial True Story of Eskimo
Nell. His second picture, the occult thriller Patrick, brought him
to the attention of Hollywood producers. Franklin directed Stacy
Keach and Jamie Lee Curtis in Roadgames and made the hugely
successful Psycho II. In spite of the difficult task of remaking
Hitchcock’s classic, the picture was both a commercial and
critical success. He produced and directed the horror pic Link in
England, starring Elisabeth Shue and Terence Stamp, and made
another successful sequel FX 2 with Bryan Brown and Brian
Dennehy. His “art house” debut, Hotel Sorrento (1995), received
the AFI's Best Screenplay Award. The unsettling Visitors (Bifff
2004) marked his return to the thriller genre. Jennifer Hadden,
producer of the film, will accompany Franklin to the festival.""",,,,,,,,,,Director,,"https:,,www.imdb.com,name,nm0002207,",,,,,
2005,guest,jury,,International Competition,"Sogo, Ishii",,Japan,,"The influence of the Japanese enfant terrible Sogo Ishii
(Fukuoka, 1957°) on the development of contemporary
Japanese Cinema is incontestable. In the late 70ties, he was
the first to make the move from underground amateur filmmaking
to the professional industry, paving the way for followers
as diverse as Shinya Tsukamoto, Kiyoshi Kurosawa
and Makoto Shinozaki. He’s widely renowned for his editing
skills, his punk-rock sagas and the depiction of raw human
chaos. 1984 is Ishii’s breakthrough with Crazy Family. From
that moment on, he’s awarded everywhere in the world with
features such as Angel Dust, Labyrinth of Dreams, Gojoe
and the hyperkinetic Electric Dragon 80.000 V. Ishii is currently
finishing his latest film, Kyoshin.",,,,,,,,,,Director,,"https:,,www.imdb.com,name,nm0411025,?ref_=tt_ov_dr",,,,,
2005,guest,jury,,International Competition,"Amanda, Plummer",,USA,,"Amanda Plummer (New York, 1957), daughter of Tammy
Grimes and Christopher Plummer, was born to be an
actress. On the stage in, amongst others, Agnes of God, A Taste
of Honey and The Glass Menagerie, she won popular and critical
acclaim, gathering many awards along the way. Plummer
made her screen debut in George Roy Hill’s The World according
to Garp, based on the novel by John Irving. After starring
in Sydney Lumet’s Daniel, she played alongside Jodie Foster
and Rob Lowe in another Irving adaptation, The Hotel New
Hampshire. You might also have caught her in Terry Gilliam’s
The Fisher King, So I married an Axe Murderer, the Stephen
King adaptation Needfull Things and in Nostradamus. Plummer
was brilliant as the crazy Honey Bunny in Pulp Fiction and
impressive in Michael Winterbottom’s Butterfly Kiss. Besides
being a member of our International Jury, she also stars in Jeff
Lieberman’s Satan’s Little Helper.",,,,,,,,,,Actress,,"https:,,www.imdb.com,name,nm0001625,",,,,,
2005,guest,jury,,European Méliès Competition,"Gil, Van Laer",,Belgium,,"Born in 1968, Gil Van Laer already developed an interest in ‘moving images’ from a fairly young age. Later, his studies at the Solvay Business School of the Free University of Brussels occurred at the same time as the opening of Belgium’s first Multiplex (Kinepolis Brussels), a happy coincidence which resulted in the fact that from then on, the so called film virus damaged him permanently. An initial career start in finance and banking had to make way fast for a job in the film and entertainment industry, where Van Laer worked from 1994 till 1997 for the Kinepolis Group. In March 1997 he moved over to Buena Vista International (the marketing and distribution division of the Walt Disney Studios), where almost 8 years later, he is still working as the Executive Director Marketing for BVI Benelux and Branch Manager for Belgium.",,,,,,,,,,Film Professional,,,,,,,
2005,guest,jury,,European Méliès Competition,"Mattias, Derdeyn",,Belgium,,"Mattias Derdeyn studied communications and public relations. At the age of 27, he already has plenty of experience in politics. Before he joined the cabinet of Charles Picqué, Minister President of the Brussels Capital Region, he was press attaché for Charles Picqué when the latter was the Federal Minister of Economy and Scientific Research (2001-2003), for Marie Arena (2003-2004) and for Christian Dupont (2004). As a diehard film enthusiast, Mattias also works as a film critic for the web sites dvdinfo.be, the largest Belgian online dvd review site, and for moviegids.be. ",,,,,,,,,,Journalist,,,,,,,
2005,guest,jury,,European Méliès Competition,"Luc, Jabon",,Belgium,,"Luc Jabon (Brussels, 1948°) has been writing screenplays for more than twenty years. He collaborated as a co-writer on some famous Belgian films such as The Music Teacher by Gérard Corbiau, Babylon by Manu Bonmariage and Maria by Marian Handwerker. He also co-wrote some work for television, under which Une Sirène dans la Nuit by Luc Boland and La Colère du Diable by Chris Van der Stappen. With Dominique Serron, he adapted Nabokov’s Lolita into a theatre play. Jabon also directed some films himself, such as the documentary La vie d’un lecteur au temps de la fin du livre. Furthermore, he was chairman of the Belgian Committee of the SACD (society of authors) and founder and president of the ASA (Screenwriter association). Since 1995, Jabon supervises screenplay writing at the IAD (Institut des Arts de Diffusion) in Louvain-La-Neuve.",,,,,,,,,,"Director,Writer",,"https:,,www.imdb.com,name,nm0413016,",,,,,
2005,guest,jury,,European Méliès Competition,"Georges, Jetter",,Belgium,,,,,,,,,,,,,,,,,,,
2005,guest,jury,,European Méliès Competition,"Audrey, Lekaene",,Belgium,,"Armed with a degree in public relations and as an English/Spanish translator, Audrey Lekaene (1978°) already developed an interest in the world of film festivals at a fairly young age. She has worked for various famous festivals such as the Festival d’Amour de Mons, the Fiff, the Festival des Films du Monde de Montreal and the Clermont-Ferrand Short Film Festival. For the past five years, Lekaene has been chairwoman of the FIDEC (International Festival of Film schools in Huy). Besides that, she’s also responsible for the promotion of Radio Nostalgie in the province of Liège. ",,,,,,,,,,Festival organizer,,,,,,,
2005,guest,jury,,European Méliès Competition,"Roland, Lethem",,Belgium,,"Roland Lethem is correspondent in Brussels for Midi-Minuit Fantastique and co-author of two volumes: Science Fiction in Cinema by Jean-Pierre Bouyxou, and 65 years of Science Fiction in Cinema. He also has an internationally successful career as an independent director of underground and experimental films. Several of his movies were awarded, among which Le Sexe Enragé (Wet Dream Festival Amsterdam in 1971) and Le Saigneur est avec Nous (Press Award at the Festival of Belgian Film in 1974). Lethem also received the Grand Prize of the Morlock Academy for his oeuvre in 1991. He’s also a screenplay writer, translator and organiser of the Screenplay Marathon and Directing the Actor for the Belgian Association of Film Authors (ABAFT).",,,,,,,,,,"Author,Director",,"https:,,www.imdb.com,name,nm0504673,",,,,,
2005,guest,jury,,European Méliès Competition,"Philippe, Manche",,Belgium,,"Philippe Manche was born in Doornik and spent his youth between the records of Bob Marley, Serge Gainsbourg and The Clash. At a later age, he admires Mano Negra and The Pixies. He also develops a passion for cinema, more specifically the work of Fritz Lang, Howard Hawkes and Martin Scorsese. From 1986 onwards, Manche writes for various music magazines, including Rock This Town. In 1993, he starts writing for the newspaper Le Soir, publishing interviews with, amongst others, Quentin Tarantino. As the years go by, Manche becomes fascinated by Manu Chao. He publishes a book with interviews in 2004 : Destination Esperanza, edited by Serpent à Plumes. ",,,,,,,,,,Journalist,,,,,,,
2005,guest,jury,,7th Orbit Competition ,"Jan, Bucquoy",,Belgium,,"How could we represent Jan Bucquoy in less than 1000 characters? Where do we start? With his Vie Sexuelle de Tintin? With his stands against the monarchy? With his panty museum? With his cake throwing practises with his pal Noel Godin? With his political party (B.A.N.A.N.E.)? With his intention to commit a “Coup d’Etat” – according to the latest news on May 21? And if we talked about his films ? About The Sexual Life of the Belgians, for instance, or about his excellent Camping Cosmos? About The Closing Down of the Renault Factory at Vilvoorde or Pleasure and Hysteria? Are there any other Belgians like this one? Who else than Bucquoy could be the first chairman of our 7th Orbit Jury ? ",,,,,,,,,,Director,,"https:,,www.imdb.com,name,nm0118809,",,,,,
2005,guest,jury,,7th Orbit Competition ,"Anne, Herion",,Belgium,,"During her studies of journalism, Anne Herion decides to go to Belfast, Rome and Serbia to make reports. After that, she studies the political sociology of Central and Eastern Europe for one year. Around the same time, she starts working in a small videoshop in the heart of Brussels, l’Excellence. Two years later, she buys the shop and transforms it into thé centre of the Brussels movie buff: she expands the collection original versions with Russian and Asian titles and adds names as Miike, Tsukamoto, Murnau, Bava, Argento and Jodorowski to the fantastic shelves. Last year, she stepped into production together with two colleagues and she’s preparing the founding of a film club. In the meantime, she’ll be a member of our 7th Orbit Jury.",,,,,,,,,,Film business,,,,,,,
2005,guest,jury,,7th Orbit Competition ,"Gauthier, Keyaerts",,Belgium,,"Some people in life have all the luck, and Gauthier Keyaerts is without a doubt one of them: he has always managed to combine his two passions, music and cinema. At an early age he spends his time watching B-movies and prevents his neighbours from sleeping by playing noisy punkrock in the basement. When he’s older, he discovers radio and starts composing electronic music (as Bump and Grind and Mash’ta, for the Brussels labels Sub Rosa and Quatermass). Six albums later, the movie devil grabs him again and Keyaerts starts working as a dvd critic. And if you ask yourself what his music sounds like, you just have to listen to the sound design of this and last year’s BIFFF publicity spot. We owe it to him! ",,,,,,,,,,"Journalist , Musician",,,,,,,
2005,guest,jury,,7th Orbit Competition ,"Jean-Marie, Buchet",,Belgium,,"Jean-Marie Buchet (Jemappes, °1938) decides in 1957 to enter the Section Experimental Cinema of La Cambre. He studies photography and directs 3 short films: Discours, Comment se pendre qu’il sonorisera in 1974 and Masques (1959) which he makes in collaboration with Marc Lobet. Over the course of his career, he makes short fiction films, experimental films and documentaries. He is also director of two long features: Suzanne’s Fugue (1974) and Mireille in the Lives of Others (1979). In 1968, he works together with Robbe de Hert and in the same year, he helps to found Cinélibre. Until 2002, Buchet also supervises a workshop as a screenplay writer, script-doctor, director and production leader at the ULB (ELICIT). Since 1996, he’s a collaborator of Le Grand-Angle publications and since 1999, a film restaurateur at the Film Archive. Jean-Marie Buchet is a member of our 7th Orbit Jury and will also introduce us his short film diptych Une Fameuse Journée – Een rare dag.",,,,,,,,,,Director,,"https:,,www.imdb.com,name,nm0118155,",,,,,
2005,guest,jury,,7th Orbit Competition ,"Frank, Moens",,Belgium,,"In 1999, when everyone is jumping on the internet train, a bunch of film buffs at the VUB launches their own film critic’s website, Kutsite. 6 years later, many similar initiatives have been put in the trash can, but Kutsite is still alive and kicking and has become a strong reference in the north of the country. One of its founders and chief editor, Frank Moens,   has since then firmly put foot on wall in the small world of filmgoers. Last year, he was appointed programmer of Cinema ZED in Leuven. In this function, he also organizes the International Festival Leuven Kort. Frank Moens is a member of our 7th Orbit Jury.",,,,,,,,,,"Kutfilm , Cinema Zed",,,,,,,
2005,guest,jury,,Make-Up Competition,"Marc, Caro",,France,,,,,,,,,,,,Director,,"https:,,www.imdb.com,name,nm0001988,",,,,,
2005,guest,jury,,Make-Up Competition,"Bob, Swain",,USA,,"After several years of directing documentaries and commercials, Swaim directs his first feature in 1977, The Night of Saint-Germain des Près (with Michel Galabru and Daniel Auteuil). His second film, La Balance, sweeps various Césars, winning Best Actor, Actress and Film. Swaim goes on to direct Half Moon Street (1986), starring Michael Caine and Sigourney Weaver, followed by the thriller Masquerade (1988), with Rob Lowe and Meg Tilly, and L’Atlantide (1992), with Tchéky Karyo and Jean Rochefort. The Climb, Swaim’s latest film, entirely shot in New Zealand (with John Hurt and David Strathairn), won the prestigious UNICEF Prize for Best Feature Film at the Berlin Film Festival in 1998. Swaim just finished writing and directing the French comedy Cheap Shot. He has also adapted James Baldwin’s cult novel Giovanni’s Room and will now attend the BIFFF as president of the Body Painting Jury.",,,,,,,,,,Director,,"https:,,www.imdb.com,name,nm0841456,",,,,,
2005,guest,jury,,International short film competition,"Srdjan, Mitrovic",,,,,,,,,,,,,,,,,,,,,
2005,guest,jury,,International short film competition,"Bénédicte, Bourgois",,,,,,,,,,,,,,,,,,,,,
2005,guest,jury,,International short film competition,"Roland, Nguyen",,,,,,,,,,,,,,,,"https:,,www.imdb.com,name,nm2819425,?ref_=nv_sr_srsg_0",,,,,
2005,guest,jury,,International short film competition,"Frank, Boel",,,,,,,,,,,,,,,,,,,,,
2005,guest,jury,,International short film competition,"João, Garção Borgés",,,,,,,,,,,,,,,,"https:,,www.imdb.com,name,nm2819425,",,,,,
2005,guest,jury,,International short film competition,"Enrico, Ghezzi",,,,,,,,,,,,,,,,,,,,,
2005,guest,jury,,International short film competition,"Sandrine, Waller",,,,,,,,,,,,,,,,,,,,,
2005,guest,jury,,Belgian Short Film Competition,"Laurent, Van Wetter",,,,,,,,,,,,,,,,,,,,,
2005,guest,jury,,Belgian Short Film Competition,"Christian, Bontinckx",,,,,,,,,,,,,,,,,,,,,
2005,guest,jury,,Belgian Short Film Competition,"Micheline, Hardy",,,,,,,,,,,,,,,,,,,,,
2005,guest,jury,,Belgian Short Film Competition,"Vincent, Lannoo",,,,,,,,,,,,,,,,,,,,,
2005,guest,jury,,Belgian Short Film Competition,"Alain, Galand ""Tom Pouce""",,,,,,,,,,,,,,,,,,,,,
2005,guest,movie,,PAUL SCHRADER'S EXORCIST: THE ORIGINAL PREQUEL,"Billy, Crawford",,USA,,,,,,,,,,,,Actor,,"https:,,www.imdb.com,name,nm1116863,",,,,,
2005,guest,movie,,PAUL SCHRADER'S EXORCIST: THE ORIGINAL PREQUEL,"Paul, Schrader",,USA,,,,,,,,,,,,Director,,"https:,,www.imdb.com,name,nm0001707,",,,,,
2005,guest,movie,,WHITE NOISE,"Deborah Kara, Unger",,,,,,,,,,,,,,Actress,,"https:,,www.imdb.com,name,nm0000679,",,,,,
2005,guest,movie,,ALONE IN THE DARK,"Uwe, Boll",,,,,,,,,,,,,,Director,,"https:,,www.imdb.com,name,nm0093051,",,,,,
2005,guest,movie,,"HYPNOS, DO YOU LIKE HITCHCOCK?","Cristina, Brondo",,Spain,,"Spanish actress Cristina Brondo already caused some excitement in her native country with her performance in Cedric Klapisch’s hugely successful Europudding. Her career started some ten years ago on Catalan television. In 1999 she played alongside Victoria Abril, Javier Bardem and Sergi Lopez in Manuel Gomez Pereira’s Between Your Legs. Since then, she has nicely divided her parts between television and cinema. Cristina Brando comes to Brussels to present her two most recent films : David Carrera’ Hypnos and Dario Argento’s Do You Like Hitchcock ?",,,,,,,,,,Actress,,"https:,,www.imdb.com,name,nm0111405,",,,,,
2005,guest,movie,,THE PROMISE,"Hector, Carré",,Spain,,"Galician director Hector Carré (1960°) first studies architecture. Drawn towards the audiovisual industry, he starts to follow courses at the Faculty of Science (Imagen) and the Taller des Artes Imaginarias in Madrid. After that, Carré works as a assistant-director for publicity films and for various feature films by some great directors (Terry Gilliam, Steven Spielberg, Mario Camus). He writes numerous screenplays for television, cinema (Las Lineas Paralelas, Facede o que Queirades, La Noche Eterna, Ni Contigo Ni Sin Ti) and theatre. Carré, director of the dramatic thriller Dame Algo (Bifff, 1998), will present us his latest nail biter: The Promise, starring Carmen Maura, Spain’s leading lady of cinema. ",,,,,,,,,,Director,,"https:,,www.imdb.com,name,nm0141139,",,,,,
2005,guest,movie,,TROUBLE,"Harry, Cleven",,Belgium,,,,,,,,,,,,Director,,"https:,,www.imdb.com,name,nm0166507,",,,,,
2005,guest,movie,,FERPECT CRIME,"Alex, de la Iglesia",,Spain,,,,,,,,,,,,Director,,"https:,,www.imdb.com,name,nm0407067,",,,,,
2005,guest,movie,,INNOCENCE,"Lucille, Hadzihalilovic",,France,,"You wouldn’t suspect it, when looking at her somewhat timid appearance, but Lucille Hadzhalilovic is a pugnacious director. She has to, for she shares her life and the editing table with a director as Gaspar Noé (I Stand Alone, Irreversible). Lucille was born in Lyon, but she spent her childhood in Morocco. Once back in France, she almost immediately enters the IDHEC, where she meets the director of I Stand Alone. Together they found the production company les Cinémas de la Zone, from which they unleash rock hard films : La Première Mort de Nono, which Lucille directs, followed by Noé’s Carne, which she edits and finally I Stand Alone, which she produces. Her middle-length feature Parental Guidance breathes the influence of Noé. The beautiful Innocence, which she brings to the Bifff, is personal, elegant and above all, quite disturbing.",,,,,,,,,,Director,,"https:,,www.imdb.com,name,nm0352968,",,,,,
