edition,type,subtype,winner,title,director,year,country,premiere,competition,casting,distributor,producer,screenplay,soundtrack,subtitles,audio,length,genre,Fonction Guest,IMDB,Lien IMDB,original_title,URL Poster,text_fr,text_nl,text_en
2016,movie ,,,YAKUZA APOCALYPSE : THE GREAT WAR OF THE UNDERWORLD,Takashi Mike,2015,Japan,Belgian,,"Yayan Ruhian, Riri Furanki, Hayato
Ichihara, Denden, Masanori Mimoto, Tetsu
Watanabe, Yoshiyuki Morishita",,,,,,,115',"Action, Comedy, Horror",,,https://www.imdb.com/title/tt3675748/?ref_=nv_sr_srsg_0,,,,,"Boss Kamiura is a legend among the yakuza, seemingly invulnerable to bullets and knifes. And that’s because he’s a vampire. His most loyal henchman is Kagemaya, who’s ridiculed by the other gang members because his sensitive skin prevents him from tattooing his back like a real yakuza. One day Kamiura gets a visit from a formidable gang of foreign assassins. They give him an ultimatum. Return to the international vampire crime syndicate he left years ago… or die. Kamiura refuses and, after a fierce fight with his assailants, is torn to pieces. But just before he dies, he bites Kagemaya, transfusing his vampire powers to him. When his pupil becomes aware of his newfound strength, he seeks vengeance for the death of his master. But the opposition is improbably strong, not to say apocalyptic.
 
Even though Takashi Miike no longer churns out five movies a year (but who would blame him after all he’s given us throughout the years: The Audition, Ichi The Killer, Sukiyaki Western Django, 13 Assassins…), a new movie from the Japanese grandmaster of genre cinema remains an event. The full title of his latest cinematic feat is Yakuza Apocalypse: The Great War of the Underworld and that’s exactly what we can expect: an exciting, ultra-violent blend of vampires, gangsters, slapstick, monster movies and popular culture."
2016,guest,Knight,,,"Jaume, Balagueró",,Spain,,"Together with Alex de la Iglesia, Jaume Balaguero is probably the most famous
ambassador of Spanish genre cinema. His feature debut The Nameless from
2000, wins the most prestigious prizes (like the Golden Raven at the BIFFF,
Fantasia, Fantasporto, Sitges, etc.). He then embarks on a journey to the
States to direct Darkness (starring Oscar nominated actress Anna Paquin
and Lena Olin), followed very quickly by Fragile (starring Harrison Ford and
Calista Flockhart). But it is upon his return to Spain that he scores his biggest hit,
the low budget horror classic REC. (Silver Raven and Audience Award at the BIFFF). The
film’s success is worldwide, the American remake follows soon after and leads to a
franchise of 4 episodes. Next, he directs Sleep Tight, a monument of terror starring
Luis Tosar. Now he comes to the BIFFF 2016. Not only as the producer of Summer
Camp and as a member of the International Jury, but also as a Knight in the Order
of the Raven. Vamos!!!",,,,,,,,,,Director,,https://www.imdb.com/name/nm0049371/?ref_=nv_sr_srsg_0,,,,,
2016,guest,jury,,International Competition,"Bai, Ling",,USA,,"Bai Ling was definitely destined to triumph at the stage. At 14, she
enrolled in the Chinese Peoples Liberation Army, spending three years
entertaining the troupes at the Tibetan border. She then trades the
big plains for the big screen, moving to Hollywood in 1994 to play
in The Crow by Alex Proyas. She ends up in all the magazines and is
ranked among the 50 most beautiful women in the world by People
magazine. Her career goes in overdrive. Bai Ling plays in Oliver Stone’s
Nixon, co-stars with Richard Gere in Red Corner, moves on to the Wild
Wild West (Barry Sonnenfeld), Anna and the King (Andy Tennant) and
almost in Star Wars 3, after George Lucas cuts out her part because of
her photoshoot for Playboy. Anyway, the thing is that gorgeous Bai has a nose for good projects: Taxi
3, Southland Tales, Sky Captain and the World of Tomorrow or cult TV shows such as Lost and Entourage,
Bai Ling is simply everywhere! Even at the BIFFF!",,,,,,,,,,Actress,,https://www.imdb.com/name/nm0000499/?ref_=nv_sr_srsg_0,,,,,
2016,guest,jury,,International Competition,"Jasna, Kohoutova",,Switzerland,,"Before she started acting, Czech-born Jasna Kohoutova, graduated as a doctor in psychology. But her artistic cravings were too strong. She played
on the stage, experimented with contemporary circus (Exos Performance Project) and modern dance (Prototype Status) before falling in love with
cinema. She first played small parts in short films, before starring in La Vrai vie est ailleurs from Frédéric Choffat. With her lead part in Olivier Beguin’s Chimères,
she won 3 Best Actress Awards at various genre film festivals. At the moment, she stars in The Lake by Vincent Bonet.",,,,,,,,,,Actress,,https://www.imdb.com/name/nm1764178/?ref_=nv_sr_srsg_0,,,,,
2016,guest,President,,International Competition,"Jaume, Balagueró",,Spain,,,,,,,,,,,,Director,,,,,,,
2016,guest,jury,,International Competition,"Luigi, Cozzi",,Italy,,"Luigi Cozzi, a lifelong friend of Dario Argento, started his career
co-writing Four Flies on Grey Velvet (1971). Four years later he
partnered up with Umberto Lenzi to direct his first giallo: The
Killer must kill again starring George Hilton. And then, in 1978,
he started directing a series of cult films under his alias Lewis
Coates: Starcrash starring Caroline Munro, Christopher Plummer
and Joe “Maniac” Spinnel, Contamination (1980) and Hercules
starring Lou Ferrigno who gave up his ‘Hulky’ green lotion for a
beard (he had to seduce Sybil Danning somehow, right?). Having
worked closely with Klaus Kinski and Donald Pleasance (Vampire
in Venice), Luigi Cozzi never forgot his old pal Argento, as he lent
him a hand with the special effects of “Phenomena” and worked
as his assistant director for Two Evil Eyes (co-directed with George
A. Romero) and on The Stendhall Syndrome.",,,,,,,,,,Director,,https://www.imdb.com/name/nm0172826/?ref_=nv_sr_srsg_0,,,,,
2016,guest,jury,,International Competition,"Marc, Caro",,France,,"Fascinated by everything related to design and graphics, Marc Caro publishes his first
comics in cult magazines like Métal Hurlant and Fluide Glacial. In 1974 he meets
a certain Jean-Pierre Jeunet, also a self-taught enthusiast for wicked images.
They collaborate and direct three short films (Le Manège wins a César in 1980),
before they renew French cinema in 1991 with their cult movie Delicatessen.
After that they work together on La Cité des Enfants Perdus, while Caro also directs
video clips for Indochine and Laurent Garnier. His inimitable graphic talent captures the
attention of other artists, resulting in a collaboration with Jan Kounen (on Vibroboy and
Blueberry). He also directs a feature film on his own: Dante 01 (2008), starring Lambert
Wilson.This time it’s our pleasure to announce him as a member of our International Jury,
while he’ll also be celebrating his anniversary: our friend turns 60 in April!",,,,,,,,,,Director,,https://www.imdb.com/name/nm0001988/?ref_=nv_sr_srsg_0,,,,,
2016,guest,jury,,International Thriller Competition,"Joelle, Baumerder",,Belgium,,"She already saw herself working as a prison warden after having studied psychology and criminology,
but thanks to her work as a cultural staff worker for the municipality of Saint-Gilles, she got an
epiphany at the end of the century. Rather than imprisoning crooks she wanted to deliver books to as
many people as possible. And so in 1997 she started the ‘Maison du Livre’ that became the institute
of our capital as we know it today. Anybody who wants to do something around literature, writing
and poetry is welcome.",,,,,,,,,,,,,,,,,
2016,guest,jury,,International Thriller Competition,"Ana, Garcia",,Belgium,,"My grandma certainly lit a fire in me with her stories about ghosts, disturbing shadows in the fog
and shady “guardias civiles”! Well yeah, I was born 150 kilometers from Guernica, the 8 of October
1959. The stories she told us at night before sleeping are still haunting my dreams. No surprise that
they brought me to reading and filmmaking. After a degree in art history, a thesis on the work of
directors Gérald Frydman and Raoul Servais, I timidly dreamt about following them, but my earliest
attempts remained just drafts. However, my passion for cinema never left me in all the kind of jobs
I have done in my life. I’ve been manager of the Carte Jeune <26, an international cultural passport
which has resulted in organizing two events such as Deux fauteuils Cannes, a contest which annually
allowed two Belgian directors to be part of the Youth Jury of this great festival. In 1997, I became
Chief Commissioner of la Foire du Livre (the Brussels’ Book Fair) until last July. Literature and cinema
have been part of my daily life for almost 20 years. Today I follow my own path; that leads me to The
Polar, a festival where literature, cinema and music are celebrated.",,,,,,,,,,,,,,,,,
2016,guest,jury,,International Thriller Competition,"Gorian, Delpâture",,Belgium,,"In his young and prolific career, Gorian Delpâture has almost worked on every kind of program of
the RTBF: sports with “Projet X”, investigative journalism with “Question à la une” and “MaTerre”,
literature with “Mille-Feuilles” and “Livrés à Domicille” and also radio with “Entrez Sans Frappez”. He
is also one of the lucky few working on the only Tv-show about cinema in Belgium: “Tellement Ciné”.
As a teacher of journalism at the University of Mons, he also worked on the comic book adaptation
of Voltaire’s Candide and helped write “KISSionnaire” a dictionary about the hardrock band KISS.",,,,,,,,,,,,,,,,,
2016,guest,jury,,International Thriller Competition,"Michel, Dufranne",,Belgium,,"This booklover knew that the music academy wasn’t his thing and decided to do something more fun;
finish a Phd in Psychology at the university of Bastogne. His other passion was role playing games and
after some friendly gaming, he found himself writing for the science-fiction magazine Phénix and
Science-Fiction Magazine. This opened the way for other endeavors and together with brother-in-arms
Jean-David Morvan (Le Collectionneur) he wrote two series for Casterman: La Guilde with Oscar Martin
and Helldorado with Ignacio Noé. But his love for books didn’t stop there, because he managed to be
one of the host of two RTBF literature programs: “Mille-feuilles” and “Livrés à domicile”. Just talking
with him about books will get you in the mood to read thousands.",,,,,,,,,,,,,,,,,
2016,guest,jury,,7th Orbit Competition ,"Geoffrey,Claustriaux",,Belgium,,"While the other kids were spending their time playing soccer outside, little Geoffrey Claustriaux
was stuck at home because of his asthma. A blessing in disguise, because his many hours spent at
his house allowed him to discover the world of literature. One thing led to another and his passion
for Lovecraft pushed him into writing. He was first an online movie critic and worked at the same
time at the SPF Santé (health center). While taking the train to work, he wrote his first fiction novel,
which was published in 2012: ‘Les Royaumes éphémères: L’Odyssée du Jeune Fauve.’ He’ll continue
his ‘Royaumes éphémères’ saga while also working on other projects such as ‘Les Chroniques de
L’Après-Monde’ (2014), for which he won the 2015 Revelation Prize at the Futuriales.",,,,,,,,,,Author,,,,,,,
2016,guest,jury,,7th Orbit Competition ,"Georges, Lini",,Belgium,,"Georges Lini, founder of la Compagnie Belle de Nuit since 1998, was also artistic director of Zone
Urbaine Théâtre (ZUT) from 2004 to 2010. As an actor, he played under the direction of Dereck
Goldbi (Trainspotting, le Colonel Oiseau, Bent), Miriam Youssef (Big Shoot), Dominique Serron
(Le conte d’hiver), Wladimir Bouchner (Quai ouest), Marine Haulot (Les Jouliks), Jasmina Douieb
(La défonce), Daniel Hanssen (Ladies night, une relation pornographique) and Laurent Capelluto
(l’enfant froid). With his company he directed more than twenty plays that have been performed in
Belgium, France, Germany and Luxembourg. Among them, we find Une petite entaille, Chroniques
et Une envie de tuer sur le bout de la langue de Xavier Durringer, La cuisine d’Elvis de Lee Hall
(Stage Price), Incendies de Wajdi Mouawad (Best Performance award), Marcia Hesse de Fabrice
Melquiot (nominated for the mise-en-scène), L’ouest solitaire de Martin Mc Donagh, Rien à signaler
de Martin Crimp, Britannicus de Racine and recently Un conte d’hiver d’après Shakespeare. At the
Public Theatre, he presented Youri de Fabrice Melquiot, and in September he will present Lisbeth,
of the same author, which he created at the Avignon Festival in 2014.",,,,,,,,,,Director,,,,,,,
2016,guest,jury,,7th Orbit Competition ,"Joost, Vandecasteele",,Belgium,,"Joost Vandecasteele is a Brussels based author and screenwriter.
His five published books, most recently ‘Jungle’ (2016), have been
described as disturbing and pre-apocalyptic. After working in the
theatre for several years and doing standup, he made the transition
to television. Currently he is working on a satirical series with
acclaimed Belgian director Pieter van Hees.",,,,,,,,,,,,,,,,,
2016,guest,jury,,7th Orbit Competition ,"Maxime, Dieu",,Belgium,,"Born in Mons in 1978, Maxime Dieu graduated at the ‘Institut des Hautes Ecoles des Communications
Sociales’ (IHECS). Since 2005, he’s in charge of organizing the Mons International Love Film Festival.
He’s also a music critic for the ‘Service Compris’ magazine on Télé MB and the presenter-producer
of the radio show ‘Arrête ton Cinéma’ on You FM with debates on yesterday’s and today’s cinema.",,,,,,,,,,,,,,,,,
2016,guest,jury,,European Méliès Competition ,"Freddy, Thielemans",,Belgium,,"Born and raised as a true ‘Brusseleir’, Freddy Thielemans came from a modest but engaged family.
One part were teachers, the other were socialist militants. He chose to follow in their footsteps
and started working in the teacher’s corps at the city of Brussels. He found his way in the cultural
world and became a city council member for public institutes and libraries. Some year later he got
elected as mayor of the city. Wanting to put Brussels on the map again, especially on a cultural
level, he introduces a Parisian event to the city. In 2002 the first ‘Bruxelles les bains’ is held, which
is still an ongoing successful event. A few years later he introduces the ‘Plaisirs d’hiver’, the biggest
Christmas market in Europe. Even with a busy political career, he still finds the time for his other
passions: literature, art and … motorcycles. Yes, sometimes you can see Freddy Thielemans cruising
on his Harley!",,,,,,,,,,,,,,,,,
2016,guest,jury,,European Méliès Competition ,"Manuel, Dacosse",,Belgium,,"At the age of 16 Manu Dacosse received his first camera. He has never stopped since. From making
short films with his friends, he goes professional with studies at the IAD. Traveling brought him to
Lebanon, where he learned to be an assistant cameraman. After some short movies he became DOP
for his first feature in 2008; Amer by Bruno Forzani and Hélène Cattet. This resulted in an amazing
career boost and a stream of interesting projects.",,,,,,,,,,DOP,,https://www.imdb.com/name/nm1449624/?ref_=nv_sr_srsg_0,,,,,
2016,guest,jury,,European Méliès Competition ,"Monique, Licht",,Belgium,,"Monique Licht has a career of more than four decades in movie production. In 1973 she founded
the company Olivier Films together with movie director Richard Olivier. First they concentrated
their movies and documentaries on dear old Belgium (La Belgiq’Kitch) and about the pain and
relief of taxidermy (Peaux de chagrin). In 1990 she started working as a co-producer for RTL-TVI.
She had the opportunity to collaborate to the cult movie ‘Le Huitième Jour’ by Jaco Van Dormael.
In 2007 she produced the documentary Esther Forever about a 70 year old woman, that is funny,
touching and misanthropic at the same time.",,,,,,,,,,Producer,,https://www.imdb.com/name/nm2156556/?ref_=nv_sr_srsg_0,,,,,
2016,guest,jury,,European Méliès Competition ,"Nancy, Ngoma",,Belgium,,"It might have started somewhere north of the Lake Kivu, but Nancy Ngoma soon finds her way to
Brussels. At the age of 17 she sets her first steps on Belgian soil. In 2005 she graduates with a master
degree in communication from the ULB. Her career then takes her from Tour & Taxis to the Brussels’
Public Service and finally to the cabinet of Minister President of the Brussels Capital Region. This
mother of two little vampires and a big fan of the Bifff, has an insatiable hunger for film.",,,,,,,,,,,,,,,,,
2016,guest,jury,,European Méliès Competition ,"Olivier, Mortagne",,Belgium,,"15 years have passed since Olivier Mortagne started working in the family business called Paradiso
Filmed Entertainment! As a fearless defender of cinema he always keeps an open look on film,
without distinguishing between “arthouse” and “commercial”. This leads to the distribution of
gems such as The Imitation Game, Philomena or the new Scorcese. Paradiso’s flag flies proudly
over Belgium! In 2011, Olivier creates Osmix S.A. a society that wants to simplify the development
of co-productions and, in the long term, new productions. The first film that came out of this
adventure was Olivier Hermanus’ Endless River, starring Nicolas Duvauchelle. This picture was in
competition at the Venice film festival!",,,,,,,,,,Producer,,https://www.imdb.com/name/nm3018735/?ref_=nv_sr_srsg_0,,,,,
2016,guest,jury,,European Méliès Competition ,"Pierre, Beaudot",,Belgium,,"Pierre Beaudot is al sinds zijn jongste jaren een fervente fan van de populaire cultuur. Deze
Anderlechtenaar is bezeten van muziek, film en voetbal. Het jaar is 1977 en hij krijgt zijn eerste
cultuurschok: de rauwe sound van The Ramones en The Sex Pistols, Star Wars IV en de klassieker
Dr Jekill en Mr. Hyde op de televisie. Na studies journalistiek aan de ULB baant hij zich een weg
doorheen vele radiozenders en de geschreven pers om uiteindelijk in 2000 hoofdredacteur te
worden van het tienermagazine 7extra. Sinds 2006 werkt hij voor de regionale Tv-zender Télé
Bruxelles, recentelijk omgevormd tot BX1. Naast verantwoordelijk voor de muziekprogramma’s
Undeuxtroisquatre en FSTVL, verzorgt hij ook al sinds de 30ste editie het BIFFF magazine van BX1.
Hij ook lid van de Unie van de Belgische Filmpers (UBFP).",,,,,,,,,,,,,,,,,
2016,guest,jury,,European Méliès Competition ,"Sacha, Feiner",,Belgium,,"Sacha Feiner was born in Brussels in 1982. He graduated in graphic design from the academy of La
Cambre in 2005 and began his cinematographic career with self-produced shorts and clips for the
BIFFF in 2007, 2008 and 2009. He got known internationally in 2008 with his Gremlins Fan Film,
which earned lots of praise from the special effects sector in the United States and from Joe Dante
himself. In 2012 he directs Un Monde Meilleur, a short feature with Orwellian and winner of several
international awards. Two years later, he adapts Philippe Foerster comic-strip Dernière Porte au
Sud as an animated short. It won the Magritte 2016 for Best Animation Short.",,,,,,,,,,Director,,https://www.imdb.com/name/nm5263760/?ref_=nv_sr_srsg_0,,,,,
2016,guest,jury,,Belgian Short Film Competition,"Bénédicte, Bourgois",,Belgium,,,,,,,,,,,,,,,,,,,
2016,guest,jury,,Belgian Short Film Competition,"Christian, Bontinckx",,Belgium,,,,,,,,,,,,,,,,,,,
2016,guest,jury,,Belgian Short Film Competition,"François, Stassens",,Belgium,,,,,,,,,,,,,,,,,,,
2016,guest,jury,,Belgian Short Film Competition,"Gilles, Reunis",,Belgium,,,,,,,,,,,,,,,,,,,
2016,guest,jury,,Belgian Short Film Competition,"Gökhan, Kulak",,Germany,,,,,,,,,,,,,,,,,,,
2016,guest,jury,,Belgian Short Film Competition,"Guy, Trifin",,France,,,,,,,,,,,,,,,,,,,
2016,guest,jury,,Belgian Short Film Competition,"Michel, Devillers",,Belgium,,,,,,,,,,,,,,,,,,,
2016,guest,jury,,Belgian Short Film Competition,"Natalie, Lebel",,France,,,,,,,,,,,,,,,,,,,
2016,guest,jury,,Critics Selection,"Charlotte, Timmermans ",,Belgium,,"Charlotte studied audiovisual arts at the University
of Antwerp and followed that up with a movie jury
workshop at the ‘Centrum voor Beeldexpressie’. From then on
she became a member of the UPCB. Het big passion for cinema
pushes her to organize various film related events in Brussels
(Cinema Bioscoop), in Antwerp (Cinéma Kavka), an internship
at Cinema Galeries and working at the redaction of Filmmagie.",,,,,,,,,,,,,,,,,
2016,guest,jury,,Critics Selection,"Laurent, De Groof ",,Belgium,,"Already on the school
benches, Laurent dreamt of a career in writing and started a
cultural fanzine. He went on to study directing at the cinema
school INRACI and started writing articles for various magazines.
After a career as a freelancer for movie club magazines,
he wrote more and more copy for Kinepolis, Flair, Cine-Revue,
Ecran Fantastique… But his other love is the BIFFF, where he
used to be webmaster for a couple of years and worked on
the creation of the festival videos. Now he is director in chief
at cine-files.be and editor at cinemaniacs.be.",,,,,,,,,,,,,,,,,
2016,guest,jury,,Critics Selection,"Nicolas, Balmet ",,Belgium,,"Before he was the referee of a crazy
football match between zombies and his fellow journalists,
he worked for the dvd department of Moustique magazine.
Recently he started to write for Femmes d’Aujourd’hui and
almost asked Cameron Diaz to marry him during an interview.
But he let her go to fall into the arms of Marie Gillian, a writer
for Vif Weekend. In the end he remains faithful to his big love:
genre movies.",,,,,,,,,,,,,,,,,
2016,guest,movie,,ABC'S OF SUPERHEROES,"Jens, Holzheuer",,Germany,,"Oliver Tietgen and Jens Holzheuer were both born and live in Hamburg. Oliver is an independent
filmmaker who has a successful career as an editor and director of PR films and commercials. He
directed several well received music videos. His short films were shown at festivals all over the
world. As for Jens, he started as a set-runner on several productions and worked his way up to
become producer of a German TV series. He worked as an adviser on a few documentaries and has
directed several short films. ABC’s of Superheroes is their first feature film.",,,,,,,,,,Director,,https://www.imdb.com/name/nm3829140/?ref_=nv_sr_srsg_0,,,,,
2016,guest,movie,,ABC'S OF SUPERHEROES,"Oliver, Tietgen",,Germany,,"Oliver Tietgen and Jens Holzheuer were both born and live in Hamburg. Oliver is an independent
filmmaker who has a successful career as an editor and director of PR films and commercials. He
directed several well received music videos. His short films were shown at festivals all over the
world. As for Jens, he started as a set-runner on several productions and worked his way up to
become producer of a German TV series. He worked as an adviser on a few documentaries and has
directed several short films. ABC’s of Superheroes is their first feature film.",,,,,,,,,,Director,,https://www.imdb.com/name/nm3637687/?ref_=nv_sr_srsg_0,,,,,
2016,guest,movie,,ABC'S OF SUPERHEROES,"Bai, Ling",,Germany,,,,,,,,,,,,Actress,,,,,,,
2016,guest,movie,,ATTACK OF THE LEDERHOSEN ZOMBIES,"Dominik, Hartl",,Austria,,"Dominik Hartl studied directing and script writing at the Vienna Film Academy Vienna. He has realized
over a dozen film projects within the past four years as a director, including award-winning
works such as the short Iron & Butterfly (2009), the music video Guitarstring Marked Fingerprints
(2010) and the Greenpeace commercial Cut The Crap (2008). He has also worked as an art director
for one of the biggest Austrian advertising companies. Besides his film career, Hartl is also involved
in several music projects, where he plays the clarinet, saxophone, bass-guitar and synthesizers.",,,,,,,,,,Director,,https://www.imdb.com/name/nm1542490/?ref_=nv_sr_srsg_0,,,,,
2016,guest,movie,,BANJO,"Liam, Regan",,UK,,"Liam Regan was born in 1985 and raised in South Yorkshire. He was exposed to the horror genre at
five years old by watching “ What Ever Happened to Baby Jane? ” (1962)’. He started his career with a
short movie called “ Confessions of Peltzer ”, before embarking on his ‘Banjo’ project ( which is a love
letter to movies by Lloyd Kaufman and Frank Henenlotter ) with his own production company titled
“ Cincest Films ”. Liam’s next project is a rape revenge horror movie titled “ Parents Evening ”, which
is described as ‘I Spit on Your Grave’ meets ‘Mean Girls’, and is to be produced with his production
company “ Cincest Films ”.",,,,,,,,,,Director,,https://www.imdb.com/name/nm4879635/?ref_=nv_sr_srsg_0,,,,,
2016,guest,movie,,BASKIN,"Can, Evrenol",,Turkey,,"Born and raised in Istanbul, Can Evrenol studied cinematography and art history at the University
of Kent, and went to NYFA at the Universal Studios in Los Angeles. Upon graduating, he has independently
written, directed and produced short horror films, which won many awards, and are
officially selected to the top international genre film festivals around the world, such as Sitges,
FantasticFest, Fantasia and Film4 Frightfest with more than 40 official recognitions worldwide.",,,,,,,,,,Actress,,https://www.imdb.com/name/nm3159880/?ref_=nv_sr_srsg_0,,,,,
