edition,type,subtype,winner,title,director,year,country,premiere,competition,casting,distributor,producer,screenplay,soundtrack,subtitles,audio,length,genre,Fonction Guest,IMDB,Lien IMDB,original_title,URL Poster,text_fr,text_nl,text_en
1983,movie,Opening,,TENEBRAE,Dario Argento,1982,Italy,,,"Anthony FRANCIOSA, Dario NICOLODl, John SAXON, Carola STAGNARO, John STEINER, Anja PIERONI",,,,,,,141',"Crime, Horror, Mystery ",,,"https:,,www.imdb.com,title,tt0084777,",TENEBRE,,(devrait contenir le texte!),,"An American writer of  detective novels is invited in Rome by his publishing house to talk about the promotion of his latest novel. Since his arrival in Rome, the writer finds himself in a strange adventure that is as strange as a detective novel. Together with his secretary, the writer begins an investigation….. .   "
1983,short,Closing,,ROOM SERVICE,Boris Bergman,1982,France,World,,"Nadine ALLARIE, Véronique SANSON, Elisabeth BOURGINE, Dominique MAURIN, Patrick BOUCHITEY, Dimitri RAFALSKI, J.M. CORNILLE ",,,,,,,28',Horror,,,"https:,,www.imdb.com,title,tt0310079,",,,OK,,"Boris Bergman, songwriter of singer Alain Bashung, takes us to an unknown world, to an unknown place, an area where nightmares meet. Filmed in the sewers of Paris, Room Service tells us the story of a special hotel for even more special guests. One day an intruder appears in this antechamber of death.    "
1983,movie,Hommage to Roy Ward Baker,,"ASYLUM by Roy, Ward Baker",Roy Ward Baker,1972,UK,,,"Peter CUSHING, Britt EKLAND, Herbert LOM, Patrick MAGEE",,,,,,,88',Horror,,,"https:,,www.imdb.com,title,tt0068230,",,,OK,,"Asylum follows the horrorfilms of Freddie Francis with a formula that, to this day,  is still original and frightening. All classic themes are treated in this series of anthology films, which for the most part are derived from the work of Robert Bloch, the horror author of Psycho. Hitchcock turned the book into a movie in 1960.  These films are not afraid to show pure horror, visual (the horror films of Freddie Francis) or suggestive (Asylum). They also use a lot of black humor and psychoanalysis. Asylum takes place in a psychiatric hospital where a young assistant- doctor learns that the director is back……as a patient ! His first job is to find the doctor amongst the insane. (Licorne d'Or Festival International du Film Fantastique de PARIS - 1973)"
1983,movie,Hommage to Roy Ward Baker,,QUATERMASS AND THE PIT,Roy Ward Baker,1967,UK,,,"James DONALD, Andrew KEIR, J. GLOVER et Barbara SHELLEY",,,,,,,97',"Horror, Mystery, Science-Fiction",,,"https:,,www.imdb.com,title,tt0062168,",,,OK,,"London, after the war. One day, a group of labourers find a skeleton in the metro. Immediately Dr. Roney and his assistant Barbara are called to the scene. They find a new skeleton, this time dating from prehistoric times. Further research discovers that it is actually from Mars. Based on an extraordinary screenplay by R.W. Baker and an excellent cast led by Andrew Keir and the ravishing Barbara Shelley ( also known for Dracula, Prince of Darkness). Quatermass & The Pit is not only a remarkable science fiction movie from the Hammer studios, it is also, just like King Kong or Frankenstein, considered to be a masterpiece. We could even call it a cinematographic delirium!     "
1983,movie,Retro Best off,,THE EXORCIST,William Friedkin,1973,USA,,,"Ellen BURSTYN, Max VAN SYDOW, Lee J. COBB, Kitty WINN,  Jack MAC GOWRAN, Jason MILLER, Linda BLAIR",,,,,,,122',Horror,,,"https:,,www.imdb.com,title,tt0070047,",,,OK,,"Washington, the present. A little girl is possessed by the devil…..
William Peter Blatty, who adapted his own novel, and director William Friedkin have released hallucinations and nightmares upon their public. As a result, there is a renewed interest in horror movies by the producers. On the basis of that and the amount of success the film has, we can say that The Exorcist is as influential for the horror film as 2001: A Space Odyssey was for the sci-fi film."
1983,movie,Retro Best off,,2001 : A SPACE ODYSSEY,Stanley Kubrick,1968,USA,,,"Keir DULLEA, Gary LOCKWOOD, William SYLVERSTER, Franck PRICHTER, Douglas RAIN",,,,,,,149',"Adventure, Science-Fiction",,,"https:,,www.imdb.com,title,tt0062622,",,,OK,,"During the communist witch hunts in Hollywood, there is a young, hotheaded director who openly pleads for antimilitarism and dismisses American fascism with an irony that’s much sharper than the majority of films that were censored at the time. The name of that director is Stanley Kubrick.  Kubrick quickly feels the need to express himself in a big production. Film after film, he polishes his technical skills and makes sure that they stick and bite. That’s probably the main reason why he has no success with big audiences. Made after Dr. Strangelove (1964) and before A Clockwork Orange  (1971),  2001: A Space Odyssey is and remains the sci-fi film that brought the genre of sci-fi to a higher level. Producers became convinced that they should give higher budgets to sci-fi movies. Based on the short story The Sentinel by Arthur C. Clarke, we see the evolution of mankind, from cavemen to modern men. An absolute masterpiece that occupies a very important place in the history of cinema."
1983,movie,Retro Best off,,THE EYES OF THE MUMMY,Ernest Lubitsch,1918,Germany,,,"Pola NEGRI, Harry LIEDTKË, Emil JANNINGS, Max LAURENCE",,,,,,,63',"Drama, Horror",,,"https:,,www.imdb.com,title,tt0008854,",DIE AUGEN DER MUMIE MA,,OK,,"The Eyes of the Mummy  is the beginning of the collaboration of a legendary trio, Lubitsch, Negri and Janning. It was Pola who explicitly asked to be directed by Lubitsch. This first real drama by Lubitsch has Pola Negri, Emil Jannings and Harry Liedtke as the leads. A German painter falls in love with a dancer of an Egyptian temple. He kidnaps her, but is pursued by the grandmaster of the religious cult the girl belongs to. "
1983,movie,Retro Best off,,TIME AFTER TIME,Nicholas Meyer,1979,USA,,,"Malcolm Mc DOWELL, David WARNER, Mary STEENBURGEN",,,,,,,112',"Adventure, Drama, Science-Fiction",,,"https:,,www.imdb.com,title,tt0080025,",,,OK,,"London 1893, the young and enthusiastic H.G. Wells, writer, inventor and prophet, is going to reveal his newest creation for his friends: a time machine. What Wells doesn’t know, is that one of his friends is Jack The Ripper. The deception is revealed and Jack escapes with the timemachine to 1979 San Francisco. Wells pursues him. Nicholas Meyer made an excellent start as the writer-director of The Day After: ‘This film brings a very intelligent message: The Day After reminds us that even commercial films can play on higher grounds and that honest expression and excitement are not necessary enemies of each other. (Bertrand BORIE, l'Ecran Fantastique no. 14).

H.G Wells, passed away in 1946 and had this to say on his gravestone : ‘You are all damned, I told you so ! He stipulated this in his testament, out of disappointment for the war and the atomic bomb. "
1983,movie,Retro Best off,,THE PHANTOM OF THE RUE MORGUE,Roy Del Ruth,1954,USA,,,"Karl MALDEN, Claude DAUPHIN, Patricia MEDINA, Steve FORREST",,,,,,,83',"Crime, Horror, Mystery ",,,"https:,,www.imdb.com,title,tt0047348,",,,OK,,"The number of movies that are inspired by the novels or short stories by E.A. Poe is countless. The Phantom of the Rue Morgue, based on these stories, is one of the great classics of fantastic cinema. Strange and nerve racking murders are taken place in the Rue Morgue in Paris in 1903. Young and beautiful women are being murdered without any suspect. To achieve this, the killer uses strange and unknown tactics.  "
1983,movie,Retro Best off,,ROLLERBALL,Norman Jewison,1975,USA,,,"James CAAN, John HOUSEMAN, Maud ADAMS, Sir Ralph RICHARDSON",,,,,,,125',"Action, Science-Fiction, Sport",,,"https:,,www.imdb.com,title,tt0073631,",,,OK,,"Rollerball by Norman Jewison shows us a futuristic society without nations and without war where a new game is popular, Rollerball: a mixture of skating, American football and hockey. The game has a real cultstatus in a society where three days of work is enough and where everybody can enjoy his passions. Opposite this symbolic competition is the struggle of the individual against a repressive society, an anonymous and totalitarian state where everything is fixed. Jonathan E, the champion of the game, much to the dismay of the promotors, is a real hero. The kind of hero from the same mould as from Zardoz and Soylent Green. "
1983,movie,Retro Best off,,THE LEGEND OF HELL HOUSE,John Hough,1973,UK,,,"Pamela FRANKLINi Roddy Mc DOWELLi Clive REVILL, Gayle HENNICUTT",,,,,,,95',Horror ,,,"https:,,www.imdb.com,title,tt0070294,",,,OK,,"Based on the novel Hell House, written by American fantasy writer Richard Matheson (Duel, Someone is Bleeding). The film tells the story of a house where the owner, a tormented aristocrat, still haunts the property. A group of scientists are invited by a billionaire to find out if there's life after death and to cast out potential ghosts. Soon the scientists are swept away by a whirlwind of events where many of them will not come out alive"
1983,movie,Retro Best off,,PLANET OF THE APES,Franklin J. Schaffner,1968,USA,,,"Charlton HESTON, Kim HUNTER, Maurice EVANS, Roddy Mc DOWELL",,,,,,,112',"Adventure, Science-Fiction",,,"https:,,www.imdb.com,title,tt0063442,",,,OK,,"Writers often enjoy worldwide fame because of the movie adaptations of their work. Authors such as Boileau- Narcejac, Manchette, Shelley, Stoker, Leroux and even E.A. Poe are good examples. Even if Planet of the Apes isn’t as strong as the novel by Pierre Boule, the result made a huge impact on the scifi movie scene. And the end has become legendary.  "
1983,movie,Retro Best off,,HECTOR SERVADAC'S ARK,Karel Zeman,1972,Czechoslovakia,,,"Emil HORVATH Jr., Magda VASARYOVA, Frantisek FILIPOVSKI",,,,,,,74',"Adventure, Comedy,Science-Fiction",,,"https:,,www.imdb.com,title,tt0066121,",NA KOMETE,,OK,,"You could say that Karel Zeman was able to accomplish what Méliès couldn’t realise. On the Comet is an intricate little juwel of animation, a wonderful movie adventure. The director is only interested in fiction, in the fantastical. Characters escape from their painted sets. The frame goes from black to white and then to color. The actors travel from era to era. This vast caleidoscope of impressions continues to inspire. The films of Zeman are situated in a personal universe where time has no meaning, a world of illusions and discoveries.   "
1983,movie,Retro Best off,,WESTWORLD,Michael Crichton,1973,USA,,,"Yul BRUNNER, Richard BENJAMIN, James BRALIN",,,,,,,88',"Action, Science-Fictionn, Thriller",,,"https:,,www.imdb.com,title,tt0070909,",MONDWEST,,OK,,"Westworld is a film that takes place in an artificial world, where rich customers can go on a vacation ‘like everybody else’ and live in locations of the past. Westworld, Romanworld, Medievalworld….all these places are populated by smart robots, programmed to carry out a specific role (gangsters who fight out duels, bartenders, hookers, etc...). The vacationers have the time of their lives and really enjoy these ‘safe worlds’. Until the robots develop a will of their own….. "
1983,movie,Retro Best off,,THE MAGICIAN OF LUBLIN,Menahem Golan,1979,"Israel, West Germany, USA",,,"Alan ARKURj Valérie PERRINE, Louise FLETCHER, Shelley WINTERS",,,,,,,114',Drama ,,,"https:,,www.imdb.com,title,tt0079504,",,,OK,,"Imagine that all the conditions for an international success are guaranteed, can you then question the quality of the adaptation of the bestseller of Nobel winner Isaac B. Singer? Or is the result contrary to what we can imagine? This wonderful film, which offers a new perspective on Israeli cinema, is proof of the knowhow of Menahem Golan. Placed against Singer's body of work, the story of magician Yosha is the voyage of an illusionist who has the pretension to provoke the Infinite."
1983,movie,Retro Best off,,CLOSE ENCOUNTERS OF THE THIRD KIND,Steven Spielberg,1977,USA,,,"Richard DREYFUSS, François TRUFFAUT, Teri GAR, Melinda DILLON",,,,,,,138',"Drama, Science-Fiction",,,"https:,,www.imdb.com,title,tt0075860,",,,OK,,"One night, aliens abduct a four year old child. The mother witnesses the phenomenon. Not far away, a man encounters aliens. Meeting indifference or secrecy, the man and the mother forge a bond to search for an answer to this alien mysterie. Their research leads them to a special place where an extraordinary meeting will take place. "
1983,movie,Retro Best off,,FAUST,Friedrich A. Murnau,1926,Germany,,,"GOSTAEKMAN, Emil  JANNINGS, Camille HORN, Yvette  GUILBERT, Wilhem  Dl TERLE",,,,,,,107',"Drama, Fantasy, Horror ",,,"https:,,www.imdb.com,title,tt0016847,",FAUST: EINE DEUTSCHE VOLKSSAGE,,OK,,"After a meeting between God and Mephisto, the demon does everything to seduce Faust, to make a bargain with him and even take him under his wing. Finally, Faust travels to Europe and meets the Duchess of Parma. Faust, made in 1926, was the last film of Friedrich Wilhelm Murnau in Germany. It is the last manifestation of his cultural pessimism, a bleak look at the social and political downfall of Germany. A country torn apart by the consequences of the First World War and the misery that followed it. His first American film, Sunrise, came out one year later: Only twenty years are between Faust and the work of Méliès: years in which cinema blossomed. Murnau movie is still the definitive version of Faust.  "
1983,movie,Retro Best off,,ZARDOZ,John Boorman,1974,USA,,,"Sean CONNERY, Charlotte RAMPLING, Sara KESTELMAN, Sally Anne  NEWTON, John ALDERTON",,,,,,,105',"Adventure, Fantasy, Science-Fiction",,,"https:,,www.imdb.com,title,tt0070948,",,,OK,,"In 2293, the world is divided between the immortal ‘Eternals’ and the mortal ‘Brutes’. The Brutes serve the Eternals. Cracks are appearing in the system when Zed, a brute, turns against his masters. Zardoz, a film from 1973 by John Boorman, is considered one of the strangest of the genre. We are far away from the science fiction B-movies of the fifties. Scifi films from the seventies often take the guise of a fable, zoom in on ecological dangers and warn against a cold world where violence threatens civilisation.    "
1983,movie,Retro Best off,,SUSPIRIA,Dario Argento,1977,Italy,,,"Jessica HARPER, Stefania COBUCCI, Miguel BOSE, Alida VALLI, Joan BERNIETT",,,,,,,99',Horror,,,"https:,,www.imdb.com,title,tt0076786,",,,OK,,"Suzy, a young American ballerina arrives in Fribourg to take lessons at the academy led by Madame Blank. Strange occurrences, cases of possession (dreams, violence) seem to indicate that some deceased people are still dancing there. One might say that Dario Argento is one of those directors who show remarkable creativity in their esthetic choices. Discovered by the critics in the seventies with his first films, The Bird with the Crystal Plumage, The Cat o’ Nine Tails and Four Flies on Grey Velvet. Suspiria has the same style as its predecessors, but gets Argento public recognition. He can finally put his name besides the great masters of fantastic cinema."
1983,movie,Retro Best off,,METROPOLIS,Fritz Lang,1927,Germany,,,"Brigitte HELM, Rudolph KLEIN, Heinrich GEORGE, Fritz PASP",,,,,,,153',"Drama, Science-Fiction",,,"https:,,www.imdb.com,title,tt0017136,",,,OK,,"The second greatest sci-fi movie of the twenties is Metropolis by Fritz Lang. It is the archetype of the social sci-fi film. The budget was around 7.000.000 mark (The sum was so high that, although the film itself was a success, the production company went bankrupt). The shooting lasted from the 22nd of May 1925 till the 30th of Octobr 1926. 620.000 meters of celluloid were used, 8 movie stars, 25.000 men, 11.000 women, 1.100 bald men, 250 children, 3.500 pair of specially designed shoes and 50 cars. Made in 1926 in a Germany that was not yet fully recovered from the war and where some dreamt of new world domination, even the screenplay wasn’t free from controversy (It is known that Thea von Harbou was a nazi symphatizer). Lang even refused to give her credits in the film.  Metropolis is nevertheless, thanks to the special effects, the mock- ups and its history, a public favorite and a masterpiece of international cinema.   "
1983,movie,Retro Best off,,THE SARAGOSSA MANUSCRIPT,Woljciech Has,1965,Poland,,,"Z. CYBULSBI, Barbara KRAFFT, B. TYSKIWICZ",,,,,,,182',"Comedy, Drama, Fantasy",,,"https:,,www.imdb.com,title,tt0059643,",REKOPIS ZNALEZIONY W SARAGOSSIE,,OK,,"The Saragossa Manuscript, based on the picaresque novel by count Jean Potocki (aristocrat and adventurer) is directly inspired by historic events in Saragossa. It is a very unusual and enigmatic film with stories within stories. The action is situated in Spain at the beginning of the 19th century, a time that was very fertile for mysterious and fantastic stories. The film tells about an encounter between a man and two strange sisters who take him to an abandoned tavern in the Despenaperros. They offer him love and access to the world of the occult. "
1983,movie,Retro Best off,,SLEEPER,Woody Allen,1973,USA,,,"Woody ALLEN, Diane KEATON, John BECK, Marya SAMALL",,,,,,,89',"Comedy, Science-Fiction",,,"https:,,www.imdb.com,title,tt0070707,",,,OK,,"In the year 2173, doctors Melik and Orwa fight over a sarcophagus that they have found intact and near the house of Melik in the woods. In the sarcophagus lies the frozen body of Miles Monroe, who was operated on an ulcer in 1973. The operation went wrong and the doctors decided to put Miles in a cryogenic sleep until they found a solution for the problem. Melik and Orwa read all this on a card that was inserted in the coffin. The two loathe the robotisation of the society in 2173 and decide to use Miles as a ‘virus’ to defeat ‘The Great Leader’."
1983,movie,Retro Best off,,THE GOLEM by Paul Wegener & Henrik Galeen,"Paul Wegener, Henrik Galeen",1915,Germany,,,"Paul WEGENER, Albert STEINROCK, Ernest DEUTSCH, Lyda SALMONOVA",,,,,,,60',Horror ,,,"https:,,www.imdb.com,title,tt0004026,",GOLEM (DER),,OK,,"Paul Wegener and Henrik Galeen shot two versions of The Golem. One in 1914 (which was lost) and one in 1920. The Golem is a statue that comes to life and who, by command of the rabbi, defends the jewish people of the ghetto of Prague. He will nevertheless rise up against the emperor but also against the rabbi, his maker. The Golem however doesn’t look like other humanoids  or fantastical creatures from genre cinema. He can only do something when his master commands him to. He is not the outcome of scientific experiments led by mad scholars. He is the product of the intangible thoughts of a suppressed religion. He cries for revolution while other monsters from the fantastical cinema are rather reactionary. They punish man for his hubris. "
1983,movie,Retro Best off,,SOLARIS,Andreï Tarkovsky,1972,USSR,,,"D. BANIONIS, N. BONDARTCHOUK, Y, YORVETJ N. GRINKO, V. DVORJETSKI, A. SOLONITSINE",,,,,,,167',"Drama, Mystery, Science-Fiction",,,"https:,,www.imdb.com,title,tt0069293,",SOLYARIS,,OK,,"Inspired by the famous sci-fi novel of Stanislas Lem, Solaris provokes with different means the same kind of fascination as 2001: A Space Odyssey. The film also postulates the problem of the machine and the future of humanity. Tarkovski shot a movie about love where the theme of communication is seen from a different perspective. It is not a propaganda movie disguised as an allegory. His film even broke with the tradition of the Sovjet film. For a long time, the mysterious planet Solaris has drawn draws the attention of mankind. An expedition is mounted to study life there. Chris Kelvin, a well known psychologist who travels with the expedition, suddenly materializes images and apparitions. The others are starting to see strange things too… .  "
1983,movie,Retro Best off,,COMA by Michael Crichton,Michael Crichton,1978,USA,,,"Geneviève BUJOLD, Michael DOUGLAS, Elizabeth ASHLEY, Rip TORN, Richard WIDMARK",,,,,,,113',"Drama, Horror, Mystery",,,"https:,,www.imdb.com,title,tt0077355,",,,OK,,"Nancy Greenly is admitted to the Boston Memorial Hospital for a curettage and suddenly lapses into a coma during reanimation. Her best friend Susan Wheeler, an intern at the hospital, wants to find the cause no matter what. During her investigation, a dumbfounded Susan discovers that there are ten similar cases registered in the Boston Memorial Hospital this year. The warden, who knows of Susan's investigation, puts an end her quest. Concerned about her wellbeing, he asks her to go and pay a visit to the psychiatrist. A few hours later Susan finds out that an American football player, brought in for minor surgery, also lapsed into a coma. "
1983,movie,Retro Best off,,ALIEN,Ridley Scott,1979,USA,,,"Sigourney WEAVER, Tom SKERRITT, Veronica CARTWRIGHT, Harry Dean STANTON, John HURT, lan HOLM, Yaphet KOTTO",,,,,,,117',"Horror, Science-Fiction",,,"https:,,www.imdb.com,title,tt0078748,",,,OK,,"1979, Ridley Scott shoots Alien, one of the most remarkable science fiction movies of the 80s. A crew of seven astronauts who travel with the Nostromo, a spaceship used for commercial spaceflight, return from a mission. Suddenly, an incomprehensible message appears on the screens. It is the beginning of a terrifying history. Known for the sets and the alien design by H.R. Giger, strange doctor Kane and of course beautiful lieutenant Ellen Ripley. Jerry Goldsmith signed on for the music (Freud, Papillon, Planet of the Apes, Chinatown, The Omen). "
1983,movie,Retro Best off,,AELITA,Yakov Protozanov,1924,USSR,,,"Loulia  SOLNTSERVA, N. BATALOV, M. JAROV",,,,,,,111',"Adventure, Comedy, Drama",,,"https:,,www.imdb.com,title,tt0014646,",,,OK,,"The exceptional beauty of Yuliya Solntseva (Queen Aelita) was one of the key factors for the success of the film. Many newborn babies got the name Aelita as a result of that. 

It is not strange to say that the first real science fiction movie was a Sovjet one. Aelita by Yakov Protazanov was made in 1924 when the Oktober revolution solidified and the Sovjet state became a stable entity. The dream of a worldwide revolution, an expansion of the Sovjet ideology far beyond their own borders, is still very much alive in the film where a sovjet engineer goes to Mars and organises a revolution there. On Mars, the engineer becomes infatuated by Aelita…"
1983,movie,Retro Best off,,SCANNERS,David Cronenberg,1981,Canada,,,"Stephen LACK, Jennifer O'NEILL, Patrick McGOOHAN,  Lawrence DANE, Michael IRONSIDE",,,,,,,103',"Horror, Science-Fiction, Thriller",,,"https:,,www.imdb.com,title,tt0081455,",,,OK,,"An experiment is organised in a conference room: a ‘Scanner’ gives a lecture with the sole purpose of showing off his mental powers. A volunteer is taken to the stage to assist….The experiment begins. It goes horribly wrong: the head of the medium explodes in front of the startled crowd. A sinister organisation investigates whether they can use the horrible powers of the mediums for their own profit. The other Scanners, adversaries of the organisation, prepare themselves for a battle…. ."
1983,movie,Retro Best off,,IKARIE XB I,Jindrich Polak,1963,Czechoslovakia,,,"Z. STEPANEK, R. LUKARSKY, F. SMALIK",,,,,,,88',Science-Fiction,,,"https:,,www.imdb.com,title,tt0122111,",IKARIE XB 1,,OK,,"We are in the year 2163. Since four months, a crew navigates the vast galaxy. The good mood of the crew is disturbed by an alarm signal. A strange entity appears on the screen. Is it a comet from the system Proxima?  The closer they come, the more details they can distinguish. It’s a spaceship. Pilot Erwin and biologist Kubes put on their spacesuits and fly to the wreckage. They walk through the long corridors, pass shuttered gates and arrive at the central part of the ship where a big surprise awaits them.   "
1983,movie,Retro Best off,,SOYLENT GREEN,Richard Fleischer,1973,USA,,,"Charlton HESTON, Leigh TAYLOR-YOUNG, Chuck CONNORS, Joseph COTTEN, Edward G, ROBINSON",,,,,,,97',"Crime, Mystery, Science-Fiction",,,"https:,,www.imdb.com,title,tt0070723,",,,OK,,"The film takes place in New York in the year 2022, where the city is overrun by forty million people (half of them without a job): Society almost collapses by overpopulation, a world where mankind survives on two daily foodtablets Soylent Green. The masses eat this artificial and industrially produced food on the basis of plankton. But….there comes a time where the reserves of the oceans empty out! "
1983,movie,Retro Best off,,BLACULA,William Crain,1972,USA,,,"William MARSHALL, Vonetta McGEE, Denise NICHOLAS",,,,,,,93',"Fantasy, Horror, Romance",,,"https:,,www.imdb.com,title,tt0068284,",,,OK,,"The imposing William Marshall is the ideal actor for Blacula, the first black Dracula. Blacula is a great film and not a condescending parody. On the contrary, it is with great respect for the myth and its conventions that director William Crain tries to bring the meaning of the story to a modern audience. The disruption of our rational world by a vampire, a relic from the 19th century, offers an interesting reflection on black and white.   
Who is able to remember that it was in 1815 that Dracula cursed the black prince Mamuwalde because he had the audacity to ask the famous count to sign a petition for the abolition of slavery……! "
