edition,type,subtype,winner,title,director,year,country,premiere,competition,casting,distributor,producer,screenplay,soundtrack,subtitles,audio,length,genre,Fonction Guest,IMDB,Lien IMDB,original_title,URL Poster,text_fr,text_nl,text_en
2014,movie ,,,ARCANA,Yoshitaka Yamaguchi,2013,JAPAN,WORLD,,"Kaito, Gorô Kishitani, Morris Matsumura",,,,,,,89',"Horror, Thriller",,OK,"https:,,www.imdb.com,title,tt2824006,?ref_=nv_sr_srsg_1",,,,,"While pursuing a gang of ruthless killers, Detective
Murakami is ordered to a gruesome crime scene. There
he discovers Maki, a beautiful young girl clutching the torn out
heart of one of the victims. As the sole survivor of the mass
killing, Maki is its prime suspect. However, she claims to have
no memory of who she is; only that she was led to the scene by
the voices of the dead. Though her explanation is dismissed as
the lunatic ravings of a mad woman by his police higher-ups,
Murakami takes note since he too is able to see the ghosts of the
dead, a condition that has afflicted him since childhood and one
he keeps hidden from the other detectives. Claiming the murder
case as his is Yutaka Hashi from the Department of Spiritual
Affairs, a small branch of the Japanese police devoted to the
investigation of unexplained phenomena. Hashi explains to the
somewhat disbelieving detectives that Japan is experiencing an
overload of “alter egos”, doppelganger ghosts torn from the
bodies of the living that loath humans and are on a campaign
of murder and mayhem.
Arcana, the debut feature of Takashi Miike’s assistant director
Yoshitaka Yamaguchi, is a thrilling ride into supernatural madness,
based on Yua Kotegawa’s famous manga. With its unique
visual style, nervous editing and a solid portion of blood and
ghosts, this exciting flick starring Tao Tsuchiya, who made her
debut in Kurosawa’s Tokyo Sonata, heralds the discovery of a
future genre master!"
2014,movie ,,,ASMODEXIA,Marc Carreté,2014,SPAIN,WORLD,,"Albert Baró, Marta Belmonte, Pepo Blasco",,,,,,,81',Horror ,,OK,"https:,,www.imdb.com,title,tt3175438,?ref_=nv_sr_srsg_0",,,,,"Eloy de Palma is an exorcist pastor roaming the darkest
corners of the country with his granddaughter
Alba. Their mission is to help those possessed by The Evil One, an
infection of the soul that is spreading fast, especially among the
most vulnerable members of society: children, mental patients,
and drug addicts. There is also a mysterious cult following them,
making it more difficult to help those in need. Each exorcism is
tougher than the one before, and every battle with Evil reveals
a piece of young Alba’s forgotten past – an enigma that if unconcealed
could change the world as we know it.
The feature film debut of Spanish filmmaker Marc Carreté gives
a new twist to the familiar exorcist/demonic possession setup
by combining it with a road movie. The traveling horror circus
could count on a script by Mike Hostench (organizer of the Sitges
Film festival), great camerawork by DOP Jordi Dalmau and
deviliscous performances by Lluis Marco as Eloy and Claudia
Pons as Alba."
2014,movie ,,,BABY BLUES ,Leong Po-chih,2013,CHINA  ,EUROPEAN,,"Raymond Lam, Hoi-Pang Lo, Karena Ng",,,,,,,92',Horror,,OK,"https:,,www.imdb.com,title,tt2375318,?ref_=nv_sr_srsg_3",,,,,"Songwriter Tao and blogster Snowy are newlyweds.
They’re able to buy a big old house for a bargain price.
It’s still full of stuff from the previous owner, including Jimmy, a
doll that would make a perfect toy for their future children. And
they don’t have to wait long, because Snowy becomes pregnant
with twins. It’s a bit unusual, as they’ve never had twins in their
families. Then tragedy strikes. Only one of the babies survives
birth. Snowy plunges into a profound postnatal depression and
starts to confuse Jimmy with her stillborn child. When the doll
shows signs of life, Snowy is ready to believe in miracles. But
Jimmy’s intentions are extremely malicious.
Chucky’s Chinese cousin causes havoc in Hong Kong! Baby Blues
3D is a horror film with lots of talent in front of and behind the
camera: director Po-Chih Leong ( The Wisdom of Crocodiles,
BIFFF 1999 ), DOP Chi Ying Chan ( The Man With the Iron Fists,
Detective Dee ) and actor Raymond Lam ( The Sorcerer and the
White Snake )."
2014,movie ,,,BEYOND BEYOND,Esben Toft Jacobsen,2014,"DENMARK , SWEDEN",BELGIAN,,"Gustaf Hammarsten, Lennart Jähkel, Sissela Kyle",,,,,,,78',"Animation, Adventure",,OK,"https:,,www.imdb.com,title,tt3480110,?ref_=fn_al_tt_1",,,,,"This is the story of Johan, a young rabbit who had
the perfect life: his parents loved each other and they
had a beautiful house full of carrots, surrounded by nature. But
everything turned upside down one evening, when the King of
Feathers, a boogeyman for rabbits, abducted his mother. Since
this tragic event, young Johan lives in the middle of the ocean
with his father, convinced that the infamous King of Feathers
fears water. Yet, Johan wants to find the boogeyman at all
costs. With the help of Bill, a grouchy hermit, he will put up a
stratagem to enter the extraordinary and mysterious world of
the King of Feathers. But doing so, he might mess up with the
fragile balance of the world.
After The Great Bear ( 2011 ), Esben Toft Jacobsen teams up again
with the production company Copenhagen Bombay for a journey
bigger than life destined for the entire family. Swarming
with astonishing visual ideas and shimmering colors, Beyond
Beyond’s universe was created by the visual designers who
worked on The Chronicles of Narnia and The Lone Ranger."
2014,movie ,,,BIODEGRADABLE,Juan Basanta,2013,DOMINICAN REPUBLIC,INTERNATIONAL,,"Dalisa Alegria, Liche Ariza, Ernesto Baez",,,,,,,96',"Action, Adventure, Drama",,OK,"https:,,www.imdb.com,title,tt2979922,?ref_=nv_sr_srsg_0",,,,,"In the future world, nations are replaced by projects,
managed like corporations. Neighborhoods, called
Quadrants, are closely monitored by those supervising them.
A highly armed military force, ready to take action against any
dissent, is used to maintain strict order. At the core of this society
is a single ambition, the maintenance of corporate productivity,
at all costs. Against this backdrop, Rosa and Daniel, two young
students from different Quadrants, fall in love. But Rosa’s ambitious
mother arranges a marriage with the much older Gravelli,
a powerful politician. He has no scruples to get rid of his rival.
Daniel is arrested and deported to a detention facility where
no one has ever returned from. Meanwhile Rosa withers away
in her golden cage. Will the two star crossed lovers ever see
each other again?
The debut feature of Dominican director Juan Basanta, an
adaptation of William Mejia’s novel A Rose In Fifth Hell, is a
cinematographic milestone in the history of the island nation.
It’s the first Dominican science fiction film and a very powerful
one indeed, full of action, drama, romance and, of course, an
ecological message. Excellent camerawork, great special effects
that create a credible image of a futuristic segregated society
and an international cast from Mexico, Cuba and the USA complete
the picture."
2014,movie ,,,BLACK BUTLER,"Kentaro Ohtani, Kei'ichi Sato",2014,JAPAN,INTERNATIONAL,,"Hiro Mizushima, Ayame Gôriki, Yûka",,,,,,,119',"Fantasy, Horror, Adventure, Crime, Mystery",,OK,"https:,,www.imdb.com,title,tt2630336,?ref_=fn_al_tt_2",,,,,"Mummified dead bodies of various dignitaries from
around the world are being discovered, a mysterious
tarot card left beside them at the scene. The world is headed
towards chaos. Kiyoharu is the young head of the Genpo noble
family, owners of a massive toy manufacturing enterprise. He
also functions as a secret watchdog for the Queen, a service
that his family has provided for generations. The Queen orders
Kiyoharu to solve the mummification incidents. He is assisted
by his perfect butler, Sebastian, who is actually a demon. Kiyoharu
has been hiding his true female identity since his parents’
tragic death 10 years earlier. In return for service to his master in
public and private, Sebastian will receive his master’s soul after
Kiyoharu achieves revenge for the murder of his parents. Who
is really behind the serial mummification deaths? Will Kiyoharu
finally find out who killed his parents?
Black Butler, the cult manga of Yana Toboso, is a true phenomenon.
The comic not only sold millions of copies, but was also
adapted into a anime TV-series (of which you could see several
episodes at the BIFFF), a musical comedy and a video game. The
missing link, a live adaptation for the big screen, has now been
delivered in spectacular fashion by directors Kentaro Ohtani and
Kei’ichi Sato. They’ve made the story jump some 130 years, but
don’t worry, Sebastian Michaelis remains as demonically fiendish
in the future as in the past."
2014,movie ,,,THE BORDERLANDS,Elliot Goldner,2013,UK  ,BELGIAN,,"Gordon Kennedy, Robin Hill, Aidan McArdle",,,,,,,89',Horror,,OK,"https:,,www.imdb.com,title,tt2781832,?ref_=fn_al_tt_1",,,,,"Deacon, a veteran paranormal investigator, is sent by
the Vatican to a remote church in England to confirm
a so called miracle. He’s partnered with the much younger techie
Gray. They install camera’s all over the place and put on
head-cams to register everything that will happen. Even though
Gray is agnostic and Deacon a man of the faith, the latter is the
most skeptical about the claims of local priest Crellick. Deacon’s
decades long experience has learned him that people are willing
to go very far to fake something. But the strange atmosphere in
the village is everything but fake and the further their investigation
goes, the weirder and more dangerous things become.
Yes, this is a found footage but don’t start running away just
yet. The Borderlands is not a zero budget hobby horror weekend
project of a few friends with lots of screaming and camera
sweeping and nothing much too see at all. This first feature by
Elliot Goldner benefits from a solid script and intelligently plays
with the genre concept. There’s real chemistry between the
leads and the creepy end is guaranteed not to disappoint you."
2014,movie ,,,CHIMERES,Olivier Beguin,2013,SWITZERLAND,BELGIAN,,"Jasna Kohoutova, Yannick Rosset, Catriona MacColl",,,,,,,82',"Drama, Horror, Romance",,OK,"https:,,www.imdb.com,title,tt2318564,?ref_=nv_sr_srsg_0",,,,,"Photographer Alex is on holiday with his girlfriend
Livia in her home country Romania. After a romantic
night out on the town and too much local wine, Alex gets run
over by a car. Only a massive blood transfusion is able to save
his life. Back home he seems to have completely recovered. And
there’s a big exhibition of his photos that has to be organized.
But the transfusion has some unexpected consequences. His
canines start growing, he becomes allergic to sunlight, nightmares
trouble his sleep and he only seems to be able to eat
raw meat. Slowly but surely Ales starts to realize in what he
is turning into. And Livia? She’s prepared to do everything to
save their relationship.
In 2012 young Swiss genre fanatic Olivier Beguin showed his
talent with the awarded short feature L’Employé du Mois. This
year he comes to Brussels with his feature film debut Chimères.
This vampire drama reminds you of Midnight Son ( Silver Raven
BIFFF 2011 ) because of the realistic approach to the myth. The
result is a dark romantic feast of blood and tears that was partly
shot in Brussels, right across BIFFF’s old home, Tour & Taxis!"
2014,movie ,,,DARK BLOOD,George Sluizer,2012,"NETHERLANDS , USA , UK",BELGIAN,,"River Phoenix, Judy Davis, Jonathan Pryce",,,,,,,86',Thriller,,OK,"https:,,www.imdb.com,title,tt0293069,?ref_=nv_sr_srsg_0",,,,,"This is the story of Boy a young Native-American who
retreats into the desert after his wife died of radiation
following nuclear tests near their home. Living alone and
isolated, Boy is waiting for the end of the world, spending his
days carving Katchina dolls that supposedly contain magical
powers and end up in his underground shelter. Then there’s
the Hollywood couple of Harry and Buffy who take a trip to
the desert as a second honeymoon in an attempt to save their
failing marriage. But their Bentley breaks down in the middle of
nowhere and the couple is rescued by Boy. The angry outcast has
other plans for his guests than taking them back to civilization.
He needs a woman to create a better world after the apocalypse
and feels that Buffy would be perfect for the job. Now, there’s
just one thing left: deconstructing Harry…
In 1993 the shooting of Dark Blood came to an abrupt end ten
days before wrap up due to the sudden and unfortunate death
of River Phoenix. For a long time the movie was considered to
be cursed. In 1999, director George Sluizer ( The Vanishing, Utz )
found out that the insurance company wanted to destroy the
footage and decided to save the material. He smuggled the
unedited footage out of storage and shipped it to the Netherlands.
When Sluizer faced death himself after an acute aortic
dissection in 2008, he decided to edit the “unfinished” version
of Dark Blood, adding commentary to bridge the missing scenes.
Now you’ll finally be able to see this unique dark masterpiece
at the BIFFF."
2014,movie ,,,DARK TOURIST,Suri Krishnamma,2013,USA,BELGIAN,,"Michael Cudlitz, Melanie Griffith, Pruitt Taylor Vince",,,,,,,84',"Drama, Thriller",,OK,"https:,,www.imdb.com,title,tt1719068,?ref_=nv_sr_srsg_3",,,,,"Graveyard-shift security guard Jim Tahna has a
unique hobby. He’s a grief tourist, which means that
his holiday snapshots are all about places where tragedies have
taken place. With his annual vacation coming up, he prepares
to embark on a deeply personal pilgrimage into the world of a
real-life monster, 1960’s serial murderer/arsonist Carl Marznap.
Enduring a childhood of violent sexual and emotional abuse,
Marznap blazed a fiery trail of charred bodies through a small
Northern California town. As Jim retraces Marznap’s defining
footsteps, questions of his own shadowy evolution bubble to
the surface, swirling dangerously with his rapidly deteriorating
grip on reality. A chance encounter with a local waitress
named Betsy tempts Tahana with a romantic connection and
final chance at normalcy, but when his rancid sexual impulses
and inner demons take control, the stage is set for a violent
downward spiral that unlocks an unspeakable secret festering
within, leading to a brutal and shocking finale.
Michael Cudlitz ( Surrogates, The Negotiator ) delivers a powerful
performance as a man who slowly looses touch with reality in
this gripping horror drama from Suri Krishnamma ( Wuthering
Heights, Bad Karma ). The Dark Tourist will work its way under
your skin, showing how our obsessions can make us transgress
the borders of what is bearable and tolerable. With Melanie
Griffith ( Pacific Heights, Mulholland Falls ) as Betsy and Pruitt
Taylor Vince ( Constantine, Monster ) as Carl Marznap."
2014,movie ,,,DEAD SNOW 2 : RED VS DEAD,Tommy Wirkola,2014,"NORWAY , ICELAND , UK , USA",EUROPEAN,,"Vegar Hoel, Ørjan Gamst, Martin Starr",,,,,,,100',"Comedy, Horror, Fantasy, Action",,OK,"https:,,www.imdb.com,title,tt2832470,?ref_=nv_sr_srsg_0",,,,,"Martin, the only survivor of a bunch of friends on ski
holiday who accidentally brought back a bunch of
Nazi’s from the dead, wakes up in a hospital. The authorities
do not even want to start believing him when he tries to explain
what has happened. The good news is that Martin’s sawed-off
arm is replaced by another one. The bad news is that his new
limb belongs to Colonel Herzog, the leader of the Nazi zombies.
And this arm possesses supernatural strength, which enables
him to escape from the hospital. The zombie army is ready to
finish what it started some 70 years ago: wipe out the entire
city. Martin is the only one who knows what’s coming. He’ll find
some unlikely allies in his fight against the jackbooted legion
of the undead.
Dead Snow: Red vs Dead doesn’t waste any time to explain what
went on before, but plunges us right into the action. Bigger, better,
bloodier and funnier… this second entry of the Dead Snow
franchise gives our friend Tommy Wirkola ( Kill Buljo, Hansel &
Gretel: Witch Hunters ) the chance to show that he’s a master in
blending humor with horror. This energetic sequel will certainly
create havoc with the BIFFF audience."
2014,movie ,Indian Focus,,EEGA,S.S. Rajamouli,2012,INDIA,INEDIT,,"Sudeep, Nani, Samantha Akkineni
",,,,,,,145',"Fantasy, Action, Comedy",,,"https:,,www.imdb.com,title,tt2258337,?ref_=fn_al_tt_1",,,,,"S.S. Rajamouli is one of the most
innovative Indian film directors
of the moment and Eega serves as the
perfect illustration of his talent and
imagination. The concept of the film
is so insane and over the top, but the
elaboration is entirely credible, entertaining
and convincing that you have
to see it to believe it. Genre cinema has
to make the improbable probable and
Eega pulls it off on all fronts. Our fly
doesn’t have superpowers, can’t talk
or do things ordinary flies can’t do.
And yet this puny insect will make you
believe in movie magic!"
2014,movie ,,,"GHOST IN THE SHELL : ARISE BORDER 1 , 2","Kazuchika Kise, Masahiko Murata",2013,JAPAN,BELGIAN,,"Maaya Sakamoto, Ikkyu Juku, Ken'ichirô Matsuda",,,,,,,58',"Animation, Action, Science-Fiction",,OK,"https:,,www.imdb.com,title,tt2636124,?ref_=fn_al_tt_1",,,,,"In 2027, one year after the end of the Fourth World
War, young Motoko Kusagani, major in the 501st secret
military unit, is hired by chief officer Arakami to investigate
an attack in Newport City. But our cyber-commissioner soon
finds herself in the middle of a nationwide hacking crisis that
threatens the lives of millions of citizens. Moreover, her well
known talents in the hacking business don’t help Motoko, as
they turn her into a potential suspect. But, between fighting
cyborg mercenaries who want to spread a virus on the Internet
and the intrigues and conspiracies between the members of
the 501st, Motoko has little time to pop up at the precinct for a
cross-examination.
Almost 20 years after the release of Mamoru Oshii’s Ghost in the
Shell, the BIFFF brings you two episodes of the awaited prequel:
Ghost Pain and Ghost Whisper. Both directed by Kazuchika Kise,
an anime veteran who has worked on the genesis of GITS and
also on Jin-Roh, Evangelion and Vampire Hunter D: Blood Lus,
these new episodes are a mind-blowing mix of heavy battles,
cutting edge scifi, action and a whodunit that would make
Sherlock Holmes tear his hair out."
2014,movie ,Indian Focus,,GO GOA GONE,"Krishna D.K., Raj Nidimoru",2013,INDIA,BELGIAN,,"Saif Ali Khan, Kunal Khemu, Vir Das",,,,,,,108',"Comedy, Horror, Action, Science-Fiction",,OK,"https:,,www.imdb.com,title,tt2436516,?ref_=fn_al_tt_1",,,,,"Hardik and Luv are two dope heads who tag along
to Goa with their best buddy Bunny on his business
trip. Luv comes across free-spirited girl Luna who casually invites
them to an exclusive underground rave party on a remote
island. The party is the brainchild of the Russian Mafioso Boris,
a testing ground for the launch of the ultimate party drug. But
something is not right, or should we say rotten, on this island.
All of a sudden, zombies are popping up everywhere. Where did
they come from and who is Boris really? And why has this coldhearted
drug-dealing gangster kingpin come to save their lives?
Together they need to get the hell out of this infected island!
India already has had to deal with monsters, ghosts, witches and
vampires, but zombies are relatively new to the subcontinent.
“Blame it on globalization”, as one of our three unlikely antiheroes
utters, while he learns by trial and lots of error how to
fight the undead. Go Goa Gone makes history as the very first
Indian zombie comedy, at least if we try to forget Kondaveeti
Donga ( http://www.youtube.com/watch?v=zDKcevMFUCo ). It’s
a refreshing and genuinely funny picture, with lots of extra
laughs as a bonus for those who are familiar with Bollywood
cinema."
2014,movie ,,,HAUNTER,Vincenzo Natali,2013,"CANADA , FRANCE",BELGIAN,,"Abigail Breslin, Peter Outerbridge, Michelle Nolden",,,,,,,97',"Fantasy, Horror, Mystery, Thriller",,OK,"https:,,www.imdb.com,title,tt2345567,?ref_=nv_sr_srsg_0",,,,,"It’s Sunday, the eve of Lisa’s 16th birthday. Outside, a
heavy fog surrounds the house and Lisa is about to
sulk the entire day. Her younger brother Robbie plays with his
imaginary friend, her mother asks her to do the laundry, her
father works in the garage and they will eat pancakes in the
morning, macaroni with cheese for lunch and a hearty meatloaf
for dinner before they all settle down in front of the television.
Lisa goes to sleep. It’s Sunday, the eve of Lisa’s 16th birthday.
Fog, pancakes, macaroni and meatloaf. Every day Lisa is forced
to relive the same events until she can’t take it anymore. She
decides to change her daily routine by locking herself up in the
attic, where she makes a disconcerting discovery. It’s Sunday,
the eve of Lisa’s 16th birthday. And this time her family acts
differently, to Lisa’s big relief. But then someone knocks at the
door…
Vincenzo Natali, cult director of Cube, Cypher and Nothing ( all
three screened at the BIFFF ) is back with a haunted house movie
and a mysterious puzzle to solve. If you’re in the mood to peel
off some some ghostly layers, join Abigail Breslin ( Zombieland,
Signs ) and the always excellent Stephen McHattie ( Torment,
Pontypool, Watchmen ) in Haunters."
2014,movie ,,,HELTER SKELTER,Mika Ninagawa,2012,JAPAN,BELGIAN,,"Gô Ayano, Lily Franky, Kiko Mizuhara",,,,,,,127',"Horror, Drama",,OK,"https:,,www.imdb.com,title,tt2147319,?ref_=nv_sr_srsg_5",,,,,"Tokyo. Lilico is a supermodel whose perfect appearance
and style make her the object of intense jealousy
among young women. Her face is on the front of every fashion
magazine, she is featured in advertisements shown on giant
outdoor television screens on the city’s buildings and her career
is taking her into movies and TV dramas. At the top of the entertainment
industry, she is everywhere all over Japan. Bathing
in the glow of camera’s, clothed in the latest fashions, and with
an army of assistants behind her, Lilico stands at the pinnacle
of beauty. Her private life is also going well. Her relationship
with Takao Nanbu, heir to the Nanbu Holdings fortune, seems
well on its way to marriage. But behind the glittering stage on
which she is the envy of all, there is a clock whose ticking only
Lilico can hear. Because she has a deep, dark secret.
The second feature of photographer and video clip director Mika
Ninagawa ( Sakuran ) is an adaptation of Kyoko Okazaki cult
manga. Helter Skelter is an extremely stylish and baroque attack
on the cultus of appearance. Visually this is one of the most
fascinating films in recent years. The dazzling array of colors and
the decadent, exuberant sets are a reflection of the deranged
psyche of its disturbed protagonist, a stand out performance by
Erika Sawajiri ( Shinobi, Ghost Train ). Helter Skelter is the kind of
movie that’s way to unusual, unique and bizarre to be shown in
the multiplexes, but it’s right up BIFFF’s alley."
2014,movie ,,,THE INCREDIBLE TRUTH,Leong Tak-sam,2012,"HONG KONG , CHINA",EUROPEAN,,"Christy Chung, Yan Liu, Denden",,,,,,,91',Horror,,OK,"https:,,www.imdb.com,title,tt2334350,?ref_=fn_al_tt_1",,,,,"Beautiful model Jiajia has lost her heart to her Japanese
boyfriend Shimizu. She follows him to his native
country, where he’ll introduce her to her family, the owners of
an inn in a remote mountain region known for its warm water
springs. She regularly sends news to her stylist and best friend
Wai. Then the messages stop coming and a worried Wai travels
to Japan to find Jiajia. She gets a cold welcome from Shimizu’s
mother, who runs the inn with an iron hand, while her son seems
to be in an alcoholic stupor all the time. But the worst of all is
that no one knows where Jiajia is. And then the first murder
happens. Nobody is safe from the killer who seems to target
the inhabitants of the inn. All traces lead to Jiajia…
There are a whole lot of dark family secrets in the closet in The
Incredible Truth, a mystery thriller by Tak-Sam Leong (Colour
of Pain, Explosive City). This Chinese-Japanese co-production
guides you through a web of intrigue with an astonishing and
shocking conclusion. Starring Megumi Kagurazaka (13 Assassins,
Cold Fish, Guilty of Romance), Jun Kunimura (Kill Bill) and Christy
Chung (Samsara, The Medaillon)."
