edition,type,subtype,winner,title,director,year,country,premiere,competition,casting,distributor,producer,screenplay,soundtrack,subtitles,audio,length,genre,Fonction Guest,IMDB,Lien IMDB,original_title,URL Poster,text_fr,text_nl,text_en
2016,movie ,"The Night, 34th Fantastic Night",,HARDCORE HENRY,Ilya Naishuller,2015,"Russia , USA",Belgian,,"Haley Bennett, Sharlto Copley, Danila
Kozlovsky, Cyrus Arnold, Ilya Naishuller,
Darya Charusha",,,,,,,96',"Action, Adventure, Science-Fiction",,,https://www.imdb.com/title/tt3072482/?ref_=nv_sr_srsg_0,,,,,"You wake up and you remember nothing. And that’s because your wife has just brought you back from the dead. Her name is Estelle and she’s a brilliant scientist. She tells you that you’re Henry and that you are now a cyborg super soldier. Five minutes later you see how Estelle’s kidnapped and you have to go get her back. Who took her? His name is Akan. He’s a psychopathic megalomaniac bent on world domination with a legion of mercenaries at his disposal. You’re also in Moscow, a city you don’t know at all. And everybody wants you dead. Good luck, Henry!

A few years ago a video clip directed by Illya Naishuller for his band Biting Elbows went viral on the internet. The breathtaking non-stop pursuit of a supernatural gizmo in first person shooter perspective was also seen by Timur Bekmambetov, the Russisian maestro of the action thriller, who thought it would make a terrific long feature. With Bekmambetov as producer, Naishuller transformed his concept into an energetic, kinetic, adrenaline charged scifi action epic bursting with sick humor and extreme violence. So fasten your seatbelts and get ready for an overwhelming, all senses crushing ride, driven by Neil Blompkamp’s fetisj-actor Sharlto Copley (District 9, Elysium, Chappie) as Henry."
2016,movie ,"The Night, 34th Fantastic Night",,NIGHT OF THE LIVING DEB,Kyle Rankin,2015,USA,Belgian,,"Maria Thayer, Chris Marquette, Ray
Wise, Michael Cassidy, Shawn C. Phillips, Syd
Wilder, Brian Sacca, Julie Brister",,,,,,,85',"Comedy, Horror, Romance",,,https://www.imdb.com/title/tt3602128/?ref_=fn_al_tt_1,,,,,"In the old days... dating was so much easier. You met each other at the prom, danced a slow and the deal was done. Now with Tinder, casual sex and friends with benefits, it’s all that more complicated. This is how we meet Deb, a charming but very timid gal that only loosens up after a couple of cocktails. After a night of heavy drinking, she wakes up in the bed of Portland’s most coveted bachelor. Deb’s in heaven and already sees their kids hopping around in the back garden of their country house. Reality quickly overtakes her when Mr. Perfect immediately ushers her out the door, ashamed that he shared the sheets with her. Deb ends up on the street for yet another walk of shame, but it will quickly turn into a run of shame because on that day there’s also a zombie apocalypse. Her attempt to survive will make her understand that it is easier to trust someone with her life, then with her heart.

We amused ourselves in 2009 with Kyle Rankin’s feature Infestation. This year, he’s back with his first zomromcom (a romantic zombie comedy like Warm Bodies or Burying The Ex). He chose an excellent cast with in the lead Maria Thayer (Game Of Power, screened at the Festival in 2009) and Ray Wise (Robocop, Twin Peaks, X-Men: First Class)."
2016,movie ,Jekino Kids Day 2016,,BATTLEDREAM CHRONICLE,Alain Bidard,2015,Martinique,Belgian,,"Yna Boulangé, Jacques Olivier
Ensfelder, Steffy Glissant, Chantal
Sacarabany-Perro, Rita Ravier",,,,,,,108',"Animation, Science-Fiction",,,https://www.imdb.com/title/tt4714032/?ref_=nv_sr_srsg_0,,,,,"In the future the Empire of Mortemonde has enslaved almost all nations on Earth. Each month everyone is forced to play the virtual reality computer game Battledream. Only those who reach a score of 1000 points are allowed to live one more month. And on top of that you can also really die in the game. Impenetrable firewalls make sure that nobody can cheat or break the codes. Syanna Meridian, a fearless young slave, decides to fight this inhuman system, together with her devoted friend Alytha Mercuri. There’s only one free nation left on the planet, Sablereve, but its leaders prefer to run rather than to fight. It’s up to Syanna to convince them to join her, but to achieve that she has to win one final game against the best players of Mortemonde, Isaac Ravengorn and Alexander Torquemada.

Battledream Chronicle is the first animated feature from the Caribbean island of Martinique. Director Alain Bidard’s labor of love took 5 years to make and was done on the tiny budget of 400.00 €. Not that it shows on the screen, but it’s not the beautiful visuals of this bleak future that are Battledream Chronicle’s biggest force. This fantastic adventure for young and old possesses true heart and is an ode to friendship, courage and integrity and an indictment against real and virtual tyranny."
2016,movie ,Jekino Kids Day 2016,,REIS NAAR HET NOORDEN,Rémi Chayé,2015,"France , Denmark",BIFFF,,"Sanne Bosman, Simon Zwiers, Erik
van der Horst, Soy Kroon, Daan van Rijssel",,,,,,,81',"Animation, Adventure, Drama",,,https://www.imdb.com/title/tt2262345/?ref_=nv_sr_srsg_0,,,,,"You could almost take Sasha, the heroine of Long Way North for a Disney Princess, but don’t be fooled. She’s much more complex. Sasha is fifteen years old and doesn’t like the world she lives in with her parents, all aristocrats at the Russian court. She’s independent, a bit stubborn and doesn’t know how to compromise. But her mother and father have everything already planned for her. She’s going to marry the adviser of the Russian Tzar, an annoying know-it-all. But Sasha is allergic to big dresses and palace life. She wants to travel and learn about the world. One day she discovers the journals and maps of her grandfather, a famous explorer who never returned from his expedition to the North pole. Sasha now knows what to do. She’ll follow her grandfather’s footsteps and finish what he started. 

Long Way North is the feature debut of French animation artist Rémi Chayé, but this is not his first exploit. He collaborated on magical and award-winning animation films such as The Isle of Black Mor (Jury Award at the Chicago International Youth Film Festival 2004) and The Secret of Kells (Audience Award Annecy 2009). His debut will appeal to everyone’s inner child. Just like Sasha, we’ll leave on a fantastic voyage of exploration and self-discovery."
2016,movie ,3rd Mad In Belgium,,LAUNDRY MAN,Johan Vandewoestijne,2016,Belgium,World,,"Ignace Paepe, Massimiliano Cerchi,
Vanessa de Largie, Ziva Marshall",,,,,,,113',Horror,,,https://www.imdb.com/title/tt4412268/?ref_=nv_sr_srsg_0,,,,,"Laundry Man is an English spoken horror film from Belgium that is inspired by the crimes of the American serial killer Jeffrey Dahmer and the Hungarian-Belgian serial killer Andras Pandy. This is linked to the dangers of surfing the many obscure chat sites on the internet, where people take on a false identity. One of these fakers is Jeff, the lead character from the movie. He pretends to be an SM mistress who’s looking for a sister to her slave Julie. That way Jeff manages to gain the trust of his victims and lure them to his flat, where a gruesome fate awaits them.
 
Laundry Man is the newest film from Johan Vandewoestijne aka James Desert. In the past he directed the cult classic Lucker the Necrophogous and produced the other Belgian cult classic Rabid Grannies. Some of his other feats are State of Mind, starring Paul Naschy and Fred Wiliamson, Parts of the Family, Engine Trouble and Purgatory. Recently he released Todeloo with popular Flemish stand-up comedian Bert Gabriels. With Laundry Man we take a deep and bloody plunge into the dark underbelly of the internet."
2016,movie ,3rd Mad In Belgium,,PAPILLON NOIR,Arno Pluquet,2016,Belgium,World,,"Grégory Baumann, Coralie Denis,
Michel Angely, Marc De Roy, Pierre-
Alexandre Kabalan",,,,,,,,,,,NO LINK,,,,,"If there is something to darken the mood after coming back from sunnier climes, it’s that damn Monday. Once again at work, your tanned skin is bleaching away in front of the PC screen, your colleagues running away when you want to show the holiday pics… That’s at least what Julie and Matthew, a couple going through a crisis, expect to get on their plate. But they’re in for a surprise. There’s no sign of life from the family. Weird guys are shouting about the end of the world in the streets, the radio spews news flashes about a virus that makes Ebola look like a common cold and people who don’t seem to be alive (but also not really dead) have taken over the city center. And if that’s not enough, they also run into a raving serial killer who believes that God has chosen him to clean up the human race. 

Al a kid Edouard Gauvin must have fallen in a box stuffed with comedies and horror films. That seems to be the only explanation why his feature debut is so rich in dark humor, horror and self-mockery. You could call it social horror with a Belgian twist. And there are some Bifff-familiars to be seen on the screen, such as Damien Marchal and Michel Angély."
2016,movie ,3rd Mad In Belgium,,SOLITAIRES: LE BAL DES SAUVAGES,Benjamin Vire,2016,Belgium,World,,"Jean Collard, Héléna Coppejans,
Nicolas Gob, Jonathan Demurger, Paul-
Emmanuel Vanhoebroeck",,,,,,,62',Drama,,,https://www.imdb.com/title/tt5425704/?ref_=nv_sr_srsg_0,,,,,"It’s New Year’s Eve and while the Brussels’ city streets are teeming with drunken revelers, the paths of two solitary souls will cross. Max, a poor sod, is drowning his existential confusion in alcohol. Julie, a young woman, finds it impossible to reconcile herself with the bitter realities of her life. But on this festive night, they’ll try to put aside their personal mess and painful pasts. Unfortunately, that past remains hot on their heels. Max’s urgent money needs drove him to commit a robbery with a trio of idiots. Juliette missed a meeting with a bottle of sleeping pills and feels the urge to try again if she can’t find anything worth living. The clock is ticking away to midnight. Whatever happens, there will be fireworks!

This cinematic experiment was filmed together over the course of several years in the margins of the system. Solitaires demonstrates the urge to free yourself from the stranglehold of classic narrative structures, with improvisation being the true driving force to the story. This emotional rollercoaster ride comes courtesy of Benjamin Viré (Cannibal, Zone), who could count on the acting talents of Helena Coppejans (Je suis mort mais j’ai des amis) and Jean Collard (Cannibal)."
2016,movie ,Burkland RTBF Special Screening,,BURKLAND,Grégory Beghin,2015,Belgium,,,"Stéphanie Van Vyve , Real Siellez,
Melissa Leon Martin",,,,,,,,,,,https://www.imdb.com/title/tt5096586/?ref_=fn_al_tt_1,,,,,
2016,movie ,,,31,Rob Zombie,2016,"USA , UK",International,,"Malcolm McDowell, Sheri Moon
Zombie, Richard Brake, Laurence Hilton
Jacobs, Jeff Daniel Phillips, Meg Foster",,,,,,,102',"Horror, Thriller",,,https://www.imdb.com/title/tt3835080/?ref_=nv_sr_srsg_0,,,,,"Halloween, 1976. A bunch of carnies are on their way to the next fair. After they’ve taken the usual shortcut, their road is blocked by a bunch of masked psychos who slaughter most of them and drag five reluctant survivors to an abandoned factory. Three gentlemen, dressed up as French aristocrats, inform them that they’ve been chosen to play a game of 31. Charly, Venus, Panda, Levon and Roscoe are let loose in a labyrinth filled with traps, while they’re being chased by a killer dwarf, three clowns with chainsaws and some very muscular neo-Nazi’s. If they manage to survive for twelve hours, freedom will await them. But their tormentors have a secret weapon in store in case they would get too far: the supreme mega psycho of them all: Doom-Head! 

Gorehounds, your wish has been fulfilled. After its world première at the Sundance Film Festival, Rob Zombie delights the BIFFF with what he describes as his most violent film ever. Please bring some watertight clothing, because there’ll be no escaping the streams of blood and intestines. Zombie has put The Chainsaw Massacre, The Running Man and Death Race in his cocktail shaker to serve us the ultimate stomach turning drink. With Malcolm McDowell as the master of ceremonies!  "
2016,movie ,,,ABC'S OF SUPERHEROES,"Jens Holzheuer , Oliver Tietgen",2015,Germany,Belgian,,"Bai Ling, Uwe Boll, Lloyd Kaufman,
Fred Olen Ray, Jorg Buttgereit, Aramis
Merlin, René Wiesner",,,,,,,86',"Action, Comedy, Fantasy",,,https://www.imdb.com/title/tt4515698/?ref_=nv_sr_srsg_0,,,,,"Yes we know, super heroes are everywhere for the moment. Not one month without a big release by Marvel or DC. But who's to blame? They give us security, keep the world in balance, make sure there is enough cheese on the nachos and runs towards you to save you from the most uncomfortable situations. But sometimes the dangers are so great that a single super hero is no longer enough. How will they compete against bad guys with satanic grins and ridiculous names like Sea Motherfucker, Orgasmic Octopus, Menstru Girl, Shistorm, Cheese Guevara, VHS Man and many others. It's like your adolescent fanfiction came to life in one movie!

Movies that go over the top and contain a ton of B and Z film references always have had a special place in our program. Because let's be honest. What's worse? Your favorite superheroes getting mangled by Disney, which next to Marvel also has “super productions” such as Violetta and the Little Princess Sofia, or handing over the superhero culture to two lunatics called Jens Holzheuer and Oliver Tietgen? In this ABC you’ll meet a fighting super Jésus, a sick (wasn't he always?) Hitler and many other crazy characters with the voluntary (or forced) participation of Bai Ling (The Crow), Jörg Buttgereit (German Angst), Lloyd Kayfman (The Toxic Avenger) and Uwe Boll (The Postal). Elastic underwear is strongly recommended during this projection!"
2016,movie ,,,ABSOLUTELY ANYTHING,Terry Jones,2015,"UK , USA",Belgian,,"Simon Pegg, Kate Beckinsale, Sanjeev
Bhaskar, Rob Riggle, Robin Williams, Joanna
Lumley, John Cleese, Terry Gilliam, Eric Idle,
Terry Jones, Michael Palin",,,,,,,85',"Comedy, Science-Fiction",,,https://www.imdb.com/title/tt1727770/?ref_=nv_sr_srsg_0,,,,,"The Intergalactic Council: a group of bickering aliens, are going to determine the worthiness of the human race by granting one randomly chosen person the power to make anything they wish come true. If they use this ability for good, Earth can join the ranks of the Council; but if the power is used selfishly, the planet will be destroyed. This fate falls upon the burnt-out school teacher and frustrated writer Neil Clarke. And it’s clear that we’re going to face an uphill battle. Once Neil discovers his new gift, he immediately uses it to get closer to his pretty neighbor and feared literature critic Catherine. And he also gives a voice to his most loyal companion, his dog Dennis. Statistics also seem to be against the human race. So far, the Intergalactic Council has encountered 445,349,722 new alien species. The number granted membership: zero!

“With great power comes total irresponsibility” is the perfect tagline for this supremely ridiculous fantastic comedy directed by none other than Terry ‘Monty Python’ Jones (The Life of Brian, The Meaning of Life). And it doesn’t stop there, as the other Pythons are the voice cast of the bunch of aliens arguing over the fate of the Earth. To top it off, it’s Simon Pegg (Shaun of the Dead, Star Trek) who tries to do his utmost best to make sure we’re going to become stardust. Oh yeah, and there’s also Kate Beckinsale, Eddie Izzard, Joanna Lumley and, last but not least, the dearly departed Robin Williams as the voice of Dennis the dog. Everyone who’s not convinced by now is probably an alien hell bent on destroying the Earth."
2016,movie ,,,ASSASSINATION CLASSROOM,Eiichiro Hasumi,2015,Japan,Belgian,,"Ryosuke Yamada, Masaki Suda, Maika
Yamamoto, Kippei Shiina, Okuma Anmi,
Wakana Aoi, Kanna Hashimoto, Jiyoung
Kang, Rena Takeda, Mio Yuki",,,,,,,110',"Action, Adventure, Comedy",,,https://www.imdb.com/title/tt3853452/?ref_=nv_sr_srsg_2,,,,,"It all started when the Moon became just a pile of floating debris. The reason: a yellow tentacle monster destroyed it with supersonic speed. He’s now threatening to do the same thing to Earth. Because of his speed, no conventional bomb or weapon can touch him. He gives his ultimatum with one special condition: If nobody can kill him within a year, he’ll make the Earth explode. In the meantime, he decides to take up a position as teacher for the worst class in Japan. The faith of our planet in now in the hands of this sorry bunch of losers.
Eiichiro Hasumi might not be that well known around here, but in the land of the Rising Sun, he directed the popular movie and Tv-series Umizaru. He comes to the BIFFF with this popular manga adaptation: a wacky scifi story stuffed with absurd humor, spectacular action scenes and a cast of J-Pop hunks and cuties. How would you kill a yellow tentacle monster that movies with the speed of light? "
2016,movie ,,,ASSASSINATION CLASSROOM: THE GRADUATION,Eiichiro Hasumi,2016,Japan,International,,"Kazunari Ninomiya, Mirei Kiritani,
Ryosuke Yamada",,,,,,,118',"Action, Adventure, Comedy",,,https://www.imdb.com/title/tt4641264/?ref_=nv_sr_srsg_4,,,,,"Let’s bring you up to speed. A yellow tentacle monster has destroyed the Moon and threatens to do the same thing to the Earth. But first he’ll teach the worst class in Japan. If his students can kill him before the end of the semester, the planet will be saved. But UT (Un-killable Teacher) reveals himself to be a terrific and popular teacher who makes his pupils rise above themselves… except when it comes to killing him. Meanwhile, the second semester has started. The authorities keep training the students in perfecting their killing skills. There are some new, very lethal classmates and we find out more about the mysterious origins of UT. While snowflakes are falling down, UT makes a shocking revelation about himself. The class is split in two while the government implements the final phase of its “UT Assassination Strategy”. It’s decision time for the students of Class 3-E. What will become of the Earth and will they ever graduate? 
Assassination Classroom, the live-action adaptation of the hugely popular manga, was one of last year’s most entertaining films; a feel-good movie that was funny, spectacular, had great sfx and a real heart for outsiders. Part 1 broke box-office records in Japan and after the world première in the land of the Rising Sun, the BIFFF is the very first festival in the world to show you the long-awaited sequel. Direction was once more handled by Umizaru director Eichiro Hasumi and the cast is still supremely J-Pop certified."
2016,movie ,,,AU NOM DE LA FILLE,Vincent Garenq,2015,"France , Germany",Belgian,,"Daniel Auteuil, Sebastian Koch,
Marie-Josée Croze, Christelle Cornil,
Lilas-Rose Gilberti, Emma Besson, Christian
Kmiotek, Serge Feuillard, Fred Personne",,,,,,,87',"Biography, Crime, Drama",,,https://www.imdb.com/title/tt4228810/?ref_=nv_sr_srsg_0,,,,,"Based on a true story, KALINKA is about the struggle of Andre Bamberski to bring justice to his daughter Kalinka who died in disturbing circumstances. After 27 years of investigation to hunt down her presumed murderer, Bamberski will finally get the killer kidnapped and brought to justice."
2016,movie ,,,BAAHUBALI: THE BEGINNING,S.S. Rajamouli,2015,India,Belgian,,"Prabhas, Rana Daggubati, Anushka
Shetty, Tamannaah Bhatia, Ramya Krishna,
Sathyeraj, Nasser, S.S. Rajamouli",,,,,,,159',"Action, Drama",,,https://www.imdb.com/title/tt2631186/?ref_=nv_sr_srsg_0,,,,,"Not everybody can live in a paradise like Shivudu. For some of us he has it all: wonderful palaces, beautiful nature and the trust of the gods that he is destined for great things. But to accomplish his destiny he will need to do one thing: climb the waterfall barefoot so he can meet his dream woman. At the end of his climb, our naive dreamer will, however, arrive in the Mahismhati kingdom. It’s no wonderland with fairies and trolls, but a true terror threat level 4. Fortunately, our hero is as strong as Hercules and as smooth as Spider-Man. His biggest challenge will be the tyrant Bhalladeva, who stands between him and his loved one. And it’s no coincidence that our Indian Power Ranger looks a lot like the fallen Prince killed in battle by Bhalladeva. We had the Greek Tragedy, the Shakespearean Drama and now the Indian Peplum.
 
Two years after the delightful Eega, S.S. Rajamouli gives us the biggest Indian hit we all want to see. This isn’t only the most expensive and the highest grossing Indian movie of all times, it could easily become a world success and kick 300, Lord Of The Rings and Conan of the throne. It’s a bigger than life experience that you can’t miss at the BIFFF! "
2016,movie ,,,BANJO,Liam Regan,2015,UK,Belgian,,"James Hamer-Morton, Damian
Morter, Laurence R. Harvey, Vito Trigo, Dani
Thompson, Clay von Carlowitz, David Curtis,
Lloyd Kaufman",,,,,,,82',"Comedy, Fantasy, Horror",,,https://www.imdb.com/title/tt3283698/?ref_=nm_knf_t1,,,,,"A megalomaniac boss, colleagues harassing you, a slutty girlfriend who pokes fun at you when you can’t handle the sex and a desk buddy who is also your ex. That’s the daily life of Peltzer Arbuckle, a guy with a failed life and a dead end job. Every day his nightmare happens in broad daylight. Until the day that his failed sex life becomes the office joke… Lucky for him, parts of his imaginary friend are still laying around somewhere in his consciousness. His name is Ronnie, but this devilishly looking figure doesn’t look at all like the imaginary friends from movies like ‘inside out’. With the powers of Ronnie, Peltzer will get some work done, but not the kind of work his boss will be happy to see. Monday, bloody Monday.

Liam Regan doesn’t hide the fact that he’s inspired by absurd horror legends like Lloyd Kaufman and Michael Herz. Banjo is his very own interpretation of The Office, but then with lots of gore and bad taste. Have you ever dreamed of a version of Clerks with blood and massacres? Welcome to this English burlesque show called Banjo."
2016,movie ,,,THE BEAUTY INSIDE,Yong-Jeol Baek,2015,South Korea,Belgian,,"Han Hyo-joo, Park Seo-jun, Juri Ueno,
Lee Jin-uk, Bae Seong-woo, Lee Hyun-woo,
Ko Ah-sung",,,,,,,127',"Drama, Fantasy, Romance",,,https://www.imdb.com/title/tt4273886/?ref_=nv_sr_srsg_0,,,,,"Waking up feeling like your face is about to morph into an alternative and weird version of your previous self isn’t something new. We’ve all had this one night when we had way too much to drink. But for Woo-jin, waking up looking different is a harsh everyday reality. Since his eighteenth birthday, he has had to live with this ailment. He can turn into a man or woman and be young, old, fat, skinny, white, black, hairy or bald. Every morning is different for him. It comes as no surprise that he doesn’t have many friends. In fact he only has one and his mom, both helping him with his unusual lifestyle and his extensive wardrobe. However, his life takes a different turn when he falls in love with the gorgeous E-soo. But how will he be able to maintain his relationship with this woman, knowing he can turn from a handsome young man to a grumpy old lady in just one night! Staying awake doesn’t seem to be the solution, though.

This big screen adaptation from an American mini-series comes straight from Korea. After a career in the commercial industry, director Jong-yeol Baek presents his first full length feature. The fact that the protagonist is played by some 123 different actors is already quite the tour de force. With an interesting view on love and relationships worthy of “Groundhog Day” and “40 Days and 40 Nights”, The Beauty Inside will melt our audience’s coldest hearts."
