edition,type,subtype,winner,title,director,year,country,premiere,competition,casting,distributor,producer,screenplay,soundtrack,subtitles,audio,length,genre,Fonction Guest,IMDB,Lien IMDB,original_title,URL Poster,text_fr,text_nl,text_en
2014,guest ,jury,,7th Orbit Competition ,"Raphaël, Charlier",,Belgium,,"Raphaël Charlier graduated from the IAD theatre section in 2002. While playing with
Panach’Club, headed by Eric De Staecke, he presents the show Cybercafé at La Deux ( RTBF ).
At its inception, he joined the staff of Pure FM ( RTBF ) where he has spent many times on air
( RC4, iPure, Connexion… ) and continues to do so. At the same time, he also makes his mark
in the movies. In 2008, he incarnates Bertrand in Michaël Havenith’s series The Marvellous
Flying Box, alongside Jean-Luc Couchard. We also seen him alongside Jean-François Stévenin
in Complot d’amateurs, with Cécile de France in Soeur Sourire, in Vincent Bal’s Zig Zag Kid… At
the moment, he’s writing the script for his first short feature, produced by Tarantula.",,,,,,,,,,,,,,,,,
2014,guest ,jury,,European Méliès Competition,"Stephan, De Potter",,Belgium,,"With a degree in International Relations and Comparative Politics (UCL), Stephan De Potter
quickly finds himself in the film industry. After being head of programming at Excelsior Films
and Concorde Films, he starts working for Cinéart in 1997, where he slowly but surely climbs
the ranks. Since 2009 he’s General Manager Benelux Cineart.",,,,,,,,,,Distributor,,,,,,,
2014,guest ,jury,,European Méliès Competition ,"Nicole, Gillet",,Belgium,,"Nicole Gillet, a programming responsible of the International Francophone Film Festival of Namur
since 1992, became its managing director in 2009. She is Vice-President of ATFCiné, organizer of
the Francophone Cinema Awards, of which the first edition was held in Dakar (Senegal) in 2013.
She’s also part of the Board of Directors of the Magritte du Film, launched in Belgium in 2013.",,,,,,,,,,,,,,,,,
2014,guest ,jury,,European Méliès Competition ,"Catherine, Marchand",,Belgium,,"Those who were already at the BIFFF in 2011 may have enjoyed the Belgian touch of this costume
designer in the scary The Incident. Rewarded by a Magritte this year for her work in Vijay and I,
Catherine Marchand will see some friendly faces at the BIFFF : in Tango Libre, she had the great
pleasure to take the measures of Sergi Lopez, member of our international jury, and she also
designed the costumes in Abaltions, presented in our thriller competition!",,,,,,,,,,Costume designer,,https://www.imdb.com/name/nm0545371/?ref_=nv_sr_srsg_0,,,,,
2014,guest ,jury,,European Méliès Competition ,"Olivier, Rausin",,Belgium,,"Olivier Rausin is the executive producer, producer and co-producer of 12 short features, 8
documentaries and more than 30 feature films. Through his production company Climax films,
he has participated in films such as Séraphine (Martin Provost), Mr. Nobody (Jaco Van Dormael),
Maternelle (Philippe Blasband), Oscar et la dame Rose (Eric Emmanuel Schmitt), Les Emotifs
Anonymes (Jean Pierre Ameris), Largo Winch (Jérome Salle), Violette (Martin Provost) and
Angelique Marquise des Anges (Ariel Zeitoun). In 2012, together with Belga Films, he creates
Belga Studios, which produces films in English for the international market. Four projects are
currently under development and should emerge in 2015.",,,,,,,,,,Producer,,https://www.imdb.com/name/nm0712178/?ref_=nv_sr_srsg_0,,,,,
2014,guest ,jury,,European Méliès Competition ,"Jan, Temmerman",,Belgium,,"For thirty years the indefatigable film critic Jan Temmerman has been writing for the Flemish
daily De Morgen. This passionate movie buff, a member of the Film Critics Union and the
European Film Academy, is known as a great lover and promoter of French Cinema, for which he
received the distinction of “Chevalier dans l’Ordre des Arts et des Lettres” from former French
Minister of Culture Christine Albanel; an honor he shares with only two other compatriots,
Arno and Axelle Red.",,,,,,,,,,,,,,,,,
2014,guest ,jury,,Belgian Short Film Competition,"Michel, Devillers",,Belgium,,,,,,,,,,,,,,,,,,,
2014,guest ,jury,,Belgian Short Film Competition,"Guy, Trifin",,Belgium,,,,,,,,,,,,,,,,,,,
2014,guest ,jury,,Belgian Short Film Competition,"Tom, Pouce",,Belgium,,,,,,,,,,,,,,,,,,,
2014,guest ,jury,,Belgian Short Film Competition,"Gokhan, Kulak",,Belgium,,,,,,,,,,,,,,,,,,,
2014,guest ,jury,,Belgian Short Film Competition,"Nathalie, Lebel",,Belgium,,,,,,,,,,,,,,,,,,,
2014,guest ,jury,,Belgian Short Film Competition,"Gilles, Reunis",,Belgium,,,,,,,,,,,,,,,,,,,
2014,guest ,jury,,Critics Selection,"Katia, Bayer",,Belgium,,"After studying Cultural Mediation in Brussels, Katia worked for several years for the webzine Cinergie. Attracted by everything that is strange, mischievous, inventive and awesome, she’s the creator of Format Court, a webzine dedicated to short films (animation, fiction, documentary, experimental) where she’s editor-in-chief. For two years, Format Court is also present on the festival circuit to attribute prizes (FIFF, Filmer à tout prix, Anima, Angers, Vendôme, Brest, Court Métrange, Silhouette, ...) and also organizes short film screenings in Paris and in Brussels. She is a member of the short feature and animation selection committee for the Césars, the French Movie Awards.",,,,,,,,,,,,,,,,,
2014,guest ,jury,,Critics Selection,"Edith, Mahieux",,Belgium,,"This linguist with a degree from the ELICIT, is passionate about writing and movies. Edith Mahieux shares her time between Belgium and France. On the one hand she writes for the magazine and website Cinergie and the magazine Smala. On the other hand she’s a member of the selection committee of the Nice Short Film Festival, which became a member of the UPCB last year. She also has more than one editorial and scriptwriting project in her pocket. Eager for new films and new horizons, she joins our BIFFF press jury 2014 with lots of passion and a sense of balance.",,,,,,,,,,,,,,,,,
2014,guest ,jury,,Critics Selection,"Sarah, Skoric",,Belgium,,"This communication science graduate from Ghent specializes in cinema and visual arts. She was a recent juror at the Fantastic Film Festival of Bruges (Méliès Jury) and the Latin American Festival of Antwerp (short film jury). Sarah works for Filmmagie magazine and the website Kortfilm.be, for which she writes interviews, reviews and dossiers. She is a member of the UPCB since 2013.",,,,,,,,,,,,,,,,,
2014,guest ,movie,,PUTI,"Miguel, Alcazaren",,PHILIPPINES,,"Miguel began his filmmaking career as a stop-motion animator creating short animated films
with his brother. After graduation, Miguel established his stop-motion company Alcazaren Bros.
Animation and began focusing on advertising and television work. The company lasted for
more than a decade before Miguel moved on to live action commercial directing. He worked
on Martial Law ( 1997 ), a documentary examining life in the Philippines during the Marcos
Dictatorship. After 20 years as a multi-awarded advertising director for animation and liveaction,
Puti marks Miguel’s film debut.",,,,,,,,,,Director,,https://www.imdb.com/name/nm6482950/?ref_=nv_sr_srsg_0,,,,,
2014,guest ,movie,,THE APOSTLES,"Joe, Chien ",,TAIWAN,,,,,,,,,,,,Director,,,,,,,
2014,guest ,movie,,THE APOSTLES,"Pei-Ling, Wu",,TAIWAN,,,,,,,,,,,,Producer,,,,,,,
2014,guest ,movie,,THE MACHINE,"Caradog, W. James",,UK,,"Caradog’s debut feature was the comedy short Plastic Wolves, which was screened at festivals
all over the world. His 2005 short The Rainbow was filmed entirely on location in Iran and was
the first fiction film by a Western director to be made in the country for 15 years. Later that
year, Caradog founded Red & Black Films with John Giwa-Amu. In 2006 the duo directed their
first feature, the comedy drama Little White Lies, which was nominated for six BAFTA Cymru
Awards. Besides directing and writing The Machine, he has been commissioned to script a
number of other feature films, including a horror movie for Dan films ( whose films include
Creep and Severance ).",,,,,,,,,,Director,,https://www.imdb.com/name/nm1589670/?ref_=nv_sr_srsg_0,,,,,
2014,guest ,movie,,THE MACHINE,"Pooneh, Hajimohammadi",,UK,,"Iranian-born actress Pooneh Hajimohammadi met her future husband, Caradog W. James, in 2005
on the set of the short film The Rainbow. 8 years later, she leads the cyborg soldiers in The Machine
( presented at BIFFF this year ), and has just finished Words With Gods, an anthology with, among others,
Guillermo Arriaga ( director of Babel, 21 Grams ) Alex de la Iglesia, Emir Kusturica and Hideo Nakata !",,,,,,,,,,Actor,,https://www.imdb.com/name/nm2763519/?ref_=nv_sr_srsg_0,,,,,
2014,guest ,movie,,DISCOPATH,"Renaud, Gauthier",,Canada,,"French-Canadian Renaud Gauthier was raised on a diet of TV series such as The Price is Right,
CHiPs, Bionic Woman, The Streets of San Francisco, The Incredible Hulk, Miami Vice or Saturday
Night Live. As a very young rocker, he shook hands with Mötley Crüe in July 1984 and was
perplexed by their cadaverous appearance. He has read everything Stephen King ever wrote
and worships Alfred Hitchcock. Gauthier decided to become a filmmaker after watching Martin
Scorsese’s Goodfellas in 1990, high on caffeine. This true “Renaissance Man”, writes, directs,
produces, composes and stars in all of his productions. He currently works in the television
industry and will come with his first long feature, Discopath, to the BIFFF 2014. ( FRONTIERES )",,,,,,,,,,Director,,https://www.imdb.com/name/nm5504892/?ref_=nv_sr_srsg_0,,,,,
2014,guest ,movie,,THE FIVE,"Yeon-Shik, Jeon",,SOUTH KOREA,,"JEONG Yeon-sik ( 1967° ) studied western painting and graphic design. After winning many
art contests during his college years, he pursued storytelling as a designer and illustrator to
become a renowned TV commercial director as well as a comic-strip artist. His webcomic The
Five Hearts had an avid following, which resulted in it getting adapted into a feature film by
the creator himself !",,,,,,,,,,Director,,https://www.imdb.com/name/nm6519954/?ref_=tt_ov_dr,,,,,
2014,guest ,movie,,AUX YEUX DES VIVANTS,"Béatrice, Dalle",,FRANCE,,,,,,,,,,,,Director,,https://www.imdb.com/name/nm0001095/?ref_=nv_sr_srsg_0,,,,,
2014,guest ,movie,,AUX YEUX DES VIVANTS,"Alexandre, Bustillo",,FRANCE,,"Young French film talent Julien Maury and Alexandre Bustillo have been passionate from the
beginning about genre cinema. Julien enrolled at the Paris Ecole Supérieure de Réalisation
Audiovisuelle and directed several short films. Alexandre got a Master in Cinema and the
Audiovisual Arts from the University of Saint-Denis. Their meeting in 2005 is pure cinema
magic. This is followed one year later by their first long feature Inside, which was presented
at the BIFFF. 2011 sees the release of their second feature Livide. Now they’re back at the BIFFF
with their latest horror flick, Aux Yeux des Vivants. Maury and Bustillo will also present a
project at Frontières.",,,,,,,,,,Director,,https://www.imdb.com/name/nm2376614/?ref_=nv_sr_srsg_0,,,,,
2014,guest ,movie,,AUX YEUX DES VIVANTS,"Julien, Maury",,FRANCE,,"Young French film talent Julien Maury and Alexandre Bustillo have been passionate from the
beginning about genre cinema. Julien enrolled at the Paris Ecole Supérieure de Réalisation
Audiovisuelle and directed several short films. Alexandre got a Master in Cinema and the
Audiovisual Arts from the University of Saint-Denis. Their meeting in 2005 is pure cinema
magic. This is followed one year later by their first long feature Inside, which was presented
at the BIFFF. 2011 sees the release of their second feature Livide. Now they’re back at the BIFFF
with their latest horror flick, Aux Yeux des Vivants. Maury and Bustillo will also present a
project at Frontières.",,,,,,,,,,Director,,https://www.imdb.com/name/nm2377660/?ref_=nv_sr_srsg_0,,,,,
2014,guest ,movie,,AUX YEUX DES VIVANTS,"Fabrice, Lombot",,FRANCE,,,,,,,,,,,,Producer,,https://www.imdb.com/name/nm2133928/?ref_=nv_sr_srsg_0,,,,,
2014,guest ,movie,,PATCHTOWN,"Craig, Goodwill",,Canada,,"Goodwill’s career as a narrative writer/director launched with his debut short film, Patch Town,
which world premiered at the Toronto International Film Festival. But he began his film career
as a producer/director’s assistant on films such as Good Will Hunting, 54, Driven, Superstar,
Storm of the Century, Loser, among many others. Subsequently, Goodwill traveled the world
from Haiti to India directing and producing documentaries for National Geographic, CBC, Alliance
etc… Goodwill continues to shoot award-winning work as a commercial director for clients
such as Nike and Microsoft, but that’s none of our business : Goodwill is at the BIFFF for Patch
Town, and this magic tale is worth all the commercials in the world !",,,,,,,,,,Director,,https://www.imdb.com/name/nm0329411/?ref_=nv_sr_srsg_0,,,,,
2014,guest ,movie,,MONSOON SHOOTOUT,"Amit, Kumar",,India,,"Amit Kumar graduated in film direction from the Indian National Film School in Pune. His
student film, Judgement Day, a single shot short feature about a custodial death and its shocking
cover-up, brought him a grant for Artist Residency from the Chicago Artists International
Program. His short The Bypass, produced under UK Film Council and Film Four’s Cinema Extreme
series, premiered at the Edinburgh International Film Festival. It won the Kodak BAFTA showcase
and was the UK entry for the Kodak showcase at Cannes 2004. The film also won 2nd prize at the
Turner Classic Movies Shorts Awards at the London Film Festival and was selected as the Best
Short Film at the Indian Film Festival in Los Angeles. Monsoon Shootout is his first long feature.",,,,,,,,,,Director,,https://www.imdb.com/name/nm1193115/?ref_=nv_sr_srsg_0,,,,,
2014,guest ,movie,,NYMPH,"Milan, Todorovic",,Serbia,,,,,,,,,,,,Director,,,,,,,
2014,guest ,movie,,NYMPH,"Franco, Nero",,Italy,,,,,,,,,,,,Actor,,https://www.imdb.com/name/nm0626259/?ref_=nv_sr_srsg_0,,,,,
2014,guest ,movie,,OXV : THE MANUAL,"Blair, Mowat",,Scotland,,"Blair has composed music for well over a hundred different film and theatre projects, ranging
from films produced by Kevin Spacey to a ballet for The English National Ballet. He is a BAFTA
nominated, award-winning composer with a BA ( Hons ) in Music from Durham University and
an MA in Composition for Film and Television from Bristol University, for which he was awarded
a Distinction. In 2012 he was nominated for a Creative Scotland Award for ‘Best New Talent’ in
the Scottish arts. His recent work includes a retelling of The Happy Prince by Oscar Wilde for
Sky Arts, narrated by Stephen Fry.",,,,,,,,,,Composer,,https://www.imdb.com/name/nm3056432/?ref_=nv_sr_srsg_0,,,,,
2014,guest ,movie,,TOMBVILLE,"Nikolas, List",,Belgium,,"Nikolas List, the son of a Mexican father and an American mother, studied film directing at
the IAD in Belgium. Ange, his university end work short feature, got selected to more than 50
international film festivals and received many awards. While working on his first long feature
Tombville, which reflects the author’s dark and bizarre world, List continued to realize video
clips, produce electronic music and publish illustrated books.",,,,,,,,,,Director,,https://www.imdb.com/name/nm2796570/?ref_=nv_sr_srsg_0,,,,,
2014,guest ,movie,,TOMBVILLE,"Pierre, Lorgnay",,Belgium,,,,,,,,,,,,Actor,,https://www.imdb.com/name/nm1946933/?ref_=nv_sr_srsg_0,,,,,
2014,guest ,movie,,TOMBVILLE,"Jean-Louis, Sbille",,Belgium,,,,,,,,,,,,Actor,,https://www.imdb.com/name/nm0589603/?ref_=nv_sr_srsg_0,,,,,
2014,guest ,movie,,TOMBVILLE,"Pascal, Verhasselt",,Belgium,,,,,,,,,,,,Actor,,,,,,,
2014,guest ,movie,,GAMBLER WHO WOULDN'T DIE,"Giancarlo, Giannini",,Italy,,"With more than 100 films to his credit, Italian actor Giancarlo Gianini has a daunting pedigree. The Italian
voice of Jack Nicholson ( he’ll also receive a congratulatory letter from Kubrick himself for his work on
The Shining ), of Al Pacino, Michael Douglas or also Dustin Hoffman, the charismatic face in Hollywood
blockbusters such as Hannibal, Darkness, Man of Fire or the double James Bond whammy Casino Royale
and Quantum of Solace... Who does it better? This year, he’s at the BIFFF to present his second feature film
as a director : The Gambler Who Wouldn’t Die, in which he stars alongside F. Murray Abraham.",,,,,,,,,,Director Actor,,https://www.imdb.com/name/nm0316284/?ref_=nv_sr_srsg_0,,,,,
2014,guest ,movie,,GAMBLER WHO WOULDN'T DIE,"Silvia, De Santis",,Italy,,,,,,,,,,,,Actress,,https://www.imdb.com/name/nm0211478/?ref_=nv_sr_srsg_0,,,,,
2014,guest ,movie,,LET ME SURVIVE,"Sam, Louwyck",,Belgium,,,,,,,,,,,,Actor,,,,,,,
2014,guest ,movie,,LET ME SURVIVE,"Jean-Luc, Van Damme",,Belgium,,,,,,,,,,,,Producer,,https://www.imdb.com/name/nm0885951/?ref_=nv_sr_srsg_0,,,,,
2014,guest ,movie,,LET ME SURVIVE,"Kierston, Wareing",,UK,,,,,,,,,,,,Actor,,https://www.imdb.com/name/nm1663573/?ref_=nv_sr_srsg_0,,,,,
2014,guest ,movie,,SOULMATE,"Axelle, Carolyn",,Belgium,,,,,,,,,,,,Director,,,,,,,
2014,guest ,movie,,SOULMATE,"Gilles, Daoust",,Belgium,,,,,,,,,,,,Producer,,https://www.imdb.com/name/nm1899712/?ref_=nv_sr_srsg_0,,,,,
2014,guest ,movie,,AURA,"Zsolt, Bernath",,HUNGARY,,"Zsolt Bernath started to shoot home-made sci-fi movies when he was 11. Since then all he
wanted was making movies that entertained people. He chose not to attend film school.
Instead, he plunged into the world of independent filmmaking. He learned everything from
scriptwriting to editing and storyboarding to directing from his movie projects. Today he is
one of the defining forces in Hungarian independent cinema. For him independence means
to relentlessly pursue one’s dreams despite all the hurdles that come one’s way. After In The
Name of Sherlock Holmes, screened last year at the BIFFF, he comes to Brussels with his latest
feature : Aura.",,,,,,,,,,Director,,https://www.imdb.com/name/nm0077218/?ref_=nv_sr_srsg_0,,,,,
2014,guest ,movie,,DARK BLOOD,"George, Sluizer",,Netherlands,,"In 1971, Dutch director George Sluizer shot his first feature film in Brazil : Joao and the Knife. This
was followed by Twice a Woman, starring Bibi Andersson and Anthony Perkins. He received
international recognition in 1988 with the award-winning feature Spoorloos, which was the Dutch
Oscar entry in 1989. Three years later he directed the American remake of Spoorloos as The Vanishing,
starring Jeff Bridges, Kiefer Sutherland and Sandra Bullock. George Sluizer followed up his
American period with many international productions such as Utz, starring Armin Mueller-Stahl
( who won the Best Actor Award at the Berlin International Film Festival ), Crimetime, starring
Pete Postlethwaite and Stephen Baldwin, The Commissioner ( BIFFF 1998 ), starring John Hurt and
Rosanna Pastor and The Stoneraft, an adaptation of a novel by Nobel Prize Laureate José Saramago.",,,,,,,,,,Director,,https://www.imdb.com/name/nm0806293/?ref_=nv_sr_srsg_0,,,,,
2014,guest ,movie,,MISS CHRISTINA,"Alexandru, Maftei",,ROMANIA,,"Alexandru Maftei is a Romanian film director and scriptwriter. In 1994 he graduated from the
Bucharest Film & Theatre Academy. His first long feature, Hello ! How are you? ( 2011 ) was a
hit on the international film festival circuit : Karlovy Vary, Cairo , Palm Springs, Dublin, Monaco
( Award for Most Promising Director, Special Jury Award ), Go East Wiesbaden, Goa-India, Vilnius,
Bratislava, Transylvania, Iasi ( Special Prize of the Jury ), South East European Film Festival Los
Angeles ( The Audience Award ), Palic, Vukovar, and many others… The film was sold in more
than 20 European territories.",,,,,,,,,,Director,,https://www.imdb.com/name/nm2451020/?ref_=nv_sr_srsg_0,,,,,
2014,guest ,movie,,BIODEGRADABLE,"Juan, Basanta",,DOMINICAN REPUBLIC,,"The trademark of this Dominican director is his pronounced eye for detail. After having directed
many a video clip for the heavyweights of Latin music ( Aventura, Kat de Luna, Juan Luis Guerra,
Emilio Estefan, Daddy Yankee ), Juan Basanta takes up a new challenge with his first feature
film Biodegradable. This first Dominican science-fiction film is an adaptation of William Mejia’s
award-winning novel A Rose In Fifth Hell.",,,,,,,,,,Director,,https://www.imdb.com/name/nm2533682/?ref_=nv_sr_srsg_0,,,,,
2014,guest ,movie,,LFO,"Antonio, Tublen",,SWEDEN,,,,,,,,,,,,Director,,,,,,,
2014,guest ,movie,,LFO,"Alexander, Bronsted",,SWEDEN,,,,,,,,,,,,Producer,,https://www.imdb.com/name/nm1584407/?ref_=nv_sr_srsg_0,,,,,
2014,guest ,movie,,GOAL OF THE DEAD,"Benjamin, Rocher",,FRANCE,,"In 2003, after two short films ( Hominus Rex and Ticket Land ), Benjamin Rocher founds the
Empreinte Digitale company, for which he produces or creates programs for television, documentaries
and broadcast designs for various formats ( clips, ads… ). In 2009, he directs The
Horde, together with journalist Yannick Dahan.",,,,,,,,,,Director,,https://www.imdb.com/name/nm1119478/?ref_=nv_sr_srsg_0,,,,,
2014,guest ,movie,,PINUP DOLLS ON ICE,"Melissa, Mira",,Canada,,"In 2008, Geoff Klein produced and directed the indie slasher film Bikini Girls on Ice. The film
went on to achieve international success with screenings at over twenty film festivals. Two
years later, Melissa Mira came on board to co-produce, co-direct, and star in the sequel, Pinup
Dolls on Ice. Instead of learning their craft in a classroom, they’ve both sharpened their skills
through actual on-set experiences. As a team, they strike an impressive balance between Klein’s
visual aesthetics and Mira’s attention to detail. Priding themselves on their ability to operate
without the assistance of outside investors, Klein and Mira’s philosophy of “doing it their
way” means they can remain true to their uncompromising vision of Canadian horror cinema.",,,,,,,,,,Director,,https://www.imdb.com/name/nm5129862/?ref_=nv_sr_srsg_0,,,,,
2014,guest ,movie,,PINUP DOLLS ON ICE,"Geoff, Klein",,Canada,,"In 2008, Geoff Klein produced and directed the indie slasher film Bikini Girls on Ice. The film
went on to achieve international success with screenings at over twenty film festivals. Two
years later, Melissa Mira came on board to co-produce, co-direct, and star in the sequel, Pinup
Dolls on Ice. Instead of learning their craft in a classroom, they’ve both sharpened their skills
through actual on-set experiences. As a team, they strike an impressive balance between Klein’s
visual aesthetics and Mira’s attention to detail. Priding themselves on their ability to operate
without the assistance of outside investors, Klein and Mira’s philosophy of “doing it their
way” means they can remain true to their uncompromising vision of Canadian horror cinema.",,,,,,,,,,Director,,https://www.imdb.com/name/nm2017069/?ref_=nv_sr_srsg_0,,,,,
2014,guest ,movie,,ZOMBIE TV,"Naoya, Tashiro",,JAPAN,,"Born in 1987, Naoya Tashiro set the course for his future career as a filmmaker when his selfproduced
splatter film High School Girl of the Dead served as his graduation thesis from art
school. It later went on to great acclaim at various film festivals in Japan, and was eventually
released directly to DVD. For its home video release, Tashiro directed the short films Bloody
Bathhouse and Cannibal Maid and Killer Nurse as special features, and both also went on to
be screened at several film festivals. In November 2012, Tashiro’s first professionally-produced
work, Hell of the College Girls, received a theatrical release in Japan, as well as a simultaneous
DVD release. His latest film, Naked Sister, premiered at the 2013 Yubari Film Festival, and will
receive a later theatrical release in Japan. And, as a romantic surprise, he’ll attend the BIFFF
as a newly wed with actress Iona – who plays in Zombie TV – for their honeymoon ! Congrats !",,,,,,,,,,Director,,https://www.imdb.com/name/nm5012129/?ref_=nv_sr_srsg_0,,,,,
2014,guest ,movie,,ZOMBIE TV,"Iona, Tashiro",,JAPAN,,"Born in 1987, Naoya Tashiro set the course for his future career as a filmmaker when his selfproduced
splatter film High School Girl of the Dead served as his graduation thesis from art
school. It later went on to great acclaim at various film festivals in Japan, and was eventually
released directly to DVD. For its home video release, Tashiro directed the short films Bloody
Bathhouse and Cannibal Maid and Killer Nurse as special features, and both also went on to
be screened at several film festivals. In November 2012, Tashiro’s first professionally-produced
work, Hell of the College Girls, received a theatrical release in Japan, as well as a simultaneous
DVD release. His latest film, Naked Sister, premiered at the 2013 Yubari Film Festival, and will
receive a later theatrical release in Japan. And, as a romantic surprise, he’ll attend the BIFFF
as a newly wed with actress Iona – who plays in Zombie TV – for their honeymoon ! Congrats !",,,,,,,,,,Actress,,https://www.imdb.com/name/nm0969365/?ref_=tt_cl_t_16,,,,,
2014,guest ,movie,,DEADLY VIRTUES : LOVE. HONOUR. OBEY,"Ate, De Jong",,Netherlands,,"Dutch director, screenwriter and producer Ate de Jong has worked for Germans, British and
Americans ( he even directed an episode of Miami Vice in 1987 ). This prolific director can
also claim to have presented a double bill at the BIFFF in 1992 : Drop Dead Fred and Highway
to Hell. 22 years later, he returns with Deadly Virtues : Love.Honor.Obey, a diabolical home
invasion movie.",,,,,,,,,,Director,,https://www.imdb.com/name/nm0429517/?ref_=nv_sr_srsg_0,,,,,
