edition,type,subtype,winner,title,director,year,country,premiere,competition,casting,distributor,producer,screenplay,soundtrack,subtitles,audio,length,genre,Fonction Guest,IMDB,Lien IMDB,original_title,URL Poster,text_fr,text_nl,text_en
2012,guest,jury,,International Thriller Competition,"Philippe, Dumont",,BELGIUM,,"Philippe Dumont was born in 1954 in Brussels. He works for more than ten years as an officer in the judicial police. He
then becomes a judicial exper t, specializing in 16th and 17th century Flemish and Dutch paintings. During that period,
he also opens a private art gallery in Brussels. In 1990, he decides to realize his passion for fantastic art. Dumont
becomes a sculptor and creates personal pieces inspired by his tortured imagination. He also designs sceneries
and sets for individuals, corporations and the cinema industry. At the same time, he writes fantastic novels that are
published in France. Nowadays, he contributes to the publication of an anthology of Belgian fantastic literature.",,,,,,,,,,,,,,,,,
2012,guest,jury,,International Thriller Competition,"Gigi, Etienne",,BELGIUM,,"Gilberte Françoise Etienne is better known as Gigi Etienne. In the 70ties she shoots short features on Super 8 together with
some friends and participates to the organization of several film events : “les Rencontres du Jeune Cinéma”, “le Festival
National du Film Super 8”, ... ). In the beginning of the eighties, together with her friends Annie and Freddy Bozzo and
Georges and Guy Delmote, she founds the Brussels International Festival of Fantastic Film, Science-Fiction and Thriller.
For more than 15 years she runs the press service, the various make-up contests and the jury’s. Today Gigi Etienne rests
closely attached to the Festival team.",,,,,,,,,,,,,,,,,
2012,guest,jury,,International Thriller Competition,"Stéphane, Bourgoin",,France,,"It all started with a tragedy : the savage murder of Stéphane Bourgoin’s
partner in 1976, by what was not yet called a serial killer, a term which
was popularised by FBI agent Robert Ressler during the Ted Bundy trial.
Thirty years later, Stéphane Bourgoin has become a leading expert in serial
killers and is known worldwide for his research. He has met some 70 serial
killers from all over the world, has realised at least ten documentaries
and has published over thirty works dedicated to the phenomenon, such
as Enquête mondiale sur les tueurs en série ( 2011, Ed. Grasset ), Le Livre
noir des Serial Killers ( 2004, Ed. Grasset ), Les Crimes cannibales ( 2004 ),
L’Année du Crime ( 2006 ) and Infanticides ( 2007 ). Stéphane Bourgoin tries
to understand the psychology of these killers and opens the debate on how
they and their victims are represented in films and in the media.",,,,,,,,,,Author,,,,,,,
2012,guest,jury,,7th Orbit Competition ,"Bruce, Ellison",,BELGIUM,,"Bruce Ellison is the off screen voice of “Indian” from the popular animation series Panique au
Village. He’s also a mime and the off screen voice in several TV series and musical comedies
and the lead singer of the rock band PPZ30. In 1981, he begins his training at the International
Marceau Mime School. In 1986, he co-writes and directs the mime L’Etrange Monsieur Knight,
together with Michel Carcan. They found the Brussels’ production company Le theâtre de la
Mandragore. Nowadays, Ellison focuses on creating shows with international artists for theatre,
cinema, music and television. He also lends his voice to many advertising campaigns and
children programs.",,,,,,,,,,,,,,,,,
2012,guest,jury,,7th Orbit Competition ,"Pat, Cronenberg",,BELGIUM,,"Pat Croonenberg, born in Malines, studied languages and communication sciences. He got
bitten by the movie microbe at the age of 16, when he saw William Dieterle’s The Hunchback
of Notre Dame ( 1939). After writing an essay about his favourite actor, Charles Laughton, he
dove headlong in everything cult and horror. Since then, he has joined the press corps and has
freelanced for various media ( www.filmsalon.be, Temps Écrit Film, cinevision.be...). Pat can
always be seen at the Bifff, but he also goes to Cannes or even Las Vegas for the Adult Oscars.
Since 2009, he has founded his own company, Film & Media, for the distribution of cult movies.
As a theatre actor, he’s been active for more than ten years with the Raiders of the Lost Ark
company. Needless to say that he feels like a fish in the water at the BIFFF.",,,,,,,,,,,,,,,,,
2012,guest,jury,,7th Orbit Competition ,"François, Marache",,BELGIUM,,"François Marache came to Brussels in 1996 to study at the Insas film school. He graduated
in 2001 and started working as a freelance editor. In 2005, he directed the short feature
Nana ! Again. Marache is the creator and the organizer of the film show “Court mais Trash”,
independent short films projections at the Brussels’ cultural centre Riches-Claires. He’s also the
founder of the npo Born 2be Cheap. “Court mais Trash” is regurarly invited to shor t film festivals
in Paris, Lille, Toulouse, Brussels and others. Since 2011, the projections are also regularly
shown in Liege and Mons.",,,,,,,,,,,,,,,,,
2012,guest,jury,,7th Orbit Competition ,"Daph, Nobody",,BELGIUM,,"Daph Nobody writes in French and English and has published fantastic and horror novels for
twelve years now. His novel Blood Bar ( 2009 ) is nominated for the Chimère Award and the
Futuriales Award in 2011. Contrary to the Twilight series, Blood Bar is a more realistic horror
novel, which por trays a world in which people need blood to survive. Nobody, already compared
to masters as Stephen King, David Lynch and Edgar Allan Poe, has also written the script of A
Broken Life, starring Tom Sizemore and Ving Rhames, and the novels Les Ténèbres Nues and
La Lumière des Au-delà. His most recent novel, L’Enfant nucléaire, was published on 7 March
2012. This sensational politic thriller contains a nice dose of horror, fantasy and suspense !",,,,,,,,,,Author,,,,,,,
2012,guest,jury,,European Méliès Competition ,"Jean-Paul, Bertin",,BELGIUM,,"Jean-Paul Bertin is the General Manager of UPI Belgium. In this function, he is
responsible for the distribution of the Paramount, Universal and MGM/United
Artists films. Thanks to him, Jurassic Parc, E.T., the Back To The Future trilogy,
Carlito’s Way, Galaxy Quest, but also Hot Fuzz, Star Trek: First Contact, Troll
Hunter and many others were released in the Belgian theaters. Furthermore, UPI
has supported the Festival since the very beginning, resulting in the presentation
of films as such as Dark Crystal, Twelve Monkeys, Dune, The Last House on
The Left, Dante’s Peak, or Village of The Damned. UPI will also help with the
distribution of the winner of our European Short Film Competition.",,,,,,,,,,,,,,,,,
2012,guest,jury,,European Méliès Competition ,"Philippe, Blasland",,BELGIUM,,"Philippe Blasband, born on 26 July 1964 in Teheran from an Iranian mother and
a Belgian father of Jewish, Polish and Austrian origins, grew up in the UK, the
USA, Belgium and Iran. After the Iranian revolution of 1979, Blasband moves to
Brussels, where he studies film editing at the INSAS and dedicates himself to
writing scripts ( Une Liaison Pornographique, Le Tango des Rashevski, La Femme
de Gilles, Thomas est amoureux ), theatre plays ( Les Mangeuses de Chocolat, les
Témoins ), and novels ( Cendres et de Fumée, Le Livre des Rabinovitch, Johnny
Bruxelles ). This versatile artist has also produced some of his plays and has
directed several films such as Un Honnête Commerçant and La Couleur des
mots. He is married to actress Aylin Yay.",,,,,,,,,,,,,,,,,
2012,guest,jury,,European Méliès Competition ,"Pierre, Dejemeppe",,BELGIUM,,"Pierre Dejemeppe works at the cabinet of Charles Picqué, Minister-President
of the Brussels Capital Region. His responsibilities cover spatial planning,
monuments and historic sites, the image of Brussels, urban renewal, housing
and the Beliris project, which wants to promote Brussels as the capital of
Belgium and Europe. He already served in the same function for the previous
legislature. Dejemeppe also coordinates the sustainable regional growth
plan and was chairman of the board in 2010 at the Agency for Regional
Development ( ATO ).",,,,,,,,,,,,,,,,,
2012,guest,jury,,European Méliès Competition ,"David, Hainaut",,BELGIUM,,"David Hainaut is the new chairman of Belgian Film Press Union ( UPCB ). In 2006, he
started his career as a journalist for the weekly Télé Moustique, where he still works.
Often member of the jury at festivals, he specialises in fiction film ( with more than
300 location visits and a thousand interviews to his credit ) and is an independent
collaborator for different media ( Be TV, La Tribune de Bruxelles, Le Soir, Cinergie… ).",,,,,,,,,,,,,,,,,
2012,guest,jury,,European Méliès Competition ,"Mattyas, Veress",,BELGIUM,,"As a film editor, Matyas Veress started his career in 1993 with the romantic
comedy Just Friends, starring Ryan Reynolds. He worked on features and short
films as La vie sexuelle des belges 1950-1978 ( 1994, Jan Bucquoy ), Erè mèla
mèla ( 2001, Daniel Wiroth ) which won the Best Short Film Award at the Berlin
International Film Festival, and Trouble ( 2005, Harry Cleven ), winner of several
awards, including the Grand Prize of European Fantasy Film at the Sitges Film
Festival. Recently, Matyas Veress received the Best Editing award at Les Magritte
du cinema 2011, for Jaco Van Dormael’s Mr Nobody.",,,,,,,,,,,,,,,,,
2012,guest,jury,,European Méliès Competition ,"Serge, Dero",,BELGIUM,,"Serge Dero was born in 1966 in Brussels. For twenty years, he worked as
an IT sales executive, after which he founded XpandIT in 2005. When you keep
in mind that Dero is a diehard Bifff fan and that he met the future mother of his
kids at our festival, it’s only logical that he became a festival sponsor in 2007.
Serge is responsible for all our IT infrastructure and its associated services
( telephony, servers, firewalls, webcasts, wifi… ). He’s also a host for the radio
show Metalfactory and serves as a jury member at Concours Circuit.",,,,,,,,,,,,,,,,,
2012,guest,jury,,European Méliès Competition ,"Kenan, Gorgun",,BELGIUM,,"Kenan Gorgun published his first book, L’enfer est à nous, with Quadrature
Publishing and is awarded Belgian Best Short Stories Collection Writer in 2006.
This debut is followed by Mémoires d’un cendrier sale ( poems – Maelstrom Ed. ),
L’Ogre c‘est mon enfant and Alcool de Larmes ( Ed. Luce Wilquin ). Fosse Commune
is published at Fayard ( finalist of the Prix Rossel 2007 ). His latest novel, Patriot Act,
was published in the summer of 2009 by First Ed. For the theatre he wrote Extrait
d’ordinaire, which was staged 40 times in 2008 at the Brussels Théâtre de Poche.
As a screen writer, Kenan collaborated on 9 mm by Taylan Barman. Manchild, a
script he developed with Elie Chouraqui, is about the encounter
between an American prospector and an African soldier child.
They’re now looking in the States for financing and actors.
Kenan has started writing Sylvia, the script for Taylan
Barman’s next film. He has also just finished his first
film, Yadel, a family drama mixed with a ghost story.",,,,,,,,,,,,,,,,,
2012,guest,jury,,Belgian Short Film Competition,"Bénédicte, Bourgois",,BELGIUM,,,,,,,,,,,,,,,,,,,
2012,guest,jury,,Belgian Short Film Competition,"Guy, Trifin",,BELGIUM,,,,,,,,,,,,,,,,,,,
2012,guest,jury,,Belgian Short Film Competition,"Christian, Bontinckx",,BELGIUM,,,,,,,,,,,,,,,,,,,
2012,guest,jury,,Belgian Short Film Competition,"Michel, Devillers",,BELGIUM,,,,,,,,,,,,,,,,,,,
2012,guest,jury,,Belgian Short Film Competition,"Benjamin, D'Aoust",,BELGIUM,,"After studying journalism as well as analysis & scriptwriting at the university, Benjamin d’Aoust directs Mur, his first short feature, in 2006. The film tours around the world and wins several awards. In 2010, he shoots a second short, Point de fuite. He’s also active as film critic, an editor, an assistant director and a script doctor. He is currently shooting his first feature documentary, La nuit qu’on suppose, and is co-writer for the comic-strip Shrimp.",,,,,,,,,,,,,,,,,
2012,guest,jury,,European Short Film Competition,"Alain, Galand ""Tom Pouce""",,,,,,,,,,,,,,,,,,,,,
2012,guest,jury,,European Short Film Competition,"Gökhan, Kulak",,,,,,,,,,,,,,,,,,,,,
2012,guest,jury,,European Short Film Competition,"Nathalie, Lebel",,,,,,,,,,,,,,,,,,,,,
2012,guest,jury,,European Short Film Competition,"Fabian, Louis",,,,"Louis Fabian is chef editor of educational journals published by Averbode. Journalist by training, but also a huge movie buff. For over 10 years now, he has been one of the pillars of the Brussels’ Short Film Festival selection committee, for both national and international competitions. He is also responsible for school screenings at the same festival.",,,,,,,,,,,,,,,,,
2012,guest,jury,,European Short Film Competition,"Gilles, Réunis",,,,,,,,,,,,,,,,,,,,,
2012,guest,movie,,SENNENTUNTSCHI : CURSE OF THE ALPS,"Michael, Sauter",,SWITZERLAND,,"Born in 1973, Michel Sauter is one of the greatest film talents that Switzerland has ever
known. Born into a fundamentalist anthroposophical family, he was not allowed to listen
to music or go to the movies. In 1991, when his parents died, he got into the hardcore
scene, playing in several bands ( MLOP, The Motordykes ... ) and recording the first Swiss
grunge album. He then abandoned his studies to devote himself to writing screenplays
such as the box office smash Ready, Steady, Charlie ( 2003 ) and Grouding ( 2006 ). His
latest achievements were the scripts for the macabre Sennentuntschi and the bloody
comedy Miss Swiss Massacre, both directed by Michael Steiner. He recently participated
to the jury of the NIFFF, alongside George Romero and John Landis.",,,,,,,,,,Writer,,https://www.imdb.com/name/nm1337900/?ref_=nv_sr_srsg_0,,,,,
2012,guest,movie,,SORCERER AND THE WHITESNAKE,"Tony, Ching",,Hong Kong,,"Hong Kong director, actor and choreographer Tony Ching learns martial arts at the Peking
Opera. In 1982 he made his directing debut with Duel to the Death” a feature film that
reinvents the Chinese sword move. With A Chinese Ghost Story, he does the same for the
ghost movie. During the 2000s, he assures the choreography for the international hits Shaolin
Soccer by Stephen Chow and Hero, The House of Flying Daggers and Curse of the Golden
flower by Zhang Yimou. This Hong Kong legend will present his latest film at the Bifff : The
Sorcerer and the White Snake, starring Jet Li.",,,,,,,,,,Director,,https://www.imdb.com/name/nm0155642/?ref_=tt_ov_dr,,,,,
2012,guest,movie,,ZOMBIE 108,"Joe, Chien",,TAIWAN,,,,,,,,,,,,Director,,,,,,,
2012,guest,movie,,THE BUTTERFLY ROOM,"Jonathan, Zarantonello",,Italy,,"Italian director Jonathan Zarantonello is quite a busy bee. So far he has given us the high
school splatterfest Medley ( a Troma production ), Uncut, a bizarre romantic crime story
told in a single shot from the bottom of a bed, and Spoof, a series of 100 film spoofs, still
in post production. He has written two books and created the TV show Find me a man
( Fox Life ). Zarantonello lives and works in Los Angeles, where he is constantly waiting
for an alien invasion or the big earthquake. He will present his latest film, The Butterfly
Room, together with his leading lady, British horror icon Barbara Steele.",,,,,,,,,,Director,,https://www.imdb.com/name/nm0953367/?ref_=nv_sr_srsg_0,,,,,
2012,guest,movie,,THE BUTTERFLY ROOM,"Barbara, Steele",,USA,,"""British actress Barbara Steele, the Iconic
Scream Queen from the sixties, was the most
beautiful actress in Italian cult classics such as
Mario Bava’s Black Sunday, Fellini’s 8½, Mario
Caiano’s Faceless Monster and Massimo
Pupillo’s Terror Creatures from the Grave.
She started strong in 1960 by breaking her
contract with Fox for Don Siegel’s Flaming
Star, in which she would have starred besides
Elvis Presley. She amply compensated that by
starring in more than 35 films in the sixties.
But it doesn’t stop there. She also blew
everybody away in Roger Corman’s The Pit
and the Pendulum, David Cronenberg’s They
Came From Within and Joe Dante’s Piranha.
In the eighties, she starred in two TV-series
with Robert Mitchum: The Winds of War and War and Remembrance. Even at the
age of 74, Barbara Steele cannot stop acting. We’ll be able to see her at the BIFFF in
Jonathan Zarantonello’s The Butterfly Room. We are honored to make this timeless
genre icon a Knight in the Order of the Raven.""",,,,,,,,,,Actress,,,,,,,
2012,guest,movie,,TRUTH OR DARE,"Robert, Heath",,UK,,"Robert Heath is one of the UK’s rising star directors and has shown a real talent for
bringing outstanding performances from his actors in compelling films. Cereal Killer was
his first short film as a writer-director in 2000, selected at the Festivals of Edinburgh,
London, Berlin and Brest where it won the Prix Du Canal+ for Best European Film. In
2004 Heath directed his first feature film Out on a Limb, which won Best Comedy at the
Wine Country Film Festival. Heath’s most recent feature film before Truth or Dare is the
critically-acclaimed Sus ( 2010 ).",,,,,,,,,,Director,,https://www.imdb.com/name/nm1042372/?ref_=nv_sr_srsg_3,,,,,
2012,guest,movie,,TRUTH OR DARE,"David, Oakes",,UK,,"David Oakes is a British actor born in Hampshire. He studied English Literature and
Drama at Manchester University and then trained at the Bristol Old Vic Theatre School.
He started his career on stage at the renowned Shakespeare’s Globe Theatre, performing
in Love’s Labour’s Lost alongside Gemma Arterton. His television debut was in the 2008
BBC serie Bonekicker, but he is best known for his role as William Hamleigh in the TV
series The Pillars of the Earth. Most recently, he played Juan Borgia in the Showtime TV
series The Borgias, directed by Neil Jordan. Besides his work for TV and cinema, David
Oakes remains active on stage. He’ll present his latest film to us, Truth or Dare, alongside
director Robert Heath.",,,,,,,,,,Actor,,https://www.imdb.com/name/nm2845631/?ref_=nv_sr_srsg_0,,,,,
2012,guest,movie,,TRUTH OR DARE,"Rupert, Jermyn",,UK,,,,,,,,,,,,Producer,,https://www.imdb.com/name/nm2918599/?ref_=nv_sr_srsg_0,,,,,
2012,guest,movie,,THE ROAD,"Yam, Laranas",,PHILIPPINES,,"Philippine director and scriptwriter Yam Laranas studied at the Manila Mowelfund Film
Institute, where some of his mentors were Cannes Golden Palm winner Raymond Red,
German filmmaker Thomas Mauch and experimental filmmaker Christoph Janetzko.
Besides his feature film work, Laranas is also a renowned commercial director and has won
many awards for his publicity spots. His supernatural drama Sigaw (The Echo) won our 7th
Orbit Award in 2006. This recognition helped him get to the States where he directed an
even better remake of the original, The Echo, which was shown at the Bifff in 2009. After
the werewolf horror of Patient X (2009), Yam Laranas finally makes it to Brussels to present
his latest film, the subtle and multi-layer ghost horror The Road.",,,,,,,,,,Director,,https://www.imdb.com/name/nm0487990/?ref_=nv_sr_srsg_0,,,,,
2012,guest,movie,,AS LUCK WOULD HAVE IT,"Alex, de la Iglesia",,SPAIN  ,,"Alex de la Iglesia is without a doubt the most prominent Spanish genre cinema director.
And that started in the nineties with his long feature debut Accion Mutante ( closing film
Bifff 1993 ), a delirious mix of black comedy, science-fiction and gore. This is the start of
a successful and versatile international career, with as highlights The Day Of The Beast
( Golden Raven Bifff 1996 ), Perdita Durango ( Bifff 1998 ), Commonwealth ( Bifff 2001 ),
Ferpect Crime ( Bifff 2005 ) and The Oxford Murders ( Bifff 2008 ). Last year Alex opened
the festival with A Sad Trumpet Ballad. He returns this year with his latest film As Luck
Would Have It, starring the seductive Salma Hayek.",,,,,,,,,,Director,,https://www.imdb.com/name/nm0407067/?ref_=nv_sr_srsg_0,,,,,
2012,guest,movie,,AS LUCK WOULD HAVE IT,"Carolina, Bang",,SPAIN  ,,"Carolina Bang is a young Spanish actress who started her career on the TV screen and in
the theater, where she could be seen in the 2005 adaptation of Woody Allen’s Bullets Over
Broadway. We saw her shine on the big screen for the first time in 2011, when she played
the female lead in Alex de la Iglesia’s A Sad Trumpet Ballad, the opening film of last year’s
Bifff. She’s back in Brussels with Alex to present their latest film As Luck Would Have It.",,,,,,,,,,Actress,,https://www.imdb.com/name/nm3016653/?ref_=nv_sr_srsg_0,,,,,
2012,guest,movie,,AS LUCK WOULD HAVE IT,"Franck, Ribière",,France,,,,,,,,,,,,Producer,,,,,,,
2012,guest,movie,,JULIAX 3D,"Philip, Pettiette",,USA,,"P.J. Petiette is a graduate of NYU Film School. His first project with his company General
Productions is John Boorman’s The General, based on the European best-seller that
Pettiette developed in collaboration with a journalist from the Irish Sunday world. This film,
which tells the story of the Irish crime boss Martin Cahill, wins the Best Director award at
the 1998 Cannes Film Festival. Another project of General Productions is If I Die Before I
Wake..., a gritty thriller about a family terrorized by intruders in their vacation home. He
wrote and produced Jennifer’s Shadow, which could be seen at the Bifff in 2005. Seven
years later, P.J. comes to Brussels to present his serial killers extravaganza Julia X 3D.",,,,,,,,,,Director,,https://www.imdb.com/name/nm0678646/?ref_=nv_sr_srsg_0,,,,,
2012,guest,movie,,JULIAX 3D,"Claudie, Viguerie",,USA,,,,,,,,,,,,Producer,,https://www.imdb.com/name/nm1909130/?ref_=nv_sr_srsg_0,,,,,
2012,guest,movie,,JULIAX 3D,"Courtney, Rawls",,USA,,,,,,,,,,,,Producer,,https://www.imdb.com/name/nm3706469/?ref_=nv_sr_srsg_0,,,,,
2012,guest,movie,,CARRE BLANC,"Julie, Gayet",,France,,"Versatile actress Julie Gayet has already played in more than 79 movies. In 1996 she was
awarded with the Romy Schneider Award for her part as a junkie prostitute in Select Hotel.
In 2007, she founded her own production company, Rouge International, which ambitious
projects on its slate such as Fix Me and Huit fois debout. In 2010, she starred in the comedy
Pièce montée, the thriller Sans laisser de traces with Benoit Magimel, and in Jean-Baptiste
Leonetti’s Carré blanc, which she’ll present at the BIFFF. In 2011, Julie Gayet was part of the
Cinéfondation jury, presided by Michel Gondry, at the 64th Cannes’ Festival.",,,,,,,,,,Actress,,https://www.imdb.com/name/nm0310865/?ref_=nv_sr_srsg_0,,,,,
2012,guest,movie,,FATHER'S DAY,"Jeremy, Gillepsie",,USA,,"Together with Adam Brooks, professional graphic designer Jeremy Gillespie founds the
Canadian film production company Astron-6. They’re rapidly joined by Matt Kennedy,
Conor Sweeney and Steven Kostanski and together they make low budgets films inspired
by the 80’s. Their films are known for playing with the expectations of the audience and
often combine horror with comedy. Gillespie was assistant art director on 388 Arletta
Avenue ( 2011 ) and on Len Wiseman’s remake of Total Recall ( 2012 ). Father’s Day, the
latest film of the collective, premiered at the Toronto After Dark Festival and got away
with the Audience Award!",,,,,,,,,,Director,,https://www.imdb.com/name/nm2860882/?ref_=nv_sr_srsg_0,,,,,
2012,guest,movie,,FATHER'S DAY,"Lloyd, Kaufman",,USA,,,,,,,,,,,,Producer,,,,,,,
2012,guest,movie,,GAME OF WEREWOLVES,"Juan, Martinez Moreno",,SPAIN  ,,,,,,,,,,,,Director,,https://www.imdb.com/name/nm0554890/?ref_=nv_sr_srsg_0,,,,,
2012,guest,movie,,DEADBALL,"Yudai, Yamaguchi",,JAPAN,,,,,,,,,,,,Director,,,,,,,
2012,guest,movie,,LETTERS TO ANGEL,"Sulev, Keedus",,ESTONIA,,"Estonian director Sulev Keedus graduated from the Tallinn Pedagogical Institute in 1979
as a stage director. In 1989 he also completed a two year course for screenwriters and
film directors in Moscow. Keedus has directed 11 documentaries and 4 feature films. His
feature film debut was A Single Sunday ( 1990 ). His next films Georgica and Somnambuul
won many awards at different festivals. He will be presenting his latest film Letters to
Angel at the BIFFF, the Estonian entry to this year’s Oscars.",,,,,,,,,,Director,,https://www.imdb.com/name/nm0444366/?ref_=nv_sr_srsg_0,,,,,
2012,guest,movie,,KILLER JOE,"William, Friedkin",,USA,,"""After seeing Orson Welles’ Citizen Kane, William Friedkin decided he wanted to be a film director.
His career took off in spectacular fashion with two legendary classics : The French Connection
( five Oscars including Best Director in 1972 ) and The Exorcist ( two Oscars and four Golden
Globes including Best Film and Best Director in 1974 ). He’s considered as one of the first “New
Hollywood” directors, a group of iconoclasts, among whom Francis Ford Coppola and Peter
Bogdanovich, who will influence American cinema for decades to come. After having directed
Gene Hackman in The French Connection, Max Von Sydow in The Exorcist, Al Pacino in Cruising,
William Petersen in To Live and Die in L.A., Nick Nolte in Blue Chips, Roy Scheider in Sorcerer,
Samuel L. Jackson in Rules of Engagement and Tommy Lee Jones in The Hunted, William Friedkin
honours us with his presence and with his latest film, Killer Joe.""",,,,,,,,,,Director,,,,,,,
