edition,type,subtype,winner,title,director,year,country,premiere,competition,casting,distributor,producer,screenplay,soundtrack,subtitles,audio,length,genre,Fonction Guest,IMDB,Lien IMDB,original_title,URL Poster,text_fr,text_nl,text_en
2014,movie ,International Thriller Competition,,SHIELD OF STRAW,Takashi Miike,2013,JAPAN,BELGIAN,International Thriller Competition,"Takao Osawa, Nanako Matsushima, Gorô Kishitani",,,,,,,117',Thriller ,,OK,"https:,,www.imdb.com,title,tt2347144,?ref_=nv_sr_srsg_0",,,,,"“Kill Kunihide Kiyomaru, and I will pay you 1 billion
Yen.” This is the ad published in all main Japanese
newspapers. By placing the ad, multi-billionaire Ninagawa puts
an irresistible price on the head of the man he believes to be
his 7 year old granddaughter’s rapist and killer. Realizing he has
become a target for millions of people, Kiyomaru turns himself
in at the Fukuoka Police Station. Four officers are dispatched to
bring Kiyomaru back to Tokyo. They know they are risking their
lives, as anyone on the 1200 km journey could be a potential
assassin. Will they get the monster to Tokyo to face his trial or
will justice of a different nature prevail ?
Shield of Straw could rightly be called a hardcore version of
SWAT. This adaptation of a novel by Kazuhiro Kiuchi ( creator of
the Bee Bop High School manga ) is Takashi Miike’s first feature
that made its way to the Official Competition in Cannes. Shield
of Straw is definitely more mainstream than The Audition or
Ichi the Killer, but remains nonetheless an exciting thriller about
vengeance and moral dilemmas that will give you no rest. Fasten
your seatbelt! Takashi Miike’s new ride is definitely a blast."
2014,movie ,7th Orbit Competition,,CRUEL & UNUSUAL,Merlin Dervisevic,2013,CANADA,EUROPEAN,7th Orbit Competition,"David Richmond-Peck, Bernadette Saquibal, Michelle Harrison",,,,,,,95',"Thriller, Science-Fiction",,OK,"https:,,www.imdb.com,title,tt2379080,?ref_=nv_sr_srsg_0",,,,,"A man and his wife die in each others arms. The husband,
Edgar, finds himself condemned to a special
place in hell, blamed for her murder; a fact he refuses to accept.
His punishment is to eternally re-live that last dreadful day.
First, he inhabits the body of Maylon’s son Gogan, and discovers
that the young boy is being bullied at school and hates his
new home. Then, Edgar inhabits the body of his brother Lance,
who witnesses how trapped Maylon feels, unable to escape the
oppression of Edgar’s idea of love and marriage. Finally, Edgar
inhabits the body of Maylon and sees how he threatens the
well-being of her son. Learning that his only escape is through
enlightenment, he enlists the help of fellow inmates and devises
a plan to end his horrific cycle. Ultimately, he comes to
understand that the opposite of innocence is not so much guilt
as it is responsibility.
Cruel & Unusual, Merlin Dervisevic’s first long feature, draws its
strength from a script that is as promising as its title suggests.
The pieces of the puzzle are slowly put together until they reveal
a mechanism that is as diabolical as it is astounding. This
modern reinterpretation of the Sisyphus myth is carried by the
performances of Michael Ecklund ( Watchmen, The Divide ) and
Michelle Harrison ( Paycheck, The Invisible )."
2014,movie ,7th Orbit Competition,,DISCOPATH,Renaud Gauthier,2013,CANADA,BELGIAN,7th Orbit Competition,"Jérémie Earp-Lavergne, Sandrine Bisson, Ivan Freud
",,,,,,,81',"Crime, Horror, Fantasy",,OK,"https:,,www.imdb.com,title,tt2677894,?ref_=nv_sr_srsg_0",,,,,"New York, 1976. Duane Lewis looses his job and drowns
his sorrows in a park. There he meets pretty girl Valerie,
who takes him to the Seventh Heaven disco to forget about
it all. But the pulsing rhythms and beats awaken something
dark in Duane that drives him to commit an act of unspeakable
violence. He has to escape New York for Montreal. Four years
later. Duana has a job as a technician in a religious school for
young girls, led with an iron hand by sister Mireille. Duane stays
away from any auditory temptation thanks to a hearing aid that
can silence any potential attack. But it’s only a matter of time
before the glitter ball in his head starts spinning again.
Saturday Night Fever meets Hannibal Lecter in Discopath, which
rhymes with psychopath, got it? The forty-somethings among
us who viciously hated the disco from their childhood years, will
finally get their revenge. Canadian director Renaud Gauthier
already gave us a tasty grindcore homage in his webseries Inspector
Bronco. With Discopath he goes into overdrive. All the
cult slashers from the 80ties are spinned on the blood drenched
turning table, thanks to the terrific sfx work of Rémy Couture."
2014,movie ,7th Orbit Competition,,HALLEY,Sebastian Hofmann,2012,MEXICO,BELGIAN,7th Orbit Competition,"Alberto Trujillo, Lourdes Trueba, Hugo Albores",,,,,,,84',"Horror, Drama",,OK,"https:,,www.imdb.com,title,tt1890417,?ref_=nv_sr_srsg_5",,,,,"As the night watchman of a fitness club in Mexico, Beto
has some issues blending into the customers. They
are all muscular with calves as big as Beto’s waist. This is kinda
normal if we know that our guard is a zombie. Every morning
he plasters his face with layers of make-up and sprays his body
with perfume to hide the petrification and the smell. And we
won’t even mention the maggots he has to remove from his
skin. But one day Beto faints in the subway and wakes up at the
mortuary. This is the last straw. He decides to quit his job. But
Silvia, his boss, won’t let him go away so easily and a strange
bond will tie these two lost souls together.
Halley, the first feature of Mexican director Sebastian Hofman, is
not an obvious crowd-pleaser, with its close shots depicting the
slow but inevitable fall of a condemned man; a star performance
by Alberto Trujillo. Hofman might dismay some viewers, but his
clinical approach slowly infuses a growing uneasiness which is
hard to shake off."
2014,movie ,7th Orbit Competition,,HEAVENLY SHIFT,Mark Bodzsar,2013,HUNGARY,BELGIAN,7th Orbit Competition,"András Ötvös, Roland Rába, Tamás Keresztes",,,,,,,100',"Comedy, Drama",,OK,"https:,,www.imdb.com,title,tt2466684,?ref_=nv_sr_srsg_0",,,,,"Half Serbian, half Hungarian Milan deserts from the
Croatian army in 1992, the second year of the Yugoslavian
civil war, and escapes to Hungary. As a former medical
student, he finds a job as a paramedic in Budapest. Milan has
two colleagues in his ambulance: Kistamas, the driver and Doctor
Fek, the chief of the paramedic crew. It’s a cold shower for
the young enthusiastic and conscientious Milan when he realizes
that his companions sometimes decide the fate of their patients.
While they are saving lifes, they also allow old people or the
mortally ill to die or even help death a hand. Milan discovers
that there’s a lucrative business side to the illegal euthanasia
events taking place in their ambulance. As he needs money to
smuggle his girlfriend out of Yugoslavia, he makes a deal with
Histamas and Fek. Milan becomes more and more involved in
their schemes until there’s no way back.
Heavenly Shift, the long feature debut of Mark Bodzsar, is an
inventive, grotesque, absurd and bloody comedy about corrupt
paramedics in the post-communist Hungary of the early nineties.
Milan’s descent into the tragicomic underworld of illegal
corpse dealers teems with weird characters and events. The
influences of Tarantino and the Coen brothers are more than
apparent in this future Hungarian cult classic!"
2014,movie ,7th Orbit Competition,,LFO ,Antonio Tublen,2013,"SWEDEN , DENMARK",BELGIAN,7th Orbit Competition,"Patrik Karlson, Izabella Jo Tschig, Per Löfberg",,,,,,,94',"Science-Fiction, Drama",,OK,"https:,,www.imdb.com,title,tt2660332,?ref_=nv_sr_srsg_0",,,,,"Robert Nord looks like a disheveled, neglected office
slave, but has a devious and quite brilliant mind. His
basement is stuffed with analog sound equipment. Robert suffers
from “sound allergy” and is looking for a remedy to cure
his affliction. He thinks he has made a breakthrough when he
discovers a frequency that could manipulate certain forms of
human behavior. He doesn’t want to try this out on himself, but
his new neighbors, the attractive Linn and her husband Simon,
might make some good guinea pigs. One evening he invites
them over. After a bit of chit chat, he excuses himself and goes
down to his basement. He puts on a sound dampening headphone
and launches the frequency. The results are stunning.
What if you could control other people without them realizing
it? LFO or Low Frequency Oscillation, is a true gem for our 7th
Orbit section, the discovery section of the BIFFF. The second
feature by Swedish director Antonio Tublen is a cynical masterpiece
that combines megalomaniac fantasies with dry wit
in a unique universe where everything is possible."
2014,movie ,7th Orbit Competition,,MOEBIUS,Kim Ki-duk,2013,SOUTH KOREA,BELGIAN,7th Orbit Competition,"Jae-Hyun Cho, Yeong-ju Seo, Na-ra Lee",,,,,,,89',"Crime, Thriller",,OK,"https:,,www.imdb.com,title,tt2942522,?ref_=nv_sr_srsg_0",,,,,"A woman catches her husband cheating on her. She
furiously grabs a knife, get into the bed and tries to
castrate him. The man wakes up just in time and manages to
hold her off. With undiminished rage, she goes into the room
of their teenage son and cuts off his penis. She then leaves the
house, without a trace of guilt or sorrow on her face.
And this is just the beginning of the latest masterpiece by Korean
iconoclast Ki-duk Kim. We don’t want to reveal more, just that
the worst hasn’t even started yet. This is clearly not the Ki-duk
Kim of Spring, Summer, Fall, Winter... and Spring and Breath.
Moebius falls into the category of The Isle ( Golden Raven 1999 )
and Pieta ( BIFFF 2013 ), but even more cruel and extreme. This
film hits you like a hammer to the head and plays like a mix
between A Serbian Film and a Greek tragedy. Never before has
the theme of sexual violence been depicted in such a raw and
visceral way. That not a word is spoken during the entire film
further strengthens the impact of what the protagonists inflict
upon each other. Moebius is definitely not a film for sensitive
souls, but those who dare will experience one of the most
memorable viewing experiences of the year."
2014,movie ,7th Orbit Competition,,THE OUTING,Mathieu Seiler,2012,"GERMANY , SWITZERLAND",BELGIAN,7th Orbit Competition,"Maike Jüttendonk, Sabine Krause, Alina Sophia Wiegert",,,,,,,91',Mystery,,OK,"https:,,www.imdb.com,title,tt2290263,?ref_=fn_tt_tt_5",,,,,"Natalie, her husband Maxim, her daughter Flora and
her sister Stella drive out of the big city for a picnic in
the “wilderness”. On the way, Flora keeps talking about all the
disappearances in the woods she’s heard about on the radio, but
nobody pays much attention. After a while they find the perfect
picnic spot. Someone has even left a carton of fruit juice. After
the meal, they all take a nap. The wake up is a very unpleasant
experience. The two women and the girl find themselves in
different places with torn clothes and bleeding wounds. There’s
not a trace of Maxim to be found. After they have wandered
for a while, they find a house with the stove still burning. Bit
there’s nobody home.
The Outing, by Swiss director Mathieu Seiler, is a grim and dark
fairytale for adults, the kind of film that shreds the borders
between dream and reality, where a sinister atmosphere constantly
lurks beneath the surface. Seiler brings many influences
to The Outing, ranging from the Brothers Grimm to slasher and
Giallo. This is the kind of fairy tale that will keep your eyes open
till dawn because you’ll be too afraid to close them."
2014,movie ,7th Orbit Competition,,OXV : THE MANUAL,Darren Paul Fisher,2013,"UK , AUSTRALIA",BELGIAN,7th Orbit Competition,"Daniel Fraser, Eleanor Wyld, Owen Pugh",,,,,,,105',"Mystery, Science-Fiction, Romance",,OK,"https:,,www.imdb.com,title,tt2414766,?ref_=fn_al_tt_1",,,,,"In a world that is not quite here and not quite now, a
young boy called Isaac Newton and a girl called Marie
Curie meet. However, this simple fact should not be possible. In
this world human frequency has been discovered. If you are high
frequency, you are born lucky. You’ll have natural “timing” and
you’ll always be in the right place at the right time. But if you are
low frequency, every natural law will conspire against you. Marie
is super-high frequency, Isaac is ultra-low. Nature should ensure
that they never cross paths. Yet they do. Every year they get to
spend exactly one minute together before nature dramatically
intervenes. Over the years it becomes an obsession for Zak to
change his frequency and be with Marie. What he discovers may
allow him to realize his dream, but will change everything we
know about ourselves and our destinies ; forever.
OXV The Manual gives you lots to think about: philosophy, determinism,
physics, free will and the laws of time and nature.
But it is most of all an incredibly intelligent piece of scifi. Director
Darren Paul Fisher transforms a philosophical and scientific love
story into an allegory about social class and mass manipulation.
After the premiere at Fantasia Montréal, some people called it
the best science-fiction film of the millennium. There are still
a few years to go before the next one, but for now we wholeheartedly
agree."
2014,movie ,7th Orbit Competition,,PATCH TOWN,Craig Goodwill,2013,CANADA,EUROPEAN,7th Orbit Competition,"Zoie Palmer, Julian Richings, Rob Ramsay",,,,,,,85',"Comedy, Fantasy, Adventure",,OK,"https:,,www.imdb.com,title,tt2189418,?ref_=fn_al_tt_1",,,,,"Jon is an abandoned toy who has lived a sad life as
an oppressed worker at a factory where hundreds
of cabbage babies are born. Work on the assembly line is a
thankless task of shucking, picking, and processing new-borns
to go out into the world and to their new adoptive mothers. Each
new birth gradually takes its toll on Jon and he slips deeper into
sadness, lamenting the days when life was good and he was
loved. Yuri, the evil child catcher who rules over Patch Town
and the factory, discovers the baby that Jon and his wife, Mary,
have stolen, which forces Jon to make the decision to escape the
authoritarian city and find a safe home for his family. Jon and
his family manage to escape with the help of his new friend, Sly,
who helps him find work in the big city as a seasonal holiday
worker. With Sly’s advice on the dos and don’ts of surviving in
the human world, Jon builds a safe place for his family but it isn’t
enough. He wants to find his adoptive mother who abandoned
him so long ago.
With this long version of his eponymous awarded short feature
from 2011, young Canadian director Craig Goodwill gives visionaries
like Terry Gilliam and Jean-Pierre Jeunet a run for their
money. The former production assistant of Good Will Hunting
transforms Lyudmilla Petrushevskaya’s classic Russian tale The
Cabbage Patch Mother into a poetic uppercut of rarely seen
originality and creativity."
2014,movie ,7th Orbit Competition,,PUTI,Miguel Alcazaren,2013,PHILIPPINES,INTERNATIONAL,7th Orbit Competition,"Ian Veneracion, Jasmine Curtis-Smith, Lauren Young",,,,,,,111',"Horror, Mystery, Drama",,OK,"https:,,www.imdb.com,title,tt3204948,?ref_=nv_sr_srsg_6",,,,,"Art forger Amir lives like a recluse with his young son
Jaime. His beloved wife died a few years ago and the
rest of his family lives abroad. His social interactions are limited
to his young assistant Nika and his dealer, who sells his forged
paintings to rich buyers. There’s not a lot of joy in his life. Then
Amir and his son are involved in a car crash. He wakes up in hospital
and discovers that he’s color blind. His son lies in a coma. To
pay for Jaime’s treatment, Amir has to continue working, which
is anything but easy with his condition. The blind woman whose
eyes were gouged out by her mother when she was a child and
whom he painted just before the accident, starts appearing
everywhere. Birds fly out of his canvasses, his paintings show
things that weren’t there before and in the hospital a mysterious
nurse keeps reading the same story to Jaime.
Art and horror form an intriguing puzzle in Puti by Filippino
director Miguel Alcazaren. He creates a disturbing, disorienting
atmosphere where logic no longer counts and imagination runs
wild. What’s the secret behind this expressionistic nightmare?
Answer at the BIFFF!"
2014,movie ,7th Orbit Competition,,TOMBVILLE,Nikolas List,2014,BELGIUM,BELGIAN,7th Orbit Competition,"Axel De Vreese, Eric Godon, Pierre Lognay",,,,,,,67',Horror,,OK,"https:,,www.imdb.com,title,tt3569786,?ref_=nv_sr_srsg_0",,,,,"David was raised by his prostitute mother to hate his
own kind. He dreams of a life that doesn’t consist of
his mother’s fake orgasms and endless tirades against the male
gender. One day he wakes up in the middle of nowhere, with
a gaping hole in his memory. A pitch dark night surrounds a
few ramshackle houses with everything bathing in a heavy,
menacing atmosphere. Nightmarish memory shards flay around
in David’s mind. There’s no doubt about it, he’s arrived in Tombvile,
the ultimate hamlet of terror where no one returns from.
And that is soon confirmed by his painful first meeting with
the inhabitants. David will quickly realize that this bunch of
perverted sadists is part of a Gordian knot he has to untie at all
costs if he wants to save his soul.
After getting noticed in 2006 with his first short feature Angel,
Nikolas List successfully transfers to the long feature division.
Tombville plays like a feverish dream in which David Lynch’s
universe is transplanted to a contemporary Western. This attack
on the senses, shot partly in the caves of Tour & Taxis, BIFFF’s
old stomping ground, benefits from a few faces not unfamiliar
to the festival audience: Pierre Lognay (Vampires, Comme tout
le monde) and Eric Godon (In Bruges, The Pack)."
2014,movie ,7th Orbit Competition,,WRONG COPS,Quentin Dupieux,2013,"USA , RUSSIA , FRANCE",BELGIAN,7th Orbit Competition,"Mark Burnham, Eric Judor, Agnes Bruckner",,,,,,,83',"Comedy, Crime",,OK,"https:,,www.imdb.com,title,tt2166616,?ref_=nv_sr_srsg_0",,,,,"In the near future, crime is only a vague memory in
Los Angeles. The cops don’t know what to do with
their time. They’re so bored; they’re willing to do the craziest
things to stay occupied. One of them is Duke, who delivers all
kinds of services against payment in cash or blowjobs. He also
deals marihuana on the side, with his clients getting their stuff
stashed in the stomachs of dead rats. Duke considers himself to
be a true music lover. One day he takes a teenager to his apartment
to educate him in what a good tune is all about. Dancing in
his underwear, he sings at the top of his lungs. The kid doesn’t
really appreciate Duke’s teachings and runs away. He fires a
few shots at the fleeing ungrateful, but manages to hit one
of his neighbors. A murder in L.A.! Nobody knows what to do.
After the monosyllabic gems Steak, Rubber and Wrong, Quentin
Dupieux dares to deliver a film with two words in the title! Just
like its illustrious predecessors, Wrong Cops is an absurd and
surrealist mosaic that clearly carries the mark of its enigmatic
and willful maker. Dupieux’s politically incorrect films always
go against the stream, perverting and turning upside down the
pillars of our society. With a remarkable guest appearance of
Marilyn Manson as a semi-autistic adolescent."
2014,movie ,7th Orbit Competition,,YELLOW,Nick Cassavetes,2012,USA  ,BELGIAN,European Méliès Competition,"Lucy Punch, Riley Keough, Sienna Miller",,,,,,,105',Drama ,,OK,"https:,,www.imdb.com,title,tt1588898,?ref_=fn_tt_tt_1",,,,,"Mary Holmes has a great life. She’s young, beautiful
and lives in Los Angeles. She has a good job teaching
at a private elementary school and four beautiful children. But
things aren’t always what they seem. Mary has problems. She
has a difficult time feeling things, and the fact that she eats
twenty Vicodin a day doesn’t help. She sees a psychiatrist for
the disconnected daydreams she keeps having, and her younger
sister with Tourette syndrome hates her. When Mary loses her
job for sleeping with one of the fathers of her pupils, she decides
to go home. And that’s when the fun really starts. The
dreams which seemed so random now start to take shape as
we understand where she came from. From young and in love,
drug dealing on the road, to her father’s slow painful dead,
from questions of love and incest to her older sister’s descent
to insanity, the secret that destroyed her entire family reveals
itself on her journey back home.
The films of Nick Cassavetes ( John Q, Alpha Dog ) do not seem to
have much in common with the intimate drama’s of his legendary
father. He co-wrote the script for Yellow together with his
wife Heather Wahlquist, who also plays the part of Mary. Yellow
is a feast for the eyes and the mind, with its sumptuous visuals,
the politically incorrect themes, many memorable scenes and
a stunning cast: Sienna Miller ( Stardust, G.I. Joe ), David Morse
( The Green Mile, Contact ), his mother Gena Rowlands, Ray Liotta
( Goodfellas ) and Melanie Griffith, who can also be seen at the
BIFFF in Dark Tourist."
2014,movie ,European Méliès Competition,,AURA,Zsolt Bernath,2014,HUNGARY,INTERNATIONAL,European Méliès Competition,"Szénási Bálint, Szénási Kristóf, Kapócs Panka
",,,,,,,80',"Science-Fiction, Drama",,OK,"https:,,www.imdb.com,title,tt3251284,?ref_=fn_tt_tt_15",,,,,"Four kids, Tokyo, Pete, Adam and Esther wake up
in their stranded car in an abandoned field only to
find that the Sun did not rise. What’s more, they discover that
a strange, 30 foot diameter, almost invisible, bionic “aura” is
covering their surroundings. It reacts to their touch, and soon
mysterious things start to happen. Our heroes find seashells in
and around their car, the smell and the sound of the ocean fill
the air, and long lost memories start to materialize in front of
their very eyes. Rainfall from nowhere, unexplainable noises,
mysterious messages and clues hidden all around force them to
go along on an investigation that reveals much more than they
would have ever hoped for: they unearth long forgotten secrets
rooted deep in the very beginning of mankind’s existence. And
these secrets have direct consequences not only on their lives;
but also on the survival of our planet as we know it.
Hungarian director Zsolt Bernath must have developed a taste
for the BIFFF. After last year’s In The Name of Sherlock Holmes,
he’s already back with Aura, a science-fiction film that reunites
the cast of Sherlock. With its mixture of metaphysics, tension
and adventures worthy of the Fantastic Four, Aura is a terrific
introduction to fantastic film for adolescents."
2014,movie ,European Méliès Competition,,AUX YEUX DES VIVANTS,"Alexandre Bustillo, Julien Maury",2014,FRANCE,EUROPEAN,European Méliès Competition,"Anne Marivin, Théo Fernandez, Francis Renaud",,,,,,,90',"Horror, Thriller",,OK,"https:,,www.imdb.com,title,tt2473750,?ref_=nv_sr_srsg_0",,,,,"It’s a warm and dry summer. Dan, Tom and Victor,
three inseparable adolescents, take advantage of the
last day of school to wander in the countryside. They jump with
joy when they discover an abandoned old film studio, whose
many corridors and halls are just begging to be explored. What
they don’t know is that their new playing ground serves as a
refuge for Isaac and Klarence Shooter, a man and his strange son
who are determined to stop the trio from setting their eyes on
their dark secrets. Night falls. Our friends are home again. But
they soon realize that something has followed them. This night
will be the longest of their young lives. And it very doubtful
they’ll ever see the light of day again.
After lnside (BIFFF 2008) and Livid, Alexandre Bustillo and Julien
Maury are back with their third long feature, an enticing blend
of Stand By Me, The Hills Have Eyes and Insidious. Aux yeux des
vivants bathes in a nostalgic atmosphere of thrills and shivers
that is guaranteed to stick to your ribs. Starring Béatrice Dalle
(Betty Blue, Inside), Anne Marivin (Welcome to the Boondocks)
and Nicolas Giraud (Taken, The Extraordinary Adventures of
Adèle Blanc-Sec). Next on the agenda for the duo: directing a
segment of The ABC’s of Death 2!"
