edition,type,subtype,winner,title,director,year,country,premiere,competition,casting,distributor,producer,screenplay,soundtrack,subtitles,audio,length,genre,Fonction Guest,IMDB,Lien IMDB,original_title,URL Poster,text_fr,text_nl,text_en
2014,short,"Belgian Short Film Competition, 10th Belgian Fantastic Film Day",,BABY SITTING STORY,Vincent Smitz,2014,BELGIUM,,Belgian Short Film Competition,"Sophie Breyer, Pauline Brisy, Vincenzo Caci",,,,,,,20',"Horror, Fantasy, Thriller",,OK,"https:,,www.imdb.com,title,tt3995180,?ref_=fn_al_tt_1",,,,,"World Premiere : Sarah and Julie go to the aunt of a friend to baby-sit. There is a
storm raging and one of them tells a scary story..."
2014,short,"Belgian Short Film Competition, 10th Belgian Fantastic Film Day",,LILITH,Maxim Stollenwerk,2013,BELGIUM,,Belgian Short Film Competition,"Pascal Maetens, Peggy Lee Cooper, Sebastien Dewaele",,,,,,,22',"Fantasy, Horror, Thriller, Romance",,OK,"https:,,www.imdb.com,title,tt3244848,?ref_=fn_tt_tt_10",,,,,"The movie takes us to the nightly backstreets of Brussels, where a young lady
wanders in search for hemoglobin to quench her thirst."
2014,short,"Belgian Short Film Competition, 10th Belgian Fantastic Film Day",,TITRE INDETERMINE,Stéphane Papet,2013,BELGIUM,,Belgian Short Film Competition,"Julie Basecqz, Serge Baudoux, Geoffrey Boissy",,,,,,,20',Surreal,,OK,"https:,,www.imdb.com,title,tt2362188,?ref_=fn_al_tt_1",,,,,"Three characters in search of a story are faced with a writer without inspiration.
They have decided not to be pushed around, but he thinks differently."
2014,short,"Belgian Short Film Competition, 10th Belgian Fantastic Film Day",,PRRREÜTE,Thierry De Coster,2013,BELGIUM,,Belgian Short Film Competition,"Steve Driesen, Stéphanie Van Vyve",,,,,,,6',"Fantasy, Comedy, Romance",,OK,"https:,,www.imdb.com,title,tt3062146,?ref_=fn_al_tt_1",,,,,"On an unknown planet far away, a courtship between two timeless
characters."
2014,short,"Belgian Short Film Competition, 10th Belgian Fantastic Film Day",,OUT OF FRAME,Monique Marnette,2013,BELGIUM,,Belgian Short Film Competition,"Daniela Bisconti, Nicole Colchat, Romain David",,,,,,,9',Fantasy ,,OK,"https:,,www.imdb.com,title,tt2919238,?ref_=fn_al_tt_3",,,,,"Every morning and every evening, Michel leaves and comes back from work
with a suitcase in his hand… One day, he’ll not return."
2014,short,"Belgian Short Film Competition, 10th Belgian Fantastic Film Day",,CLOSE-UP,"Laure Escadafals, Lora D'Addazio",2013,BELGIUM,,Belgian Short Film Competition,"Michel Hinderyckx, Mathieu Moreau, Martin Spinhayer",,,,,,,5',Animation,,OK,"https:,,www.imdb.com,title,tt8099198,?ref_=fn_tt_tt_6",,,,,"Three suspicious men are playing a game of poker in an obscure
bar. The presumptuous Larry comes to challenge them…"
2014,short,"Belgian Short Film Competition, 10th Belgian Fantastic Film Day",,INTERFERENCE,John Danvoye,2013,BELGIUM,,Belgian Short Film Competition,"Anthony Davis, Isabel Scott Plummer",,,,,,,5',"Fantasy, Drama, Comedy",,OK,"https:,,www.imdb.com,title,tt3227066,?ref_=fn_al_nm_1a",,,,,"Erin has lived her entire life alone
and cut off from the outside world. Her house is like a fortress where she
controls everything. Until one day…"
2014,short,"Belgian Short Film Competition, 10th Belgian Fantastic Film Day",,FIGURES,Miklos Keleti,2013,BELGIUM,,Belgian Short Film Competition,"Titouan Aquilina, Tristan Aquilina, Nicolas Bauduin",,,,,,,19',"Mystery, Drama",,OK,"https:,,www.imdb.com,title,tt3421414,?ref_=fn_tt_tt_3",,,,,"Hannah is 10 years and a deaf mute, but one day, she hears a sound while
walking in the park. From then on, she is convinced that the park wants to
communicate something to her !"
2014,short,"Belgian Short Film Competition, 10th Belgian Fantastic Film Day",,OCULUS by Gianni Carella,Gianni Carella,2013,BELGIUM,,Belgian Short Film Competition,"Kristien Perpête, Gemma Braeckman, Leah Thys",,,,,,,14',"Horror, Mystery",,OK,"https:,,www.imdb.com,title,tt3209680,?ref_=fn_tt_tt_2",,,,,"Mieke is being harassed by an unexplainable phenomenon. She has nightmares
and her children behave in a very strange way..."
2014,short,"Belgian Short Film Competition, 10th Belgian Fantastic Film Day",,LA CHAMBRE NOIRE,Maxime Pistorio,2013,BELGIUM,,Belgian Short Film Competition,"Mathieu Alexandre, Lisa Debauche, Patrick Descamps",,,,,,,13',"Fantasy, Comedy, Musical",,OK,"https:,,www.imdb.com,title,tt3407420,?ref_=fn_tt_tt_6",,,,,"One night in the darkroom, the young assistant of a photographer
discovers that the pictures are coming to life !"
2014,short,"Belgian Short Film Competition, 10th Belgian Fantastic Film Day",,VOISINS,Christophe Mavroudis,2014,BELGIUM,,Belgian Short Film Competition,"Guillaume Alexandre, Adonis Danieletto, Celine Delval",,,,,,,13',"Horror, Mystery, Action, Science-Fiction",,OK,"https:,,www.imdb.com,title,tt3685240,?ref_=fn_tt_tt_4",,,,,"An exiting tale, based on a text by Renato Lazzaroni : husband, wife and
neighbour… An explosive combination !"
2014,short,"Belgian Short Film Competition, 10th Belgian Fantastic Film Day",,INTUS,Gary Seghers,2013,BELGIUM,,Belgian Short Film Competition,"Margaux Colarusso, Jérémie Renier",,,,,,,13',Drama,,OK,"https:,,www.imdb.com,title,tt2848740,?ref_=fn_al_tt_1",,,,,"A man wakes up in an enclosed room. His only link with the outside, is a broken
phone !"
2014,short,"Belgian Short Film Competition, 10th Belgian Fantastic Film Day",,BOULES OF DEATH,Manuel Janssens,2013,BELGIUM,,Belgian Short Film Competition,,,,,,,,,,,,,,,,,"On the beach, Tim and his brother face a demoniac dealer who sells deadly
delicacies…"
2014,short,"Belgian Short Film Competition, 10th Belgian Fantastic Film Day",,NAÏVE,Marie Enthoven,2013,BELGIUM,,Belgian Short Film Competition,"Bénédicte Bantuelle, Maaike Neuville, Marijke Pinoy",,,,,,,11',"Thriller, Comedy",,OK,"https:,,www.imdb.com,title,tt3297132,?ref_=fn_al_tt_2",,,,,"Emma discovers that her life is a lie orchestrated by her mother. It looks as if
everyone, her lover, her friends, is being paid just to surround her."
2014,short,"Belgian Short Film Out of Competition, 10th Belgian Fantastic Film Day",,SONGS FROM THE OUTSIDE,Michael Van Ostade,2013,BELGIUM,,,"Dolores Bouckaert, Andrew James Van Ostade",,,,,,,28',,,OK,"https:,,www.imdb.com,title,tt3473524,?ref_=fn_al_tt_1",,,,,"The speakers have exploded ! … Ghosts !? … Do you believe that ! … An ode to
the Sci-Fi of the ’90ties… With blood and a fairytale like atmosphere… And also
influenced by the musical version of Jeff Wayne’s War of the Worlds…"
2014,short,"Belgian Short Film Out of Competition, 10th Belgian Fantastic Film Day",,LA COQUILLE,"Louise-Marie Colon, Siona Vidakovic",2012,BELGIUM,,,,,,,,,,13',Animation,,OK,"https:,,www.imdb.com,title,tt3335588,?ref_=fn_tt_tt_1",,,,,"One morning, Sam discovers a small shell on his back that grows day by day and
becoming ever more cumbersome, both physically and socially…"
2014,short,"Belgian Short Film Out of Competition, 10th Belgian Fantastic Film Day",,EGG,Arne Keustermans,2013,BELGIUM,,,"Herman Boets, Julian De Backer, Ronny Schuerman",,,,,,,14',"Horror, Mystery, Thriller",,OK,"https:,,www.imdb.com,title,tt2492350,?ref_=fn_tt_tt_28",,,,,"Kirsten loves to play in the woods. One day, she discovers a big egg that she
takes home and hides in the attic."
2014,short,"Belgian Short Film Out of Competition, 10th Belgian Fantastic Film Day",,STOCK EXCHANGE,Stéphane Everart,2013,BELGIUM,,,"Michel Nabokoff, Frederic Mosbeux, Bruce Ellison",,,,,,,12',"Thriller, Comedy",,OK,"https:,,www.imdb.com,title,tt3071232,?ref_=fn_al_tt_1",,,,,"Kris wants his daughter back and pays the ransom. Unfortunately, the aftersales
service of this dubious kidnapping company is a disaster"
2014,short,"Belgian Short Film Out of Competition, 10th Belgian Fantastic Film Day",,28 JOINTS LATER,Emre Olcayto,2013,BELGIUM,,,,,,,,,,,,,",",,,,,,"2 friends spend an evening smoking 28 joints. The morning after, they wake up
in the midst of the zombie apocalypse."
2014,short,"Belgian Short Film Out of Competition, 10th Belgian Fantastic Film Day",,LE PROGRAMME X.65E.S,Thierry Uyttenhoven,2013,BELGIUM,,,"Brigitte Louveaux, Bernard Yerlès, Michel Nabokoff",,,,,,,10',Drama,,OK,"https:,,www.imdb.com,title,tt2977214,?ref_=fn_al_tt_1",,,,,"65 years old Mrs Vanrusselt receives a visit from the transition officer of the
government. Together, they complete the form of program X.65E.S. Then she
realizes that she’s living the last minutes of her life !"
2014,short,"Belgian Short Film Out of Competition, 10th Belgian Fantastic Film Day",,LES VOILES DU PARTAGE,"Pierre Mousquet, Jérôme Cauwe",2013,BELGIUM,,,,,,,,,,7',,,OK,"https:,,www.imdb.com,title,tt3044326,?ref_=fn_al_tt_1",,,,,"I fled the big cities for the wastelands, where chaos rhymes with freedom.
I thirst for liberty !"
2014,movie ,Opening,,THE QUIET ONES,John Pogue,2014,"USA , UK",WORLD,,"Jared Harris, Sam Claflin, Olivia Cooke",,,,,,,98',"Horror, Thriller, Mystery",,OK,"https:,,www.imdb.com,title,tt2235779,?ref_=fn_al_tt_1",,,,,"England, the seventies. Professor Coupland, an unorthodox
but charismatic college professor, recruits
some of his students with an open mind to participate in a
unique experiment: the creation of a poltergeist. Crucial for the
success of the undertaking is Jane Harper, a seriously mentally
disturbed girl who will serve as the catalyst. Coupland hires
cameraman Brian McNeill to film the events. It goes without
saying that the experiment will seriously go off the rails. Those
who want to destroy the barriers between the living and the
dead will have to pay a heavy price.
The supernatural thriller The Quiet Ones, the feature film debut
by scriptwriter John Pogue (US Marshalls, Ghost Ship), drew
its inspiration from a true event that transpired in the 70ties
when a poltergeist went on a rampage. The film was shot in a
very creepy and atmospheric mansion in England, the perfect
setting for the first horror film by the revamped Hammer Film
Studios. Starring Jared Harris (Lincoln, Sherlock Holmes: A Game
of Shadows) as professor Coupland, newcomer Olivia Cooke as
Jane and Sam Claflin (Snow White & The Huntsman) as the man
who has to capture it all on film."
2014,movie ,Opening,,SPACE PIRATE : CAPTAIN HARLOCK,Shinji Aramaki,2013,JAPAN,BELGIAN,,"Yû Aoi, Jessica Boone, Ayano Fukuda",,,,,,,115',"Animation, Science-Fiction, Adventure",,OK,"https:,,www.imdb.com,title,tt2668134,?ref_=fn_al_tt_6",,,,,"When overpopulation made the Earth uninhabitable,
mankind decided to seek for a new home among the
stars. They searched in vain and had to return to their old planet,
only finding their way barred by the Gaia Coalition, an alien
alliance that closed off the Earth from its former inhabitants.
But one man resisted; the mysterious space pirate Captain Harlock.
This merciless but honorable revolutionary can count on
his battle cruiser Arcadia, the support of fierce warrior Kei and
the council of the alien Mimay to conquer the Earth. Ezra, the
military leader of the Alliance, orders his brother Logan to kill
Harlock. He infiltrates the crew of the Arcadia, ready to make
an end to the pirate’s life. But Logan becomes impressed by
Harlock’s crusade and turns his back on Gaia. The web of lies
spun around our planet starts to unravel. An epic battle will
decide the fate of humanity.
Finally we’ll be able to see the famous anime classic by Leiji
Matsumoto (Galaxy Express 999, Space Battleship Yamato) on
the big screen. Director Shinji Aramaki (Appleseed) had a budget
of 30 million dollars to bring this epic space opera to live in all
its glory. Not only the old, nostalgic for the series that colored
their youth, will enjoy this. Their kids will also be impressed
by this impressive piece of sci-fi animation that benefits from
such a sense of detail that even James Cameron would approve."
2014,movie ,Closing,,POLICE STORY 2013,Sheng Ding,2013,"HONG KONG , CHINA",EUROPEAN,,"Jackie Chan, Ye Liu, Tian Jing",,,,,,,110',"Action, Crime, Drama, Thriller",,OK,"https:,,www.imdb.com,title,tt2599716,?ref_=fn_al_tt_1",,,,,"Inside an enormous bar on a busy street, all the patrons
are being held hostage. Among them are policeman
Zhong Wen and his daughter Miao Miao, and several
strangers who seem to have met before. The kidnapper is the
bar owner Wu Jiang. His only demand is the release of a longterm
prisoner. What motive is worth this risk? The prisoner is
brought to the scene of the crime, but the police now face an
even greater crisis, as a cold case is re-opened. Cold is the mind
of the policeman, decisively using his wits to resolve the crisis;
his mission is to find the truth. Cold is the blood of the criminal,
calmly carrying out his evil plan for his revenge. Cold are the
hearts of uncaring people, reacquainted only to pay the ultimate
price for their selfishness; their lives. Cold are the facts that
prove to the rebellious Miao Miao through her extreme ordeal
the love between a father and a daughter.
This grim and intense reboot of the successful Police Story
franchise was directed by Sheng Ding (who already worked
with Jackie Chan in Little Big Soldier). You could describe it as
a mix between Die Hard and an Agatha Christie mystery, in
which action legend Jackie Chan not only gets the chance to
stunt but also to deliver one of the finest performances of his
impressive career."
2014,movie ,Closing,,ENEMY,Denis Villeneuve,2013,"CANADA , SPAIN",BELGIAN,,"Jake Gyllenhaal, Mélanie Laurent, Sarah Gadon",,,,,,,91',"Drama, Mystery, Thriller",,OK,"https:,,www.imdb.com,title,tt2316411,?ref_=nv_sr_srsg_0",,,,,"Adam Bell is a gloomy, disheveled history teacher
who’s not even interested in having sex with his beautiful
girlfriend Mary. When he’s watching a movie recommended
by a colleague, he discovers his double in a bit part, an actor
named Anthony Clair. For the first time since long does Adam
feel exited about something. He decides to go find Mr. Clair.
When the two identical men meet, their lives get intertwined
in a weird and irrevocable way.
This gorgeous adaptation of The Double, the 2002 novel by
Nobel Laureate José Saramago, breathes new life into the
doppelganger genre. The sweeping, surreal approach by Canadian
director Denis Villeneuve (Incendies, Prisoners) confirms
his reputation as one of the most talented contemporary
filmmakers. There’s something sinister lurking under the slick
surface of things in Enemy. The dark dreams and motives of
the protagonists slowly seep through to reality and turn the
truth into a lie. With Jake Gyllenhaal (Donnie Darko, Brokeback
Mountain) as Adam / Anthony and Mélanie Laurent (Inglorious
Basterds, Now You See Me) as Mary."
2014,movie ,International Competition,,CHEAP THRILLS,E.L. Katz,2013,USA,BELGIAN,International Competition,"Pat Healy, Ethan Embry, Sara Paxton",,,,,,,88',"Comedy, Horror, Thriller, Crime",,OK,"https:,,www.imdb.com,title,tt2389182,?ref_=nv_sr_srsg_0",,,,,"Craig is suffering. His wife is out of work, taking care of
their infant son, and they’re months behind on rent. To
make matters worse, he’s just been laid off. Not wanting to face
his wife, Craig hits up a dive bar where he runs into Vince, an old
friend from High School who now makes his money breaking
people’s arms if they don’t pay off their debts. As Craig prepares
to leave the bar, he and Vince are roped into having a round
of drinks with a very wealthy hipster couple. Colin wants to
celebrate his beautiful wife Violet’s birthday, by taking her to
the seedier side of town. In order to amuse themselves, Colin
engages them all in a series of innocuous bar bets and challenges.
Whoever can drink a shot quickest makes fifty bucks,
whoever can get a bar patron to slap them gets a hundred…
and it continues on like that, with the challenges increasing
in both money and outrageousness, because Colin and Violet
know no limits.
Cheap Thrills was one of last year’s darlings on the festival
circuit and rightly so. This deliciously sadistic comedy thriller
from debut director Evan Katz shows in all gory detail how far
we’re willing to go “for a fistful of dollars”. Just when you think
you can’t take it anymore, Katz ups the ante and leads us to
a devastating, intolerable climax. With an excellent script by
Troma writer Trent Haaga and stand out performances from
Pat Healy ( Ghost World ) and Ethan Embry ( Harold & Kumar )
as Craig and Vince and from David Koechner ( Anchorma ) and
Sara Paxton ( The Innkeepers ) as Colin and Violet."
2014,movie ,International Competition,,CONTROL,Kenneth Bi,2013,"HONG KONG , CHINA",EUROPEAN,International Competition,"Daniel Wu, Chen Yao, Leon Dai",,,,,,,90',"Crime, Mystery, Science-Fiction",,OK,"https:,,www.imdb.com,title,tt2550112,?ref_=fn_tt_tt_8",,,,,"As a devoted son, Mark makes the difficult decision
to withhold evidence in court for his employer when
told to do so. The promotion he gets, allows him to move his
aging mother to a nicer retirement home. But his action sets
off a chain of events starting with a threatening call from a
blackmailer, The Voice, who informs Mark it has emptied his
bank account but would replenish it so long as Mark follows
his instructions to the letter. The Voice then orders Mark to rob
a bank where he must enlist the assistance of Jessica, his childhood
sweetheart, by coercing her. Mark continues to be forced
to do The Voice’s bidding, including raiding a group of drug
dealers. When Mark completes his mission and tries to ambush
The Voice, it outmaneuvers him and makes off with the goods
and cash. Later, Mark finds his own money returned to his bank
account and he returns, relieved, to his everyday life. Until the
phone starts to ring gain…
The futuristic Chinese techno-thriller Control is a dazzling game
of manipulation and deceit. Director Kenneth Bi (The Drummer,
Girl$) guides us through an intrigue that becomes ever
more complicated without loosing track of things and delivers
a twist at the end which puts everything that went before into
a different light. With Daniel Wu (Tai Chi Hero, The Man With
The Iron Fists), Simon Yam (ip Man, Election, The Thieves) and
Chen Yao (Firestorm)."
2014,movie ,International Competition,,ESPECTRO by Alfonso Pineda Ulloa,Alfonso Pineda Ulloa,2013,MEXICO,EUROPEAN,International Competition,"Paz Vega, Johanna Murillo, Alfonso Herrera",,,,,,,93',"Horror, Thriller ",,OK,"https:,,www.imdb.com,title,tt2401199,?ref_=fn_al_tt_3",,,,,"Marta was a famous and successful medium, but
she did not see her own rape coming. The trauma
makes her loose her talent and renders her agoraphobic. The
face of her rapist Mario follows her everywhere and she fears
that he might start to stalk her again. The empty apartment of
a friend becomes her refuge. But soon Marta gets into trouble
with the neighbors. Especially the hysterical woman upstairs
keeps bothering her. She installs cameras in all the dead corners
of the flat to keep an eye on things. Marta’s horrified to discover
that she’s not alone. A spooky presence is haunting the apartment
and her hysterical neighbor threatens to kill her. Marta,
besieged by dead and living assailants, has to get her gift back
before Mario finds her.
You’d better cut your nails before watching Espectro if you don’t
want to risk biting off your fingers from the unbearable tension
and terror that director Alfonso Pineda Ulloa inflicts upon us.
That’s how scary this Mexican ghost thriller actually is. Luckily
there’s beauty among all the horror thanks to the performance
of the gracious Paz Vega ( Lucia y el Sexo, The Spirit ). The only
thing is that you definitely don’t want to be in her shoes."
2014,movie ,International Competition,,HORROR STORIES 2,"Min Kyu-dong, Kim Sung-ho, Kim Hui, Jung Bum-shik",2013,SOUTH KOREA,BELGIAN,International Competition,"Jin-hee Baek, Kim Ji-Won, Sung Jun",,,,,,,95',Horror ,,OK,"https:,,www.imdb.com,title,tt2961802,?ref_=fn_al_tt_1",,,,,"444: The eccentric Se-young works at an insurance
company and can communicate with the dead. Her
boss, aware of her gift, wants her help to solve three mystery
dossiers. A dark aura hangs around these cases and every time
they manage to solve one of the files, the aura grows stronger.
The Cliff: Two friends survive falling off a cliff, but find themselves
trapped on an overhanging rock. While they wait for help,
their friendship is put to the test because of a chocolate bar.
To survive, one of them has to die. The Accident: Three young
women fail their entry exam to become high school teachers.
They take a trip to the mountains to lighten up their spirits. But
they get an accident with their car. Despite their wounds, they
decide to make their way to a faint light that shines from a
nearby mountain. The Escape: Byeong-shin is a teacher trainee
who suffers serious humiliation from his pupils on his first day.
After meeting Tan-hee, a student obsessed with black magic,
he decides to try out one of her spells. He becomes trapped in
a doorway to hell.
Part One of this Korean horror anthology already delivered lots
of chills and thrills, but part two is even better. These four new
terror tales are brought to you by Beom-sik Jeong ( Epitaph ),
Sung-ho Kim ( Mirrors ), Hwi Kim ( The Neighbors, Midnight FM )
and Kyu-dong Min ( Memento Mori )."
2014,movie ,International Competition,,I'LL FOLLOW YOU DOWN,Richie Mehta,2013,CANADA,EUROPEAN,International Competition,"John Paul Ruttan, Rufus Sewell,Gillian Anderson, Haley Joel Osment",,,,,,,93',"Drama, Mystery, Science-Fiction",,OK,"https:,,www.imdb.com,title,tt2048770,?ref_=fn_al_tt_1",,,,,"Gabriel and Marika appear to have everything. He is an
Ivy League educated physicist and professor, she a contemporary
artist. Together they have found what everyone is looking
for; true love. After years of marriage, they’re still happy with
each other and completely adore their 9-year old son Erol. Until
the day Gabriel flies to Princeton for a conference and mysteriously
disappears off the face of the earth without any explanation and
without leaving any clues as to where he has gone. In the years
that follow, wondering what happened to Gabriel, and why, devastates
Marika. While Erol, now 21, follows in his father’s footsteps
and begins studying physics under his grandfather, and Gabriel’s
mentor, Sal. The family enjoys a tenuous stability, until the day
that Sal discovers some of Gabriel’s old project files and traces their
contents back to his place of disappearance. Erol initially wants to
leave the past behind him, until another tragedy propels him to
follow Gabriel’s research to its staggering conclusion, even though
it may mean saying goodbye to everything he’s come to cherish.
The best genre films are usually not those that only consist of
special effects, expensive sets or futuristic technology. They’re the
ones that use those elements to make us care about the problems,
trials and tribulations of real people. Richie Mehta’s I’ll Follow You
Down is one of those films. He uses time travel shenanigans as a
metaphor for how you deal with loss and insecurity, always wanting
to know if the grass was really greener on the other side of the
hill. And he has a terrific cast to draw us into this moving story.
Rufus Sewell ( Dark City, The Illusionist ) is Gabe, Gillian Anderson
( The X-Files, The Fall ) plays Marika and Haley Joel Osment ( the
now grown-up kid from The Sixth Sense ) is Erol."
2014,movie ,International Competition,,KILLERS,"Kimo Stamboel, Timo Tjahanto",2013,"INDONESIA , JAPAN , USA",INTERNATIONAL,International Competition,"Kazuki Kitamura, Oka Antara, Rin Takanashi",,,,,,,137',"Crime, Horror, Drama, Thriller",,OK,"https:,,www.imdb.com,title,tt2409300,?ref_=fn_al_tt_2",,,,,"Nomura Shuhei is a young, charismatic, and charming
Japanese executive based in Tokyo who has a dark
side nobody knows. He kills people and has been recording his
actions. Nomura uploads the clips on the Internet so that everybody
can see his murders. On the other side of the earth is Bayu
Aditya, an ambitious Jakarta-based journalist. His obsession to
uncover a story of a powerful and corrupt politician makes his
marriage and career fall apart. Feeling desperate, Bayu sees one
of Nomura’s videos. His horrible acts inspire Bayu to find out
Nomura’s reasons for killing and eventually lead him to follow
a dark path and become a killer himself. Bayu tries to kill in the
name of justice. He records his acts and anonymously uploads
the video on the internet, similar to Nomura’s modus operandi.
Nomura is intrigued when he sees Bayu’s video and responds.
The psychological bond between them grows and become more
complicated. Then Nomura decides to meet Bayu in person.
In 2010 we screened Macabre at the BIFFF, a stylish feast of blood
and pain directed by the Indonesian filmmakers Timo Tjahjanto
and Kimo Stamboel, aka The Mo Brothers. They’re back this year
with the impressive Killers, one of the revelations of the recent
Sundance Film Festival. It’s a dark and gruesome experience that
slowly grabs you by the throat and never releases its hold. Carefully
constructed scenes of tension and anticipation are followed
by explosions of horror and action. The Mo Brothers know their
audience through and through and play with the expectations
of genre fans. Killers is a very smart and strong genre experience
that holds a mirror to the obsession with horror and brutality
of its target audience."
